meta_config.json
[
  {
    "M": 4,
    "N": 8192,
    "K": 12288,
    "BLOCK_SIZE_M": 16,
    "BLOCK_SIZE_N": 128,
    "BLOCK_SIZE_K": 32,
    " GROUP_SIZE_M": 4,
    "num_warps": 4,
    "num_stages": 4
  },
  {
    "M": 8,
    "N": 8192,
    "K": 12288,
    "BLOCK_SIZE_M": 16,
    "BLOCK_SIZE_N": 128,
    "BLOCK_SIZE_K": 32,
    " GROUP_SIZE_M": 4,
    "num_warps": 4,
    "num_stages": 4
  },
  {
    "M": 12,
    "N": 8192,
    "K": 12288,
    "BLOCK_SIZE_M": 16,
    "BLOCK_SIZE_N": 128,
    "BLOCK_SIZE_K": 32,
    " GROUP_SIZE_M": 4,
    "num_warps": 4,
    "num_stages": 4
  },
  {
    "M": 16,
    "N": 8192,
    "K": 12288,
    "BLOCK_SIZE_M": 16,
    "BLOCK_SIZE_N": 128,
    "BLOCK_SIZE_K": 32,
    " GROUP_SIZE_M": 16,
    "num_warps": 4,
    "num_stages": 4
  },
  {
    "M": 20,
    "N": 8192,
    "K": 12288,
    "BLOCK_SIZE_M": 32,
    "BLOCK_SIZE_N": 256,
    "BLOCK_SIZE_K": 32,
    " GROUP_SIZE_M": 4,
    "num_warps": 4,
    "num_stages": 4
  },
  {
    "M": 24,
    "N": 8192,
    "K": 12288,
    "BLOCK_SIZE_M": 32,
    "BLOCK_SIZE_N": 256,
    "BLOCK_SIZE_K": 32,
    " GROUP_SIZE_M": 4,
    "num_warps": 4,
    "num_stages": 4
  },
  {
    "M": 28,
    "N": 8192,
    "K": 12288,
    "BLOCK_SIZE_M": 32,
    "BLOCK_SIZE_N": 256,
    "BLOCK_SIZE_K": 32,
    " GROUP_SIZE_M": 8,
    "num_warps": 4,
    "num_stages": 4
  },
  {
    "M": 32,
    "N": 8192,
    "K": 12288,
    "BLOCK_SIZE_M": 32,
    "BLOCK_SIZE_N": 256,
    "BLOCK_SIZE_K": 32,
    " GROUP_SIZE_M": 4,
    "num_warps": 4,
    "num_stages": 4
  },
  {
    "M": 36,
    "N": 8192,
    "K": 12288,
    "BLOCK_SIZE_M": 64,
    "BLOCK_SIZE_N": 128,
    "BLOCK_SIZE_K": 32,
    " GROUP_SIZE_M": 8,
    "num_warps": 4,
    "num_stages": 4
  },
  {
    "M": 40,
    "N": 8192,
    "K": 12288,
    "BLOCK_SIZE_M": 64,
    "BLOCK_SIZE_N": 128,
    "BLOCK_SIZE_K": 32,
    " GROUP_SIZE_M": 4,
    "num_warps": 4,
    "num_stages": 4
  },
  {
    "M": 44,
    "N": 8192,
    "K": 12288,
    "BLOCK_SIZE_M": 64,
    "BLOCK_SIZE_N": 128,
    "BLOCK_SIZE_K": 32,
    " GROUP_SIZE_M": 4,
    "num_warps": 4,
    "num_stages": 4
  },
  {
    "M": 48,
    "N": 8192,
    "K": 12288,
    "BLOCK_SIZE_M": 64,
    "BLOCK_SIZE_N": 128,
    "BLOCK_SIZE_K": 32,
    " GROUP_SIZE_M": 16,
    "num_warps": 4,
    "num_stages": 4
  },
  {
    "M": 52,
    "N": 8192,
    "K": 12288,
    "BLOCK_SIZE_M": 64,
    "BLOCK_SIZE_N": 128,
    "BLOCK_SIZE_K": 32,
    " GROUP_SIZE_M": 8,
    "num_warps": 4,
    "num_stages": 4
  },
  {
    "M": 56,
    "N": 8192,
    "K": 12288,
    "BLOCK_SIZE_M": 32,
    "BLOCK_SIZE_N": 128,
    "BLOCK_SIZE_K": 32,
    " GROUP_SIZE_M": 16,
    "num_warps": 4,
    "num_stages": 4
  },
  {
    "M": 60,
    "N": 8192,
    "K": 12288,
    "BLOCK_SIZE_M": 64,
    "BLOCK_SIZE_N": 128,
    "BLOCK_SIZE_K": 32,
    " GROUP_SIZE_M": 8,
    "num_warps": 4,
    "num_stages": 4
  },
  {
    "M": 64,
    "N": 8192,
    "K": 12288,
    "BLOCK_SIZE_M": 32,
    "BLOCK_SIZE_N": 128,
    "BLOCK_SIZE_K": 32,
    " GROUP_SIZE_M": 16,
    "num_warps": 4,
    "num_stages": 4
  },
  {
    "M": 68,
    "N": 8192,
    "K": 12288,
    "BLOCK_SIZE_M": 32,
    "BLOCK_SIZE_N": 128,
    "BLOCK_SIZE_K": 32,
    " GROUP_SIZE_M": 16,
    "num_warps": 4,
    "num_stages": 5
  },
  {
    "M": 72,
    "N": 8192,
    "K": 12288,
    "BLOCK_SIZE_M": 32,
    "BLOCK_SIZE_N": 128,
    "BLOCK_SIZE_K": 64,
    " GROUP_SIZE_M": 4,
    "num_warps": 4,
    "num_stages": 4
  },
  {
    "M": 76,
    "N": 8192,
    "K": 12288,
    "BLOCK_SIZE_M": 32,
    "BLOCK_SIZE_N": 128,
    "BLOCK_SIZE_K": 32,
    " GROUP_SIZE_M": 4,
    "num_warps": 4,
    "num_stages": 5
  },
  {
    "M": 80,
    "N": 8192,
    "K": 12288,
    "BLOCK_SIZE_M": 32,
    "BLOCK_SIZE_N": 256,
    "BLOCK_SIZE_K": 32,
    " GROUP_SIZE_M": 4,
    "num_warps": 4,
    "num_stages": 4
  },
  {
    "M": 84,
    "N": 8192,
    "K": 12288,
    "BLOCK_SIZE_M": 32,
    "BLOCK_SIZE_N": 128,
    "BLOCK_SIZE_K": 32,
    " GROUP_SIZE_M": 8,
    "num_warps": 4,
    "num_stages": 5
  },
  {
    "M": 88,
    "N": 8192,
    "K": 12288,
    "BLOCK_SIZE_M": 32,
    "BLOCK_SIZE_N": 256,
    "BLOCK_SIZE_K": 32,
    " GROUP_SIZE_M": 4,
    "num_warps": 4,
    "num_stages": 4
  },
  {
    "M": 92,
    "N": 8192,
    "K": 12288,
    "BLOCK_SIZE_M": 32,
    "BLOCK_SIZE_N": 128,
    "BLOCK_SIZE_K": 32,
    " GROUP_SIZE_M": 4,
    "num_warps": 4,
    "num_stages": 5
  },
  {
    "M": 96,
    "N": 8192,
    "K": 12288,
    "BLOCK_SIZE_M": 32,
    "BLOCK_SIZE_N": 256,
    "BLOCK_SIZE_K": 32,
    " GROUP_SIZE_M": 4,
    "num_warps": 4,
    "num_stages": 4
  },
  {
    "M": 100,
    "N": 8192,
    "K": 12288,
    "BLOCK_SIZE_M": 128,
    "BLOCK_SIZE_N": 128,
    "BLOCK_SIZE_K": 32,
    " GROUP_SIZE_M": 8,
    "num_warps": 4,
    "num_stages": 5
  },
  {
    "M": 104,
    "N": 8192,
    "K": 12288,
    "BLOCK_SIZE_M": 32,
    "BLOCK_SIZE_N": 128,
    "BLOCK_SIZE_K": 32,
    " GROUP_SIZE_M": 16,
    "num_warps": 4,
    "num_stages": 4
  },
  {
    "M": 108,
    "N": 8192,
    "K": 12288,
    "BLOCK_SIZE_M": 128,
    "BLOCK_SIZE_N": 128,
    "BLOCK_SIZE_K": 32,
    " GROUP_SIZE_M": 8,
    "num_warps": 4,
    "num_stages": 5
  },
  {
    "M": 112,
    "N": 8192,
    "K": 12288,
    "BLOCK_SIZE_M": 32,
    "BLOCK_SIZE_N": 128,
    "BLOCK_SIZE_K": 32,
    " GROUP_SIZE_M": 16,
    "num_warps": 4,
    "num_stages": 4
  },
  {
    "M": 116,
    "N": 8192,
    "K": 12288,
    "BLOCK_SIZE_M": 128,
    "BLOCK_SIZE_N": 128,
    "BLOCK_SIZE_K": 32,
    " GROUP_SIZE_M": 4,
    "num_warps": 4,
    "num_stages": 5
  },
  {
    "M": 120,
    "N": 8192,
    "K": 12288,
    "BLOCK_SIZE_M": 128,
    "BLOCK_SIZE_N": 128,
    "BLOCK_SIZE_K": 32,
    " GROUP_SIZE_M": 8,
    "num_warps": 4,
    "num_stages": 4
  },
  {
    "M": 124,
    "N": 8192,
    "K": 12288,
    "BLOCK_SIZE_M": 32,
    "BLOCK_SIZE_N": 128,
    "BLOCK_SIZE_K": 32,
    " GROUP_SIZE_M": 16,
    "num_warps": 4,
    "num_stages": 4
  },
  {
    "M": 128,
    "N": 8192,
    "K": 12288,
    "BLOCK_SIZE_M": 32,
    "BLOCK_SIZE_N": 128,
    "BLOCK_SIZE_K": 32,
    " GROUP_SIZE_M": 16,
    "num_warps": 4,
    "num_stages": 4
  },
  {
    "M": 256,
    "N": 8192,
    "K": 12288,
    "BLOCK_SIZE_M": 64,
    "BLOCK_SIZE_N": 128,
    "BLOCK_SIZE_K": 64,
    " GROUP_SIZE_M": 8,
    "num_warps": 4,
    "num_stages": 4
  },
  {
    "M": 512,
    "N": 8192,
    "K": 12288,
    "BLOCK_SIZE_M": 128,
    "BLOCK_SIZE_N": 128,
    "BLOCK_SIZE_K": 32,
    " GROUP_SIZE_M": 4,
    "num_warps": 4,
    "num_stages": 4
  },
  {
    "M": 1024,
    "N": 8192,
    "K": 12288,
    "BLOCK_SIZE_M": 128,
    "BLOCK_SIZE_N": 128,
    "BLOCK_SIZE_K": 32,
    " GROUP_SIZE_M": 8,
    "num_warps": 4,
    "num_stages": 4
  },
  {
    "M": 2048,
    "N": 8192,
    "K": 12288,
    "BLOCK_SIZE_M": 128,
    "BLOCK_SIZE_N": 128,
    "BLOCK_SIZE_K": 32,
    " GROUP_SIZE_M": 4,
    "num_warps": 4,
    "num_stages": 4
  },
  {
    "M": 4096,
    "N": 8192,
    "K": 12288,
    "BLOCK_SIZE_M": 128,
    "BLOCK_SIZE_N": 128,
    "BLOCK_SIZE_K": 32,
    " GROUP_SIZE_M": 8,
    "num_warps": 4,
    "num_stages": 4
  },
  {
    "M": 8192,
    "N": 8192,
    "K": 12288,
    "BLOCK_SIZE_M": 128,
    "BLOCK_SIZE_N": 128,
    "BLOCK_SIZE_K": 32,
    " GROUP_SIZE_M": 8,
    "num_warps": 4,
    "num_stages": 4
  }
]