gemm_triton/config.json
[
  {
    "M": 128,
    "N": 128,
    "K": 128,
    "ldtype": "bfloat16",
    "rdtype": "bfloat16",
    "BLOCK_SIZE_M": 16,
    "BLOCK_SIZE_N": 64,
    "BLOCK_SIZE_K": 32,
    " GROUP_SIZE_M": 16,
    "num_warps": 2,
    "num_stages": 5
  },
  {
    "M": 256,
    "N": 256,
    "K": 256,
    "ldtype": "float32",
    "rdtype": "float32",
    "BLOCK_SIZE_M": 32,
    "BLOCK_SIZE_N": 64,
    "BLOCK_SIZE_K": 32,
    " GROUP_SIZE_M": 4,
    "num_warps": 2,
    "num_stages": 4
  },
  {
    "M": 64,
    "N": 64,
    "K": 64,
    "ldtype": "bfloat16",
    "rdtype": "bfloat16",
    "BLOCK_SIZE_M": 16,
    "BLOCK_SIZE_N": 64,
    "BLOCK_SIZE_K": 32,
    " GROUP_SIZE_M": 4,
    "num_warps": 2,
    "num_stages": 5
  },
  {
    "M": 512,
    "N": 512,
    "K": 512,
    "ldtype": "float32",
    "rdtype": "float32",
    "BLOCK_SIZE_M": 32,
    "BLOCK_SIZE_N": 64,
    "BLOCK_SIZE_K": 32,
    " GROUP_SIZE_M": 8,
    "num_warps": 2,
    "num_stages": 4
  },
  {
    "M": 32,
    "N": 32,
    "K": 32,
    "ldtype": "bfloat16",
    "rdtype": "bfloat16",
    "BLOCK_SIZE_M": 16,
    "BLOCK_SIZE_N": 128,
    "BLOCK_SIZE_K": 32,
    " GROUP_SIZE_M": 4,
    "num_warps": 4,
    "num_stages": 4
  },
  {
    "M": 1024,
    "N": 1024,
    "K": 1024,
    "ldtype": "float32",
    "rdtype": "float32",
    "BLOCK_SIZE_M": 64,
    "BLOCK_SIZE_N": 128,
    "BLOCK_SIZE_K": 32,
    " GROUP_SIZE_M": 8,
    "num_warps": 4,
    "num_stages": 4
  },
  {
    "M": 16,
    "N": 16,
    "K": 16,
    "ldtype": "bfloat16",
    "rdtype": "bfloat16",
    "BLOCK_SIZE_M": 16,
    "BLOCK_SIZE_N": 64,
    "BLOCK_SIZE_K": 32,
    " GROUP_SIZE_M": 4,
    "num_warps": 2,
    "num_stages": 4
  },
  {
    "M": 2048,
    "N": 2048,
    "K": 2048,
    "ldtype": "float32",
    "rdtype": "float32",
    "BLOCK_SIZE_M": 64,
    "BLOCK_SIZE_N": 128,
    "BLOCK_SIZE_K": 32,
    " GROUP_SIZE_M": 4,
    "num_warps": 4,
    "num_stages": 4
  },
  {
    "M": 8,
    "N": 8,
    "K": 8,
    "ldtype": "bfloat16",
    "rdtype": "bfloat16",
    "BLOCK_SIZE_M": 16,
    "BLOCK_SIZE_N": 128,
    "BLOCK_SIZE_K": 32,
    " GROUP_SIZE_M": 4,
    "num_warps": 4,
    "num_stages": 4
  },
  {
    "M": 4096,
    "N": 4096,
    "K": 4096,
    "ldtype": "float32",
    "rdtype": "float32",
    "BLOCK_SIZE_M": 64,
    "BLOCK_SIZE_N": 128,
    "BLOCK_SIZE_K": 32,
    " GROUP_SIZE_M": 16,
    "num_warps": 4,
    "num_stages": 4
  },
  {
    "M": 16,
    "N": 32,
    "K": 48,
    "ldtype": "bfloat16",
    "rdtype": "bfloat16",
    "BLOCK_SIZE_M": 16,
    "BLOCK_SIZE_N": 64,
    "BLOCK_SIZE_K": 32,
    " GROUP_SIZE_M": 8,
    "num_warps": 2,
    "num_stages": 4
  },
  {
    "M": 64,
    "N": 80,
    "K": 96,
    "ldtype": "float32",
    "rdtype": "float32",
    "BLOCK_SIZE_M": 16,
    "BLOCK_SIZE_N": 64,
    "BLOCK_SIZE_K": 32,
    " GROUP_SIZE_M": 4,
    "num_warps": 2,
    "num_stages": 4
  },
  {
    "M": 112,
    "N": 128,
    "K": 144,
    "ldtype": "bfloat16",
    "rdtype": "bfloat16",
    "BLOCK_SIZE_M": 16,
    "BLOCK_SIZE_N": 64,
    "BLOCK_SIZE_K": 64,
    " GROUP_SIZE_M": 8,
    "num_warps": 2,
    "num_stages": 5
  },
  {
    "M": 160,
    "N": 176,
    "K": 192,
    "ldtype": "float32",
    "rdtype": "float32",
    "BLOCK_SIZE_M": 32,
    "BLOCK_SIZE_N": 64,
    "BLOCK_SIZE_K": 64,
    " GROUP_SIZE_M": 4,
    "num_warps": 2,
    "num_stages": 4
  },
  {
    "M": 208,
    "N": 224,
    "K": 240,
    "ldtype": "bfloat16",
    "rdtype": "bfloat16",
    "BLOCK_SIZE_M": 32,
    "BLOCK_SIZE_N": 64,
    "BLOCK_SIZE_K": 64,
    " GROUP_SIZE_M": 4,
    "num_warps": 2,
    "num_stages": 4
  },
  {
    "M": 256,
    "N": 272,
    "K": 288,
    "ldtype": "float32",
    "rdtype": "float32",
    "BLOCK_SIZE_M": 32,
    "BLOCK_SIZE_N": 64,
    "BLOCK_SIZE_K": 32,
    " GROUP_SIZE_M": 4,
    "num_warps": 2,
    "num_stages": 4
  },
  {
    "M": 304,
    "N": 320,
    "K": 336,
    "ldtype": "bfloat16",
    "rdtype": "bfloat16",
    "BLOCK_SIZE_M": 32,
    "BLOCK_SIZE_N": 64,
    "BLOCK_SIZE_K": 32,
    " GROUP_SIZE_M": 4,
    "num_warps": 2,
    "num_stages": 5
  },
  {
    "M": 352,
    "N": 368,
    "K": 384,
    "ldtype": "float32",
    "rdtype": "float32",
    "BLOCK_SIZE_M": 64,
    "BLOCK_SIZE_N": 128,
    "BLOCK_SIZE_K": 32,
    " GROUP_SIZE_M": 8,
    "num_warps": 4,
    "num_stages": 4
  },
  {
    "M": 400,
    "N": 416,
    "K": 432,
    "ldtype": "bfloat16",
    "rdtype": "bfloat16",
    "BLOCK_SIZE_M": 32,
    "BLOCK_SIZE_N": 64,
    "BLOCK_SIZE_K": 32,
    " GROUP_SIZE_M": 4,
    "num_warps": 2,
    "num_stages": 4
  },
  {
    "M": 448,
    "N": 464,
    "K": 480,
    "ldtype": "float32",
    "rdtype": "float32",
    "BLOCK_SIZE_M": 32,
    "BLOCK_SIZE_N": 64,
    "BLOCK_SIZE_K": 32,
    " GROUP_SIZE_M": 4,
    "num_warps": 2,
    "num_stages": 4
  },
  {
    "M": 2048,
    "N": 2048,
    "K": 2048,
    "ldtype": "float32",
    "rdtype": "float32",
    "BLOCK_SIZE_M": 64,
    "BLOCK_SIZE_N": 128,
    "BLOCK_SIZE_K": 32,
    " GROUP_SIZE_M": 4,
    "num_warps": 4,
    "num_stages": 4
  },
  {
    "M": 16,
    "N": 16,
    "K": 16,
    "ldtype": "bfloat16",
    "rdtype": "bfloat16",
    "BLOCK_SIZE_M": 16,
    "BLOCK_SIZE_N": 64,
    "BLOCK_SIZE_K": 32,
    " GROUP_SIZE_M": 4,
    "num_warps": 2,
    "num_stages": 4
  },
  {
    "M": 2032,
    "N": 2032,
    "K": 2032,
    "ldtype": "float32",
    "rdtype": "float32",
    "BLOCK_SIZE_M": 64,
    "BLOCK_SIZE_N": 128,
    "BLOCK_SIZE_K": 32,
    " GROUP_SIZE_M": 4,
    "num_warps": 4,
    "num_stages": 4
  },
  {
    "M": 32,
    "N": 32,
    "K": 32,
    "ldtype": "bfloat16",
    "rdtype": "bfloat16",
    "BLOCK_SIZE_M": 16,
    "BLOCK_SIZE_N": 128,
    "BLOCK_SIZE_K": 32,
    " GROUP_SIZE_M": 4,
    "num_warps": 4,
    "num_stages": 4
  },
  {
    "M": 2016,
    "N": 2016,
    "K": 2016,
    "ldtype": "float32",
    "rdtype": "float32",
    "BLOCK_SIZE_M": 64,
    "BLOCK_SIZE_N": 128,
    "BLOCK_SIZE_K": 32,
    " GROUP_SIZE_M": 4,
    "num_warps": 4,
    "num_stages": 4
  },
  {
    "M": 48,
    "N": 48,
    "K": 48,
    "ldtype": "bfloat16",
    "rdtype": "bfloat16",
    "BLOCK_SIZE_M": 16,
    "BLOCK_SIZE_N": 64,
    "BLOCK_SIZE_K": 64,
    " GROUP_SIZE_M": 8,
    "num_warps": 2,
    "num_stages": 5
  },
  {
    "M": 2000,
    "N": 2000,
    "K": 2000,
    "ldtype": "float32",
    "rdtype": "float32",
    "BLOCK_SIZE_M": 64,
    "BLOCK_SIZE_N": 128,
    "BLOCK_SIZE_K": 32,
    " GROUP_SIZE_M": 4,
    "num_warps": 4,
    "num_stages": 4
  },
  {
    "M": 64,
    "N": 64,
    "K": 64,
    "ldtype": "bfloat16",
    "rdtype": "bfloat16",
    "BLOCK_SIZE_M": 16,
    "BLOCK_SIZE_N": 64,
    "BLOCK_SIZE_K": 32,
    " GROUP_SIZE_M": 4,
    "num_warps": 2,
    "num_stages": 5
  },
  {
    "M": 1984,
    "N": 1984,
    "K": 1984,
    "ldtype": "float32",
    "rdtype": "float32",
    "BLOCK_SIZE_M": 64,
    "BLOCK_SIZE_N": 128,
    "BLOCK_SIZE_K": 32,
    " GROUP_SIZE_M": 4,
    "num_warps": 4,
    "num_stages": 4
  },
  {
    "M": 80,
    "N": 80,
    "K": 80,
    "ldtype": "bfloat16",
    "rdtype": "bfloat16",
    "BLOCK_SIZE_M": 16,
    "BLOCK_SIZE_N": 64,
    "BLOCK_SIZE_K": 32,
    " GROUP_SIZE_M": 4,
    "num_warps": 2,
    "num_stages": 5
  },
  {
    "M": 1968,
    "N": 1968,
    "K": 1968,
    "ldtype": "float32",
    "rdtype": "float32",
    "BLOCK_SIZE_M": 64,
    "BLOCK_SIZE_N": 128,
    "BLOCK_SIZE_K": 32,
    " GROUP_SIZE_M": 4,
    "num_warps": 4,
    "num_stages": 4
  },
  {
    "M": 96,
    "N": 96,
    "K": 96,
    "ldtype": "bfloat16",
    "rdtype": "bfloat16",
    "BLOCK_SIZE_M": 16,
    "BLOCK_SIZE_N": 128,
    "BLOCK_SIZE_K": 32,
    " GROUP_SIZE_M": 4,
    "num_warps": 4,
    "num_stages": 4
  },
  {
    "M": 1952,
    "N": 1952,
    "K": 1952,
    "ldtype": "float32",
    "rdtype": "float32",
    "BLOCK_SIZE_M": 64,
    "BLOCK_SIZE_N": 128,
    "BLOCK_SIZE_K": 32,
    " GROUP_SIZE_M": 4,
    "num_warps": 4,
    "num_stages": 4
  },
  {
    "M": 112,
    "N": 112,
    "K": 112,
    "ldtype": "bfloat16",
    "rdtype": "bfloat16",
    "BLOCK_SIZE_M": 16,
    "BLOCK_SIZE_N": 64,
    "BLOCK_SIZE_K": 32,
    " GROUP_SIZE_M": 4,
    "num_warps": 2,
    "num_stages": 5
  },
  {
    "M": 1936,
    "N": 1936,
    "K": 1936,
    "ldtype": "float32",
    "rdtype": "float32",
    "BLOCK_SIZE_M": 64,
    "BLOCK_SIZE_N": 128,
    "BLOCK_SIZE_K": 32,
    " GROUP_SIZE_M": 4,
    "num_warps": 4,
    "num_stages": 4
  },
  {
    "M": 128,
    "N": 128,
    "K": 128,
    "ldtype": "bfloat16",
    "rdtype": "bfloat16",
    "BLOCK_SIZE_M": 16,
    "BLOCK_SIZE_N": 64,
    "BLOCK_SIZE_K": 32,
    " GROUP_SIZE_M": 16,
    "num_warps": 2,
    "num_stages": 5
  },
  {
    "M": 1920,
    "N": 1920,
    "K": 1920,
    "ldtype": "float32",
    "rdtype": "float32",
    "BLOCK_SIZE_M": 64,
    "BLOCK_SIZE_N": 128,
    "BLOCK_SIZE_K": 32,
    " GROUP_SIZE_M": 4,
    "num_warps": 4,
    "num_stages": 4
  },
  {
    "M": 144,
    "N": 144,
    "K": 144,
    "ldtype": "bfloat16",
    "rdtype": "bfloat16",
    "BLOCK_SIZE_M": 16,
    "BLOCK_SIZE_N": 64,
    "BLOCK_SIZE_K": 32,
    " GROUP_SIZE_M": 4,
    "num_warps": 2,
    "num_stages": 5
  },
  {
    "M": 1904,
    "N": 1904,
    "K": 1904,
    "ldtype": "float32",
    "rdtype": "float32",
    "BLOCK_SIZE_M": 64,
    "BLOCK_SIZE_N": 128,
    "BLOCK_SIZE_K": 32,
    " GROUP_SIZE_M": 4,
    "num_warps": 4,
    "num_stages": 4
  },
  {
    "M": 160,
    "N": 160,
    "K": 160,
    "ldtype": "bfloat16",
    "rdtype": "bfloat16",
    "BLOCK_SIZE_M": 32,
    "BLOCK_SIZE_N": 64,
    "BLOCK_SIZE_K": 32,
    " GROUP_SIZE_M": 4,
    "num_warps": 2,
    "num_stages": 5
  },
  {
    "M": 2064,
    "N": 2064,
    "K": 2064,
    "ldtype": "float32",
    "rdtype": "float32",
    "BLOCK_SIZE_M": 64,
    "BLOCK_SIZE_N": 128,
    "BLOCK_SIZE_K": 32,
    " GROUP_SIZE_M": 4,
    "num_warps": 4,
    "num_stages": 4
  },
  {
    "M": 176,
    "N": 176,
    "K": 176,
    "ldtype": "bfloat16",
    "rdtype": "bfloat16",
    "BLOCK_SIZE_M": 16,
    "BLOCK_SIZE_N": 64,
    "BLOCK_SIZE_K": 64,
    " GROUP_SIZE_M": 16,
    "num_warps": 2,
    "num_stages": 4
  },
  {
    "M": 2080,
    "N": 2080,
    "K": 2080,
    "ldtype": "float32",
    "rdtype": "float32",
    "BLOCK_SIZE_M": 64,
    "BLOCK_SIZE_N": 128,
    "BLOCK_SIZE_K": 32,
    " GROUP_SIZE_M": 4,
    "num_warps": 4,
    "num_stages": 4
  },
  {
    "M": 192,
    "N": 192,
    "K": 192,
    "ldtype": "bfloat16",
    "rdtype": "bfloat16",
    "BLOCK_SIZE_M": 16,
    "BLOCK_SIZE_N": 64,
    "BLOCK_SIZE_K": 64,
    " GROUP_SIZE_M": 8,
    "num_warps": 2,
    "num_stages": 4
  },
  {
    "M": 2096,
    "N": 2096,
    "K": 2096,
    "ldtype": "float32",
    "rdtype": "float32",
    "BLOCK_SIZE_M": 64,
    "BLOCK_SIZE_N": 128,
    "BLOCK_SIZE_K": 32,
    " GROUP_SIZE_M": 4,
    "num_warps": 4,
    "num_stages": 4
  },
  {
    "M": 208,
    "N": 208,
    "K": 208,
    "ldtype": "bfloat16",
    "rdtype": "bfloat16",
    "BLOCK_SIZE_M": 32,
    "BLOCK_SIZE_N": 64,
    "BLOCK_SIZE_K": 32,
    " GROUP_SIZE_M": 4,
    "num_warps": 2,
    "num_stages": 5
  },
  {
    "M": 2112,
    "N": 2112,
    "K": 2112,
    "ldtype": "float32",
    "rdtype": "float32",
    "BLOCK_SIZE_M": 64,
    "BLOCK_SIZE_N": 128,
    "BLOCK_SIZE_K": 32,
    " GROUP_SIZE_M": 4,
    "num_warps": 4,
    "num_stages": 4
  },
  {
    "M": 224,
    "N": 224,
    "K": 224,
    "ldtype": "bfloat16",
    "rdtype": "bfloat16",
    "BLOCK_SIZE_M": 32,
    "BLOCK_SIZE_N": 64,
    "BLOCK_SIZE_K": 64,
    " GROUP_SIZE_M": 16,
    "num_warps": 2,
    "num_stages": 4
  },
  {
    "M": 2128,
    "N": 2128,
    "K": 2128,
    "ldtype": "float32",
    "rdtype": "float32",
    "BLOCK_SIZE_M": 64,
    "BLOCK_SIZE_N": 128,
    "BLOCK_SIZE_K": 32,
    " GROUP_SIZE_M": 4,
    "num_warps": 4,
    "num_stages": 4
  },
  {
    "M": 240,
    "N": 240,
    "K": 240,
    "ldtype": "bfloat16",
    "rdtype": "bfloat16",
    "BLOCK_SIZE_M": 32,
    "BLOCK_SIZE_N": 64,
    "BLOCK_SIZE_K": 32,
    " GROUP_SIZE_M": 4,
    "num_warps": 2,
    "num_stages": 5
  }
]