gemm_triton/config.json
[
    {
        "M": 4,
        "N": 512,
        "K": 512,
        "ldtype": "float16",
        "rdtype": "float16",
        "BLOCK_SIZE_M": 16,
        "BLOCK_SIZE_N": 64,
        "BLOCK_SIZE_K": 64,
        "GROUP_SIZE_M": 16,
        "num_warps": 2,
        "num_ctas": 1,
        "num_stages": 5,
        "kernel_name": "kernel_2c7e9857_0d1d2d34567891011"
    },
    {
        "M": 8,
        "N": 512,
        "K": 512,
        "ldtype": "float16",
        "rdtype": "float16",
        "BLOCK_SIZE_M": 16,
        "BLOCK_SIZE_N": 64,
        "BLOCK_SIZE_K": 64,
        "GROUP_SIZE_M": 4,
        "num_warps": 2,
        "num_ctas": 1,
        "num_stages": 5,
        "kernel_name": "kernel_719a088d_0d1d2d34567891011"
    },
    {
        "M": 12,
        "N": 512,
        "K": 512,
        "ldtype": "float16",
        "rdtype": "float16",
        "BLOCK_SIZE_M": 16,
        "BLOCK_SIZE_N": 64,
        "BLOCK_SIZE_K": 64,
        "GROUP_SIZE_M": 4,
        "num_warps": 2,
        "num_ctas": 1,
        "num_stages": 5,
        "kernel_name": "kernel_719a088d_0d1d2d34567891011"
    },
    {
        "M": 16,
        "N": 512,
        "K": 512,
        "ldtype": "float16",
        "rdtype": "float16",
        "BLOCK_SIZE_M": 16,
        "BLOCK_SIZE_N": 64,
        "BLOCK_SIZE_K": 64,
        "GROUP_SIZE_M": 4,
        "num_warps": 2,
        "num_ctas": 1,
        "num_stages": 5,
        "kernel_name": "kernel_719a088d_0d1d2d34567891011"
    },
    {
        "M": 20,
        "N": 512,
        "K": 512,
        "ldtype": "float16",
        "rdtype": "float16",
        "BLOCK_SIZE_M": 16,
        "BLOCK_SIZE_N": 64,
        "BLOCK_SIZE_K": 64,
        "GROUP_SIZE_M": 4,
        "num_warps": 2,
        "num_ctas": 1,
        "num_stages": 5,
        "kernel_name": "kernel_719a088d_0d1d2d34567891011"
    },
    {
        "M": 24,
        "N": 512,
        "K": 512,
        "ldtype": "float16",
        "rdtype": "float16",
        "BLOCK_SIZE_M": 16,
        "BLOCK_SIZE_N": 64,
        "BLOCK_SIZE_K": 64,
        "GROUP_SIZE_M": 8,
        "num_warps": 2,
        "num_ctas": 1,
        "num_stages": 5,
        "kernel_name": "kernel_e1807783_0d1d2d34567891011"
    },
    {
        "M": 28,
        "N": 512,
        "K": 512,
        "ldtype": "float16",
        "rdtype": "float16",
        "BLOCK_SIZE_M": 16,
        "BLOCK_SIZE_N": 64,
        "BLOCK_SIZE_K": 64,
        "GROUP_SIZE_M": 8,
        "num_warps": 2,
        "num_ctas": 1,
        "num_stages": 5,
        "kernel_name": "kernel_e1807783_0d1d2d34567891011"
    },
    {
        "M": 32,
        "N": 512,
        "K": 512,
        "ldtype": "float16",
        "rdtype": "float16",
        "BLOCK_SIZE_M": 16,
        "BLOCK_SIZE_N": 128,
        "BLOCK_SIZE_K": 64,
        "GROUP_SIZE_M": 16,
        "num_warps": 4,
        "num_ctas": 1,
        "num_stages": 5,
        "kernel_name": "kernel_8ac9753b_0d1d2d34567891011"
    },
    {
        "M": 36,
        "N": 512,
        "K": 512,
        "ldtype": "float16",
        "rdtype": "float16",
        "BLOCK_SIZE_M": 16,
        "BLOCK_SIZE_N": 64,
        "BLOCK_SIZE_K": 64,
        "GROUP_SIZE_M": 16,
        "num_warps": 2,
        "num_ctas": 1,
        "num_stages": 5,
        "kernel_name": "kernel_2c7e9857_0d1d2d34567891011"
    },
    {
        "M": 40,
        "N": 512,
        "K": 512,
        "ldtype": "float16",
        "rdtype": "float16",
        "BLOCK_SIZE_M": 16,
        "BLOCK_SIZE_N": 64,
        "BLOCK_SIZE_K": 64,
        "GROUP_SIZE_M": 16,
        "num_warps": 2,
        "num_ctas": 1,
        "num_stages": 5,
        "kernel_name": "kernel_2c7e9857_0d1d2d34567891011"
    },
    {
        "M": 44,
        "N": 512,
        "K": 512,
        "ldtype": "float16",
        "rdtype": "float16",
        "BLOCK_SIZE_M": 16,
        "BLOCK_SIZE_N": 128,
        "BLOCK_SIZE_K": 64,
        "GROUP_SIZE_M": 4,
        "num_warps": 4,
        "num_ctas": 1,
        "num_stages": 5,
        "kernel_name": "kernel_7f22bb6a_0d1d2d34567891011"
    },
    {
        "M": 48,
        "N": 512,
        "K": 512,
        "ldtype": "float16",
        "rdtype": "float16",
        "BLOCK_SIZE_M": 16,
        "BLOCK_SIZE_N": 64,
        "BLOCK_SIZE_K": 64,
        "GROUP_SIZE_M": 8,
        "num_warps": 2,
        "num_ctas": 1,
        "num_stages": 5,
        "kernel_name": "kernel_e1807783_0d1d2d34567891011"
    },
    {
        "M": 52,
        "N": 512,
        "K": 512,
        "ldtype": "float16",
        "rdtype": "float16",
        "BLOCK_SIZE_M": 16,
        "BLOCK_SIZE_N": 64,
        "BLOCK_SIZE_K": 64,
        "GROUP_SIZE_M": 4,
        "num_warps": 2,
        "num_ctas": 1,
        "num_stages": 5,
        "kernel_name": "kernel_719a088d_0d1d2d34567891011"
    },
    {
        "M": 56,
        "N": 512,
        "K": 512,
        "ldtype": "float16",
        "rdtype": "float16",
        "BLOCK_SIZE_M": 16,
        "BLOCK_SIZE_N": 64,
        "BLOCK_SIZE_K": 64,
        "GROUP_SIZE_M": 4,
        "num_warps": 2,
        "num_ctas": 1,
        "num_stages": 5,
        "kernel_name": "kernel_719a088d_0d1d2d34567891011"
    },
    {
        "M": 60,
        "N": 512,
        "K": 512,
        "ldtype": "float16",
        "rdtype": "float16",
        "BLOCK_SIZE_M": 16,
        "BLOCK_SIZE_N": 64,
        "BLOCK_SIZE_K": 64,
        "GROUP_SIZE_M": 8,
        "num_warps": 2,
        "num_ctas": 1,
        "num_stages": 5,
        "kernel_name": "kernel_e1807783_0d1d2d34567891011"
    },
    {
        "M": 64,
        "N": 512,
        "K": 512,
        "ldtype": "float16",
        "rdtype": "float16",
        "BLOCK_SIZE_M": 16,
        "BLOCK_SIZE_N": 64,
        "BLOCK_SIZE_K": 64,
        "GROUP_SIZE_M": 8,
        "num_warps": 2,
        "num_ctas": 1,
        "num_stages": 5,
        "kernel_name": "kernel_e1807783_0d1d2d34567891011"
    },
    {
        "M": 68,
        "N": 512,
        "K": 512,
        "ldtype": "float16",
        "rdtype": "float16",
        "BLOCK_SIZE_M": 16,
        "BLOCK_SIZE_N": 128,
        "BLOCK_SIZE_K": 64,
        "GROUP_SIZE_M": 4,
        "num_warps": 4,
        "num_ctas": 1,
        "num_stages": 5,
        "kernel_name": "kernel_7f22bb6a_0d1d2d34567891011"
    },
    {
        "M": 72,
        "N": 512,
        "K": 512,
        "ldtype": "float16",
        "rdtype": "float16",
        "BLOCK_SIZE_M": 16,
        "BLOCK_SIZE_N": 128,
        "BLOCK_SIZE_K": 64,
        "GROUP_SIZE_M": 4,
        "num_warps": 4,
        "num_ctas": 1,
        "num_stages": 5,
        "kernel_name": "kernel_7f22bb6a_0d1d2d34567891011"
    },
    {
        "M": 76,
        "N": 512,
        "K": 512,
        "ldtype": "float16",
        "rdtype": "float16",
        "BLOCK_SIZE_M": 16,
        "BLOCK_SIZE_N": 64,
        "BLOCK_SIZE_K": 64,
        "GROUP_SIZE_M": 4,
        "num_warps": 2,
        "num_ctas": 1,
        "num_stages": 5,
        "kernel_name": "kernel_719a088d_0d1d2d34567891011"
    },
    {
        "M": 80,
        "N": 512,
        "K": 512,
        "ldtype": "float16",
        "rdtype": "float16",
        "BLOCK_SIZE_M": 16,
        "BLOCK_SIZE_N": 64,
        "BLOCK_SIZE_K": 64,
        "GROUP_SIZE_M": 8,
        "num_warps": 2,
        "num_ctas": 1,
        "num_stages": 5,
        "kernel_name": "kernel_e1807783_0d1d2d34567891011"
    },
    {
        "M": 84,
        "N": 512,
        "K": 512,
        "ldtype": "float16",
        "rdtype": "float16",
        "BLOCK_SIZE_M": 32,
        "BLOCK_SIZE_N": 64,
        "BLOCK_SIZE_K": 64,
        "GROUP_SIZE_M": 16,
        "num_warps": 2,
        "num_ctas": 1,
        "num_stages": 5,
        "kernel_name": "kernel_cf98af0c_0d1d2d34567891011"
    },
    {
        "M": 88,
        "N": 512,
        "K": 512,
        "ldtype": "float16",
        "rdtype": "float16",
        "BLOCK_SIZE_M": 32,
        "BLOCK_SIZE_N": 64,
        "BLOCK_SIZE_K": 64,
        "GROUP_SIZE_M": 8,
        "num_warps": 2,
        "num_ctas": 1,
        "num_stages": 5,
        "kernel_name": "kernel_11f7c317_0d1d2d34567891011"
    },
    {
        "M": 92,
        "N": 512,
        "K": 512,
        "ldtype": "float16",
        "rdtype": "float16",
        "BLOCK_SIZE_M": 16,
        "BLOCK_SIZE_N": 64,
        "BLOCK_SIZE_K": 64,
        "GROUP_SIZE_M": 4,
        "num_warps": 2,
        "num_ctas": 1,
        "num_stages": 5,
        "kernel_name": "kernel_719a088d_0d1d2d34567891011"
    },
    {
        "M": 96,
        "N": 512,
        "K": 512,
        "ldtype": "float16",
        "rdtype": "float16",
        "BLOCK_SIZE_M": 16,
        "BLOCK_SIZE_N": 64,
        "BLOCK_SIZE_K": 64,
        "GROUP_SIZE_M": 16,
        "num_warps": 2,
        "num_ctas": 1,
        "num_stages": 5,
        "kernel_name": "kernel_2c7e9857_0d1d2d34567891011"
    },
    {
        "M": 100,
        "N": 512,
        "K": 512,
        "ldtype": "float16",
        "rdtype": "float16",
        "BLOCK_SIZE_M": 32,
        "BLOCK_SIZE_N": 64,
        "BLOCK_SIZE_K": 64,
        "GROUP_SIZE_M": 4,
        "num_warps": 2,
        "num_ctas": 1,
        "num_stages": 5,
        "kernel_name": "kernel_babb08f0_0d1d2d34567891011"
    },
    {
        "M": 104,
        "N": 512,
        "K": 512,
        "ldtype": "float16",
        "rdtype": "float16",
        "BLOCK_SIZE_M": 32,
        "BLOCK_SIZE_N": 64,
        "BLOCK_SIZE_K": 64,
        "GROUP_SIZE_M": 4,
        "num_warps": 2,
        "num_ctas": 1,
        "num_stages": 5,
        "kernel_name": "kernel_babb08f0_0d1d2d34567891011"
    },
    {
        "M": 108,
        "N": 512,
        "K": 512,
        "ldtype": "float16",
        "rdtype": "float16",
        "BLOCK_SIZE_M": 32,
        "BLOCK_SIZE_N": 64,
        "BLOCK_SIZE_K": 64,
        "GROUP_SIZE_M": 8,
        "num_warps": 2,
        "num_ctas": 1,
        "num_stages": 5,
        "kernel_name": "kernel_11f7c317_0d1d2d34567891011"
    },
    {
        "M": 112,
        "N": 512,
        "K": 512,
        "ldtype": "float16",
        "rdtype": "float16",
        "BLOCK_SIZE_M": 32,
        "BLOCK_SIZE_N": 64,
        "BLOCK_SIZE_K": 64,
        "GROUP_SIZE_M": 4,
        "num_warps": 2,
        "num_ctas": 1,
        "num_stages": 5,
        "kernel_name": "kernel_babb08f0_0d1d2d34567891011"
    },
    {
        "M": 116,
        "N": 512,
        "K": 512,
        "ldtype": "float16",
        "rdtype": "float16",
        "BLOCK_SIZE_M": 16,
        "BLOCK_SIZE_N": 64,
        "BLOCK_SIZE_K": 64,
        "GROUP_SIZE_M": 4,
        "num_warps": 2,
        "num_ctas": 1,
        "num_stages": 4,
        "kernel_name": "kernel_1702476a_0d1d2d34567891011"
    },
    {
        "M": 120,
        "N": 512,
        "K": 512,
        "ldtype": "float16",
        "rdtype": "float16",
        "BLOCK_SIZE_M": 32,
        "BLOCK_SIZE_N": 64,
        "BLOCK_SIZE_K": 64,
        "GROUP_SIZE_M": 4,
        "num_warps": 2,
        "num_ctas": 1,
        "num_stages": 5,
        "kernel_name": "kernel_babb08f0_0d1d2d34567891011"
    },
    {
        "M": 124,
        "N": 512,
        "K": 512,
        "ldtype": "float16",
        "rdtype": "float16",
        "BLOCK_SIZE_M": 32,
        "BLOCK_SIZE_N": 64,
        "BLOCK_SIZE_K": 64,
        "GROUP_SIZE_M": 8,
        "num_warps": 2,
        "num_ctas": 1,
        "num_stages": 5,
        "kernel_name": "kernel_11f7c317_0d1d2d34567891011"
    },
    {
        "M": 128,
        "N": 512,
        "K": 512,
        "ldtype": "float16",
        "rdtype": "float16",
        "BLOCK_SIZE_M": 32,
        "BLOCK_SIZE_N": 64,
        "BLOCK_SIZE_K": 64,
        "GROUP_SIZE_M": 16,
        "num_warps": 2,
        "num_ctas": 1,
        "num_stages": 5,
        "kernel_name": "kernel_cf98af0c_0d1d2d34567891011"
    },
    {
        "M": 132,
        "N": 512,
        "K": 512,
        "ldtype": "float16",
        "rdtype": "float16",
        "BLOCK_SIZE_M": 32,
        "BLOCK_SIZE_N": 64,
        "BLOCK_SIZE_K": 64,
        "GROUP_SIZE_M": 4,
        "num_warps": 2,
        "num_ctas": 1,
        "num_stages": 5,
        "kernel_name": "kernel_babb08f0_0d1d2d34567891011"
    },
    {
        "M": 136,
        "N": 512,
        "K": 512,
        "ldtype": "float16",
        "rdtype": "float16",
        "BLOCK_SIZE_M": 32,
        "BLOCK_SIZE_N": 64,
        "BLOCK_SIZE_K": 64,
        "GROUP_SIZE_M": 8,
        "num_warps": 2,
        "num_ctas": 1,
        "num_stages": 5,
        "kernel_name": "kernel_11f7c317_0d1d2d34567891011"
    },
    {
        "M": 140,
        "N": 512,
        "K": 512,
        "ldtype": "float16",
        "rdtype": "float16",
        "BLOCK_SIZE_M": 32,
        "BLOCK_SIZE_N": 64,
        "BLOCK_SIZE_K": 64,
        "GROUP_SIZE_M": 4,
        "num_warps": 2,
        "num_ctas": 1,
        "num_stages": 5,
        "kernel_name": "kernel_babb08f0_0d1d2d34567891011"
    },
    {
        "M": 144,
        "N": 512,
        "K": 512,
        "ldtype": "float16",
        "rdtype": "float16",
        "BLOCK_SIZE_M": 32,
        "BLOCK_SIZE_N": 64,
        "BLOCK_SIZE_K": 64,
        "GROUP_SIZE_M": 4,
        "num_warps": 2,
        "num_ctas": 1,
        "num_stages": 5,
        "kernel_name": "kernel_babb08f0_0d1d2d34567891011"
    },
    {
        "M": 148,
        "N": 512,
        "K": 512,
        "ldtype": "float16",
        "rdtype": "float16",
        "BLOCK_SIZE_M": 32,
        "BLOCK_SIZE_N": 64,
        "BLOCK_SIZE_K": 64,
        "GROUP_SIZE_M": 4,
        "num_warps": 2,
        "num_ctas": 1,
        "num_stages": 5,
        "kernel_name": "kernel_babb08f0_0d1d2d34567891011"
    },
    {
        "M": 152,
        "N": 512,
        "K": 512,
        "ldtype": "float16",
        "rdtype": "float16",
        "BLOCK_SIZE_M": 32,
        "BLOCK_SIZE_N": 64,
        "BLOCK_SIZE_K": 64,
        "GROUP_SIZE_M": 16,
        "num_warps": 2,
        "num_ctas": 1,
        "num_stages": 5,
        "kernel_name": "kernel_cf98af0c_0d1d2d34567891011"
    },
    {
        "M": 156,
        "N": 512,
        "K": 512,
        "ldtype": "float16",
        "rdtype": "float16",
        "BLOCK_SIZE_M": 32,
        "BLOCK_SIZE_N": 64,
        "BLOCK_SIZE_K": 64,
        "GROUP_SIZE_M": 4,
        "num_warps": 2,
        "num_ctas": 1,
        "num_stages": 5,
        "kernel_name": "kernel_babb08f0_0d1d2d34567891011"
    },
    {
        "M": 160,
        "N": 512,
        "K": 512,
        "ldtype": "float16",
        "rdtype": "float16",
        "BLOCK_SIZE_M": 32,
        "BLOCK_SIZE_N": 64,
        "BLOCK_SIZE_K": 64,
        "GROUP_SIZE_M": 4,
        "num_warps": 2,
        "num_ctas": 1,
        "num_stages": 4,
        "kernel_name": "kernel_f2c3539b_0d1d2d34567891011"
    },
    {
        "M": 164,
        "N": 512,
        "K": 512,
        "ldtype": "float16",
        "rdtype": "float16",
        "BLOCK_SIZE_M": 32,
        "BLOCK_SIZE_N": 64,
        "BLOCK_SIZE_K": 64,
        "GROUP_SIZE_M": 8,
        "num_warps": 2,
        "num_ctas": 1,
        "num_stages": 5,
        "kernel_name": "kernel_11f7c317_0d1d2d34567891011"
    },
    {
        "M": 168,
        "N": 512,
        "K": 512,
        "ldtype": "float16",
        "rdtype": "float16",
        "BLOCK_SIZE_M": 32,
        "BLOCK_SIZE_N": 64,
        "BLOCK_SIZE_K": 64,
        "GROUP_SIZE_M": 16,
        "num_warps": 2,
        "num_ctas": 1,
        "num_stages": 5,
        "kernel_name": "kernel_cf98af0c_0d1d2d34567891011"
    },
    {
        "M": 172,
        "N": 512,
        "K": 512,
        "ldtype": "float16",
        "rdtype": "float16",
        "BLOCK_SIZE_M": 32,
        "BLOCK_SIZE_N": 64,
        "BLOCK_SIZE_K": 64,
        "GROUP_SIZE_M": 4,
        "num_warps": 2,
        "num_ctas": 1,
        "num_stages": 5,
        "kernel_name": "kernel_babb08f0_0d1d2d34567891011"
    },
    {
        "M": 176,
        "N": 512,
        "K": 512,
        "ldtype": "float16",
        "rdtype": "float16",
        "BLOCK_SIZE_M": 32,
        "BLOCK_SIZE_N": 64,
        "BLOCK_SIZE_K": 64,
        "GROUP_SIZE_M": 4,
        "num_warps": 2,
        "num_ctas": 1,
        "num_stages": 5,
        "kernel_name": "kernel_babb08f0_0d1d2d34567891011"
    },
    {
        "M": 180,
        "N": 512,
        "K": 512,
        "ldtype": "float16",
        "rdtype": "float16",
        "BLOCK_SIZE_M": 32,
        "BLOCK_SIZE_N": 64,
        "BLOCK_SIZE_K": 64,
        "GROUP_SIZE_M": 8,
        "num_warps": 2,
        "num_ctas": 1,
        "num_stages": 5,
        "kernel_name": "kernel_11f7c317_0d1d2d34567891011"
    },
    {
        "M": 184,
        "N": 512,
        "K": 512,
        "ldtype": "float16",
        "rdtype": "float16",
        "BLOCK_SIZE_M": 32,
        "BLOCK_SIZE_N": 64,
        "BLOCK_SIZE_K": 64,
        "GROUP_SIZE_M": 8,
        "num_warps": 2,
        "num_ctas": 1,
        "num_stages": 5,
        "kernel_name": "kernel_11f7c317_0d1d2d34567891011"
    },
    {
        "M": 188,
        "N": 512,
        "K": 512,
        "ldtype": "float16",
        "rdtype": "float16",
        "BLOCK_SIZE_M": 32,
        "BLOCK_SIZE_N": 64,
        "BLOCK_SIZE_K": 64,
        "GROUP_SIZE_M": 4,
        "num_warps": 2,
        "num_ctas": 1,
        "num_stages": 5,
        "kernel_name": "kernel_babb08f0_0d1d2d34567891011"
    },
    {
        "M": 192,
        "N": 512,
        "K": 512,
        "ldtype": "float16",
        "rdtype": "float16",
        "BLOCK_SIZE_M": 32,
        "BLOCK_SIZE_N": 64,
        "BLOCK_SIZE_K": 64,
        "GROUP_SIZE_M": 4,
        "num_warps": 2,
        "num_ctas": 1,
        "num_stages": 5,
        "kernel_name": "kernel_babb08f0_0d1d2d34567891011"
    },
    {
        "M": 196,
        "N": 512,
        "K": 512,
        "ldtype": "float16",
        "rdtype": "float16",
        "BLOCK_SIZE_M": 32,
        "BLOCK_SIZE_N": 64,
        "BLOCK_SIZE_K": 32,
        "GROUP_SIZE_M": 8,
        "num_warps": 2,
        "num_ctas": 1,
        "num_stages": 5,
        "kernel_name": "kernel_bcc51275_0d1d2d34567891011"
    },
    {
        "M": 200,
        "N": 512,
        "K": 512,
        "ldtype": "float16",
        "rdtype": "float16",
        "BLOCK_SIZE_M": 32,
        "BLOCK_SIZE_N": 64,
        "BLOCK_SIZE_K": 32,
        "GROUP_SIZE_M": 4,
        "num_warps": 2,
        "num_ctas": 1,
        "num_stages": 5,
        "kernel_name": "kernel_d3f2a44f_0d1d2d34567891011"
    },
    {
        "M": 204,
        "N": 512,
        "K": 512,
        "ldtype": "float16",
        "rdtype": "float16",
        "BLOCK_SIZE_M": 32,
        "BLOCK_SIZE_N": 128,
        "BLOCK_SIZE_K": 32,
        "GROUP_SIZE_M": 4,
        "num_warps": 4,
        "num_ctas": 1,
        "num_stages": 5,
        "kernel_name": "kernel_099b0ee9_0d1d2d34567891011"
    },
    {
        "M": 208,
        "N": 512,
        "K": 512,
        "ldtype": "float16",
        "rdtype": "float16",
        "BLOCK_SIZE_M": 32,
        "BLOCK_SIZE_N": 128,
        "BLOCK_SIZE_K": 32,
        "GROUP_SIZE_M": 4,
        "num_warps": 4,
        "num_ctas": 1,
        "num_stages": 5,
        "kernel_name": "kernel_099b0ee9_0d1d2d34567891011"
    },
    {
        "M": 212,
        "N": 512,
        "K": 512,
        "ldtype": "float16",
        "rdtype": "float16",
        "BLOCK_SIZE_M": 32,
        "BLOCK_SIZE_N": 64,
        "BLOCK_SIZE_K": 32,
        "GROUP_SIZE_M": 4,
        "num_warps": 2,
        "num_ctas": 1,
        "num_stages": 5,
        "kernel_name": "kernel_d3f2a44f_0d1d2d34567891011"
    },
    {
        "M": 216,
        "N": 512,
        "K": 512,
        "ldtype": "float16",
        "rdtype": "float16",
        "BLOCK_SIZE_M": 32,
        "BLOCK_SIZE_N": 128,
        "BLOCK_SIZE_K": 32,
        "GROUP_SIZE_M": 16,
        "num_warps": 4,
        "num_ctas": 1,
        "num_stages": 5,
        "kernel_name": "kernel_705d0902_0d1d2d34567891011"
    },
    {
        "M": 220,
        "N": 512,
        "K": 512,
        "ldtype": "float16",
        "rdtype": "float16",
        "BLOCK_SIZE_M": 32,
        "BLOCK_SIZE_N": 64,
        "BLOCK_SIZE_K": 32,
        "GROUP_SIZE_M": 4,
        "num_warps": 2,
        "num_ctas": 1,
        "num_stages": 5,
        "kernel_name": "kernel_d3f2a44f_0d1d2d34567891011"
    },
    {
        "M": 224,
        "N": 512,
        "K": 512,
        "ldtype": "float16",
        "rdtype": "float16",
        "BLOCK_SIZE_M": 32,
        "BLOCK_SIZE_N": 64,
        "BLOCK_SIZE_K": 32,
        "GROUP_SIZE_M": 4,
        "num_warps": 2,
        "num_ctas": 1,
        "num_stages": 5,
        "kernel_name": "kernel_d3f2a44f_0d1d2d34567891011"
    },
    {
        "M": 228,
        "N": 512,
        "K": 512,
        "ldtype": "float16",
        "rdtype": "float16",
        "BLOCK_SIZE_M": 32,
        "BLOCK_SIZE_N": 128,
        "BLOCK_SIZE_K": 32,
        "GROUP_SIZE_M": 4,
        "num_warps": 4,
        "num_ctas": 1,
        "num_stages": 5,
        "kernel_name": "kernel_099b0ee9_0d1d2d34567891011"
    },
    {
        "M": 232,
        "N": 512,
        "K": 512,
        "ldtype": "float16",
        "rdtype": "float16",
        "BLOCK_SIZE_M": 32,
        "BLOCK_SIZE_N": 128,
        "BLOCK_SIZE_K": 32,
        "GROUP_SIZE_M": 4,
        "num_warps": 4,
        "num_ctas": 1,
        "num_stages": 5,
        "kernel_name": "kernel_099b0ee9_0d1d2d34567891011"
    },
    {
        "M": 236,
        "N": 512,
        "K": 512,
        "ldtype": "float16",
        "rdtype": "float16",
        "BLOCK_SIZE_M": 64,
        "BLOCK_SIZE_N": 64,
        "BLOCK_SIZE_K": 64,
        "GROUP_SIZE_M": 8,
        "num_warps": 2,
        "num_ctas": 1,
        "num_stages": 4,
        "kernel_name": "kernel_5c76303f_0d1d2d34567891011"
    },
    {
        "M": 240,
        "N": 512,
        "K": 512,
        "ldtype": "float16",
        "rdtype": "float16",
        "BLOCK_SIZE_M": 64,
        "BLOCK_SIZE_N": 64,
        "BLOCK_SIZE_K": 64,
        "GROUP_SIZE_M": 8,
        "num_warps": 2,
        "num_ctas": 1,
        "num_stages": 4,
        "kernel_name": "kernel_5c76303f_0d1d2d34567891011"
    },
    {
        "M": 244,
        "N": 512,
        "K": 512,
        "ldtype": "float16",
        "rdtype": "float16",
        "BLOCK_SIZE_M": 64,
        "BLOCK_SIZE_N": 64,
        "BLOCK_SIZE_K": 64,
        "GROUP_SIZE_M": 4,
        "num_warps": 2,
        "num_ctas": 1,
        "num_stages": 4,
        "kernel_name": "kernel_98bbb594_0d1d2d34567891011"
    },
    {
        "M": 248,
        "N": 512,
        "K": 512,
        "ldtype": "float16",
        "rdtype": "float16",
        "BLOCK_SIZE_M": 32,
        "BLOCK_SIZE_N": 64,
        "BLOCK_SIZE_K": 32,
        "GROUP_SIZE_M": 4,
        "num_warps": 2,
        "num_ctas": 1,
        "num_stages": 5,
        "kernel_name": "kernel_d3f2a44f_0d1d2d34567891011"
    },
    {
        "M": 252,
        "N": 512,
        "K": 512,
        "ldtype": "float16",
        "rdtype": "float16",
        "BLOCK_SIZE_M": 64,
        "BLOCK_SIZE_N": 64,
        "BLOCK_SIZE_K": 64,
        "GROUP_SIZE_M": 4,
        "num_warps": 2,
        "num_ctas": 1,
        "num_stages": 4,
        "kernel_name": "kernel_98bbb594_0d1d2d34567891011"
    },
    {
        "M": 256,
        "N": 512,
        "K": 512,
        "ldtype": "float16",
        "rdtype": "float16",
        "BLOCK_SIZE_M": 64,
        "BLOCK_SIZE_N": 64,
        "BLOCK_SIZE_K": 64,
        "GROUP_SIZE_M": 16,
        "num_warps": 2,
        "num_ctas": 1,
        "num_stages": 4,
        "kernel_name": "kernel_8c21baee_0d1d2d34567891011"
    },
    {
        "M": 260,
        "N": 512,
        "K": 512,
        "ldtype": "float16",
        "rdtype": "float16",
        "BLOCK_SIZE_M": 64,
        "BLOCK_SIZE_N": 64,
        "BLOCK_SIZE_K": 64,
        "GROUP_SIZE_M": 16,
        "num_warps": 2,
        "num_ctas": 1,
        "num_stages": 4,
        "kernel_name": "kernel_8c21baee_0d1d2d34567891011"
    },
    {
        "M": 264,
        "N": 512,
        "K": 512,
        "ldtype": "float16",
        "rdtype": "float16",
        "BLOCK_SIZE_M": 32,
        "BLOCK_SIZE_N": 128,
        "BLOCK_SIZE_K": 32,
        "GROUP_SIZE_M": 4,
        "num_warps": 4,
        "num_ctas": 1,
        "num_stages": 5,
        "kernel_name": "kernel_099b0ee9_0d1d2d34567891011"
    },
    {
        "M": 268,
        "N": 512,
        "K": 512,
        "ldtype": "float16",
        "rdtype": "float16",
        "BLOCK_SIZE_M": 64,
        "BLOCK_SIZE_N": 64,
        "BLOCK_SIZE_K": 64,
        "GROUP_SIZE_M": 4,
        "num_warps": 2,
        "num_ctas": 1,
        "num_stages": 4,
        "kernel_name": "kernel_98bbb594_0d1d2d34567891011"
    },
    {
        "M": 272,
        "N": 512,
        "K": 512,
        "ldtype": "float16",
        "rdtype": "float16",
        "BLOCK_SIZE_M": 64,
        "BLOCK_SIZE_N": 64,
        "BLOCK_SIZE_K": 64,
        "GROUP_SIZE_M": 4,
        "num_warps": 2,
        "num_ctas": 1,
        "num_stages": 4,
        "kernel_name": "kernel_98bbb594_0d1d2d34567891011"
    },
    {
        "M": 276,
        "N": 512,
        "K": 512,
        "ldtype": "float16",
        "rdtype": "float16",
        "BLOCK_SIZE_M": 64,
        "BLOCK_SIZE_N": 64,
        "BLOCK_SIZE_K": 64,
        "GROUP_SIZE_M": 8,
        "num_warps": 2,
        "num_ctas": 1,
        "num_stages": 4,
        "kernel_name": "kernel_5c76303f_0d1d2d34567891011"
    },
    {
        "M": 280,
        "N": 512,
        "K": 512,
        "ldtype": "float16",
        "rdtype": "float16",
        "BLOCK_SIZE_M": 64,
        "BLOCK_SIZE_N": 64,
        "BLOCK_SIZE_K": 64,
        "GROUP_SIZE_M": 16,
        "num_warps": 2,
        "num_ctas": 1,
        "num_stages": 4,
        "kernel_name": "kernel_8c21baee_0d1d2d34567891011"
    },
    {
        "M": 284,
        "N": 512,
        "K": 512,
        "ldtype": "float16",
        "rdtype": "float16",
        "BLOCK_SIZE_M": 64,
        "BLOCK_SIZE_N": 64,
        "BLOCK_SIZE_K": 64,
        "GROUP_SIZE_M": 4,
        "num_warps": 2,
        "num_ctas": 1,
        "num_stages": 4,
        "kernel_name": "kernel_98bbb594_0d1d2d34567891011"
    },
    {
        "M": 288,
        "N": 512,
        "K": 512,
        "ldtype": "float16",
        "rdtype": "float16",
        "BLOCK_SIZE_M": 32,
        "BLOCK_SIZE_N": 128,
        "BLOCK_SIZE_K": 32,
        "GROUP_SIZE_M": 4,
        "num_warps": 4,
        "num_ctas": 1,
        "num_stages": 5,
        "kernel_name": "kernel_099b0ee9_0d1d2d34567891011"
    },
    {
        "M": 292,
        "N": 512,
        "K": 512,
        "ldtype": "float16",
        "rdtype": "float16",
        "BLOCK_SIZE_M": 64,
        "BLOCK_SIZE_N": 64,
        "BLOCK_SIZE_K": 64,
        "GROUP_SIZE_M": 4,
        "num_warps": 2,
        "num_ctas": 1,
        "num_stages": 4,
        "kernel_name": "kernel_98bbb594_0d1d2d34567891011"
    },
    {
        "M": 296,
        "N": 512,
        "K": 512,
        "ldtype": "float16",
        "rdtype": "float16",
        "BLOCK_SIZE_M": 64,
        "BLOCK_SIZE_N": 64,
        "BLOCK_SIZE_K": 64,
        "GROUP_SIZE_M": 4,
        "num_warps": 2,
        "num_ctas": 1,
        "num_stages": 4,
        "kernel_name": "kernel_98bbb594_0d1d2d34567891011"
    },
    {
        "M": 300,
        "N": 512,
        "K": 512,
        "ldtype": "float16",
        "rdtype": "float16",
        "BLOCK_SIZE_M": 32,
        "BLOCK_SIZE_N": 128,
        "BLOCK_SIZE_K": 32,
        "GROUP_SIZE_M": 4,
        "num_warps": 4,
        "num_ctas": 1,
        "num_stages": 5,
        "kernel_name": "kernel_099b0ee9_0d1d2d34567891011"
    },
    {
        "M": 304,
        "N": 512,
        "K": 512,
        "ldtype": "float16",
        "rdtype": "float16",
        "BLOCK_SIZE_M": 64,
        "BLOCK_SIZE_N": 64,
        "BLOCK_SIZE_K": 64,
        "GROUP_SIZE_M": 8,
        "num_warps": 2,
        "num_ctas": 1,
        "num_stages": 4,
        "kernel_name": "kernel_5c76303f_0d1d2d34567891011"
    },
    {
        "M": 308,
        "N": 512,
        "K": 512,
        "ldtype": "float16",
        "rdtype": "float16",
        "BLOCK_SIZE_M": 32,
        "BLOCK_SIZE_N": 128,
        "BLOCK_SIZE_K": 32,
        "GROUP_SIZE_M": 4,
        "num_warps": 4,
        "num_ctas": 1,
        "num_stages": 5,
        "kernel_name": "kernel_099b0ee9_0d1d2d34567891011"
    },
    {
        "M": 312,
        "N": 512,
        "K": 512,
        "ldtype": "float16",
        "rdtype": "float16",
        "BLOCK_SIZE_M": 64,
        "BLOCK_SIZE_N": 64,
        "BLOCK_SIZE_K": 64,
        "GROUP_SIZE_M": 8,
        "num_warps": 2,
        "num_ctas": 1,
        "num_stages": 4,
        "kernel_name": "kernel_5c76303f_0d1d2d34567891011"
    },
    {
        "M": 316,
        "N": 512,
        "K": 512,
        "ldtype": "float16",
        "rdtype": "float16",
        "BLOCK_SIZE_M": 64,
        "BLOCK_SIZE_N": 64,
        "BLOCK_SIZE_K": 64,
        "GROUP_SIZE_M": 4,
        "num_warps": 2,
        "num_ctas": 1,
        "num_stages": 4,
        "kernel_name": "kernel_98bbb594_0d1d2d34567891011"
    },
    {
        "M": 320,
        "N": 512,
        "K": 512,
        "ldtype": "float16",
        "rdtype": "float16",
        "BLOCK_SIZE_M": 64,
        "BLOCK_SIZE_N": 64,
        "BLOCK_SIZE_K": 64,
        "GROUP_SIZE_M": 8,
        "num_warps": 2,
        "num_ctas": 1,
        "num_stages": 4,
        "kernel_name": "kernel_5c76303f_0d1d2d34567891011"
    },
    {
        "M": 324,
        "N": 512,
        "K": 512,
        "ldtype": "float16",
        "rdtype": "float16",
        "BLOCK_SIZE_M": 64,
        "BLOCK_SIZE_N": 64,
        "BLOCK_SIZE_K": 64,
        "GROUP_SIZE_M": 16,
        "num_warps": 2,
        "num_ctas": 1,
        "num_stages": 4,
        "kernel_name": "kernel_8c21baee_0d1d2d34567891011"
    },
    {
        "M": 328,
        "N": 512,
        "K": 512,
        "ldtype": "float16",
        "rdtype": "float16",
        "BLOCK_SIZE_M": 64,
        "BLOCK_SIZE_N": 64,
        "BLOCK_SIZE_K": 64,
        "GROUP_SIZE_M": 4,
        "num_warps": 2,
        "num_ctas": 1,
        "num_stages": 4,
        "kernel_name": "kernel_98bbb594_0d1d2d34567891011"
    },
    {
        "M": 332,
        "N": 512,
        "K": 512,
        "ldtype": "float16",
        "rdtype": "float16",
        "BLOCK_SIZE_M": 32,
        "BLOCK_SIZE_N": 64,
        "BLOCK_SIZE_K": 32,
        "GROUP_SIZE_M": 4,
        "num_warps": 2,
        "num_ctas": 1,
        "num_stages": 5,
        "kernel_name": "kernel_d3f2a44f_0d1d2d34567891011"
    },
    {
        "M": 336,
        "N": 512,
        "K": 512,
        "ldtype": "float16",
        "rdtype": "float16",
        "BLOCK_SIZE_M": 64,
        "BLOCK_SIZE_N": 64,
        "BLOCK_SIZE_K": 64,
        "GROUP_SIZE_M": 8,
        "num_warps": 2,
        "num_ctas": 1,
        "num_stages": 4,
        "kernel_name": "kernel_5c76303f_0d1d2d34567891011"
    },
    {
        "M": 340,
        "N": 512,
        "K": 512,
        "ldtype": "float16",
        "rdtype": "float16",
        "BLOCK_SIZE_M": 64,
        "BLOCK_SIZE_N": 64,
        "BLOCK_SIZE_K": 64,
        "GROUP_SIZE_M": 16,
        "num_warps": 2,
        "num_ctas": 1,
        "num_stages": 4,
        "kernel_name": "kernel_8c21baee_0d1d2d34567891011"
    },
    {
        "M": 344,
        "N": 512,
        "K": 512,
        "ldtype": "float16",
        "rdtype": "float16",
        "BLOCK_SIZE_M": 64,
        "BLOCK_SIZE_N": 64,
        "BLOCK_SIZE_K": 64,
        "GROUP_SIZE_M": 8,
        "num_warps": 2,
        "num_ctas": 1,
        "num_stages": 4,
        "kernel_name": "kernel_5c76303f_0d1d2d34567891011"
    },
    {
        "M": 348,
        "N": 512,
        "K": 512,
        "ldtype": "float16",
        "rdtype": "float16",
        "BLOCK_SIZE_M": 64,
        "BLOCK_SIZE_N": 64,
        "BLOCK_SIZE_K": 64,
        "GROUP_SIZE_M": 16,
        "num_warps": 2,
        "num_ctas": 1,
        "num_stages": 4,
        "kernel_name": "kernel_8c21baee_0d1d2d34567891011"
    },
    {
        "M": 352,
        "N": 512,
        "K": 512,
        "ldtype": "float16",
        "rdtype": "float16",
        "BLOCK_SIZE_M": 64,
        "BLOCK_SIZE_N": 64,
        "BLOCK_SIZE_K": 64,
        "GROUP_SIZE_M": 8,
        "num_warps": 2,
        "num_ctas": 1,
        "num_stages": 4,
        "kernel_name": "kernel_5c76303f_0d1d2d34567891011"
    },
    {
        "M": 356,
        "N": 512,
        "K": 512,
        "ldtype": "float16",
        "rdtype": "float16",
        "BLOCK_SIZE_M": 64,
        "BLOCK_SIZE_N": 64,
        "BLOCK_SIZE_K": 64,
        "GROUP_SIZE_M": 16,
        "num_warps": 2,
        "num_ctas": 1,
        "num_stages": 4,
        "kernel_name": "kernel_8c21baee_0d1d2d34567891011"
    },
    {
        "M": 360,
        "N": 512,
        "K": 512,
        "ldtype": "float16",
        "rdtype": "float16",
        "BLOCK_SIZE_M": 64,
        "BLOCK_SIZE_N": 64,
        "BLOCK_SIZE_K": 64,
        "GROUP_SIZE_M": 8,
        "num_warps": 2,
        "num_ctas": 1,
        "num_stages": 4,
        "kernel_name": "kernel_5c76303f_0d1d2d34567891011"
    },
    {
        "M": 364,
        "N": 512,
        "K": 512,
        "ldtype": "float16",
        "rdtype": "float16",
        "BLOCK_SIZE_M": 64,
        "BLOCK_SIZE_N": 64,
        "BLOCK_SIZE_K": 64,
        "GROUP_SIZE_M": 8,
        "num_warps": 2,
        "num_ctas": 1,
        "num_stages": 4,
        "kernel_name": "kernel_5c76303f_0d1d2d34567891011"
    },
    {
        "M": 368,
        "N": 512,
        "K": 512,
        "ldtype": "float16",
        "rdtype": "float16",
        "BLOCK_SIZE_M": 64,
        "BLOCK_SIZE_N": 64,
        "BLOCK_SIZE_K": 64,
        "GROUP_SIZE_M": 16,
        "num_warps": 2,
        "num_ctas": 1,
        "num_stages": 4,
        "kernel_name": "kernel_8c21baee_0d1d2d34567891011"
    },
    {
        "M": 372,
        "N": 512,
        "K": 512,
        "ldtype": "float16",
        "rdtype": "float16",
        "BLOCK_SIZE_M": 64,
        "BLOCK_SIZE_N": 64,
        "BLOCK_SIZE_K": 64,
        "GROUP_SIZE_M": 4,
        "num_warps": 2,
        "num_ctas": 1,
        "num_stages": 4,
        "kernel_name": "kernel_98bbb594_0d1d2d34567891011"
    },
    {
        "M": 376,
        "N": 512,
        "K": 512,
        "ldtype": "float16",
        "rdtype": "float16",
        "BLOCK_SIZE_M": 64,
        "BLOCK_SIZE_N": 64,
        "BLOCK_SIZE_K": 64,
        "GROUP_SIZE_M": 4,
        "num_warps": 2,
        "num_ctas": 1,
        "num_stages": 4,
        "kernel_name": "kernel_98bbb594_0d1d2d34567891011"
    },
    {
        "M": 380,
        "N": 512,
        "K": 512,
        "ldtype": "float16",
        "rdtype": "float16",
        "BLOCK_SIZE_M": 32,
        "BLOCK_SIZE_N": 128,
        "BLOCK_SIZE_K": 32,
        "GROUP_SIZE_M": 4,
        "num_warps": 4,
        "num_ctas": 1,
        "num_stages": 5,
        "kernel_name": "kernel_099b0ee9_0d1d2d34567891011"
    },
    {
        "M": 384,
        "N": 512,
        "K": 512,
        "ldtype": "float16",
        "rdtype": "float16",
        "BLOCK_SIZE_M": 64,
        "BLOCK_SIZE_N": 64,
        "BLOCK_SIZE_K": 64,
        "GROUP_SIZE_M": 16,
        "num_warps": 2,
        "num_ctas": 1,
        "num_stages": 4,
        "kernel_name": "kernel_8c21baee_0d1d2d34567891011"
    },
    {
        "M": 388,
        "N": 512,
        "K": 512,
        "ldtype": "float16",
        "rdtype": "float16",
        "BLOCK_SIZE_M": 32,
        "BLOCK_SIZE_N": 128,
        "BLOCK_SIZE_K": 32,
        "GROUP_SIZE_M": 4,
        "num_warps": 4,
        "num_ctas": 1,
        "num_stages": 4,
        "kernel_name": "kernel_c7603356_0d1d2d34567891011"
    },
    {
        "M": 392,
        "N": 512,
        "K": 512,
        "ldtype": "float16",
        "rdtype": "float16",
        "BLOCK_SIZE_M": 32,
        "BLOCK_SIZE_N": 64,
        "BLOCK_SIZE_K": 32,
        "GROUP_SIZE_M": 8,
        "num_warps": 2,
        "num_ctas": 1,
        "num_stages": 4,
        "kernel_name": "kernel_7043566a_0d1d2d34567891011"
    },
    {
        "M": 396,
        "N": 512,
        "K": 512,
        "ldtype": "float16",
        "rdtype": "float16",
        "BLOCK_SIZE_M": 32,
        "BLOCK_SIZE_N": 128,
        "BLOCK_SIZE_K": 32,
        "GROUP_SIZE_M": 16,
        "num_warps": 4,
        "num_ctas": 1,
        "num_stages": 4,
        "kernel_name": "kernel_b3d46ea1_0d1d2d34567891011"
    },
    {
        "M": 400,
        "N": 512,
        "K": 512,
        "ldtype": "float16",
        "rdtype": "float16",
        "BLOCK_SIZE_M": 32,
        "BLOCK_SIZE_N": 64,
        "BLOCK_SIZE_K": 32,
        "GROUP_SIZE_M": 4,
        "num_warps": 2,
        "num_ctas": 1,
        "num_stages": 4,
        "kernel_name": "kernel_bbbda236_0d1d2d34567891011"
    },
    {
        "M": 404,
        "N": 512,
        "K": 512,
        "ldtype": "float16",
        "rdtype": "float16",
        "BLOCK_SIZE_M": 32,
        "BLOCK_SIZE_N": 64,
        "BLOCK_SIZE_K": 32,
        "GROUP_SIZE_M": 8,
        "num_warps": 2,
        "num_ctas": 1,
        "num_stages": 4,
        "kernel_name": "kernel_7043566a_0d1d2d34567891011"
    },
    {
        "M": 408,
        "N": 512,
        "K": 512,
        "ldtype": "float16",
        "rdtype": "float16",
        "BLOCK_SIZE_M": 32,
        "BLOCK_SIZE_N": 64,
        "BLOCK_SIZE_K": 32,
        "GROUP_SIZE_M": 8,
        "num_warps": 2,
        "num_ctas": 1,
        "num_stages": 4,
        "kernel_name": "kernel_7043566a_0d1d2d34567891011"
    },
    {
        "M": 412,
        "N": 512,
        "K": 512,
        "ldtype": "float16",
        "rdtype": "float16",
        "BLOCK_SIZE_M": 32,
        "BLOCK_SIZE_N": 64,
        "BLOCK_SIZE_K": 32,
        "GROUP_SIZE_M": 4,
        "num_warps": 2,
        "num_ctas": 1,
        "num_stages": 4,
        "kernel_name": "kernel_bbbda236_0d1d2d34567891011"
    },
    {
        "M": 416,
        "N": 512,
        "K": 512,
        "ldtype": "float16",
        "rdtype": "float16",
        "BLOCK_SIZE_M": 32,
        "BLOCK_SIZE_N": 64,
        "BLOCK_SIZE_K": 32,
        "GROUP_SIZE_M": 4,
        "num_warps": 2,
        "num_ctas": 1,
        "num_stages": 4,
        "kernel_name": "kernel_bbbda236_0d1d2d34567891011"
    },
    {
        "M": 420,
        "N": 512,
        "K": 512,
        "ldtype": "float16",
        "rdtype": "float16",
        "BLOCK_SIZE_M": 32,
        "BLOCK_SIZE_N": 128,
        "BLOCK_SIZE_K": 32,
        "GROUP_SIZE_M": 8,
        "num_warps": 4,
        "num_ctas": 1,
        "num_stages": 4,
        "kernel_name": "kernel_87e072ae_0d1d2d34567891011"
    },
    {
        "M": 424,
        "N": 512,
        "K": 512,
        "ldtype": "float16",
        "rdtype": "float16",
        "BLOCK_SIZE_M": 32,
        "BLOCK_SIZE_N": 128,
        "BLOCK_SIZE_K": 32,
        "GROUP_SIZE_M": 8,
        "num_warps": 4,
        "num_ctas": 1,
        "num_stages": 4,
        "kernel_name": "kernel_87e072ae_0d1d2d34567891011"
    },
    {
        "M": 428,
        "N": 512,
        "K": 512,
        "ldtype": "float16",
        "rdtype": "float16",
        "BLOCK_SIZE_M": 32,
        "BLOCK_SIZE_N": 64,
        "BLOCK_SIZE_K": 32,
        "GROUP_SIZE_M": 8,
        "num_warps": 2,
        "num_ctas": 1,
        "num_stages": 4,
        "kernel_name": "kernel_7043566a_0d1d2d34567891011"
    },
    {
        "M": 432,
        "N": 512,
        "K": 512,
        "ldtype": "float16",
        "rdtype": "float16",
        "BLOCK_SIZE_M": 32,
        "BLOCK_SIZE_N": 64,
        "BLOCK_SIZE_K": 32,
        "GROUP_SIZE_M": 8,
        "num_warps": 2,
        "num_ctas": 1,
        "num_stages": 4,
        "kernel_name": "kernel_7043566a_0d1d2d34567891011"
    },
    {
        "M": 436,
        "N": 512,
        "K": 512,
        "ldtype": "float16",
        "rdtype": "float16",
        "BLOCK_SIZE_M": 32,
        "BLOCK_SIZE_N": 64,
        "BLOCK_SIZE_K": 32,
        "GROUP_SIZE_M": 8,
        "num_warps": 2,
        "num_ctas": 1,
        "num_stages": 5,
        "kernel_name": "kernel_bcc51275_0d1d2d34567891011"
    },
    {
        "M": 440,
        "N": 512,
        "K": 512,
        "ldtype": "float16",
        "rdtype": "float16",
        "BLOCK_SIZE_M": 32,
        "BLOCK_SIZE_N": 64,
        "BLOCK_SIZE_K": 32,
        "GROUP_SIZE_M": 8,
        "num_warps": 2,
        "num_ctas": 1,
        "num_stages": 4,
        "kernel_name": "kernel_7043566a_0d1d2d34567891011"
    },
    {
        "M": 444,
        "N": 512,
        "K": 512,
        "ldtype": "float16",
        "rdtype": "float16",
        "BLOCK_SIZE_M": 32,
        "BLOCK_SIZE_N": 128,
        "BLOCK_SIZE_K": 32,
        "GROUP_SIZE_M": 8,
        "num_warps": 4,
        "num_ctas": 1,
        "num_stages": 4,
        "kernel_name": "kernel_87e072ae_0d1d2d34567891011"
    },
    {
        "M": 448,
        "N": 512,
        "K": 512,
        "ldtype": "float16",
        "rdtype": "float16",
        "BLOCK_SIZE_M": 32,
        "BLOCK_SIZE_N": 128,
        "BLOCK_SIZE_K": 32,
        "GROUP_SIZE_M": 8,
        "num_warps": 4,
        "num_ctas": 1,
        "num_stages": 4,
        "kernel_name": "kernel_87e072ae_0d1d2d34567891011"
    },
    {
        "M": 452,
        "N": 512,
        "K": 512,
        "ldtype": "float16",
        "rdtype": "float16",
        "BLOCK_SIZE_M": 32,
        "BLOCK_SIZE_N": 64,
        "BLOCK_SIZE_K": 32,
        "GROUP_SIZE_M": 8,
        "num_warps": 2,
        "num_ctas": 1,
        "num_stages": 4,
        "kernel_name": "kernel_7043566a_0d1d2d34567891011"
    },
    {
        "M": 456,
        "N": 512,
        "K": 512,
        "ldtype": "float16",
        "rdtype": "float16",
        "BLOCK_SIZE_M": 32,
        "BLOCK_SIZE_N": 64,
        "BLOCK_SIZE_K": 32,
        "GROUP_SIZE_M": 8,
        "num_warps": 2,
        "num_ctas": 1,
        "num_stages": 4,
        "kernel_name": "kernel_7043566a_0d1d2d34567891011"
    },
    {
        "M": 460,
        "N": 512,
        "K": 512,
        "ldtype": "float16",
        "rdtype": "float16",
        "BLOCK_SIZE_M": 32,
        "BLOCK_SIZE_N": 128,
        "BLOCK_SIZE_K": 32,
        "GROUP_SIZE_M": 16,
        "num_warps": 4,
        "num_ctas": 1,
        "num_stages": 4,
        "kernel_name": "kernel_b3d46ea1_0d1d2d34567891011"
    },
    {
        "M": 464,
        "N": 512,
        "K": 512,
        "ldtype": "float16",
        "rdtype": "float16",
        "BLOCK_SIZE_M": 32,
        "BLOCK_SIZE_N": 64,
        "BLOCK_SIZE_K": 32,
        "GROUP_SIZE_M": 8,
        "num_warps": 2,
        "num_ctas": 1,
        "num_stages": 4,
        "kernel_name": "kernel_7043566a_0d1d2d34567891011"
    },
    {
        "M": 468,
        "N": 512,
        "K": 512,
        "ldtype": "float16",
        "rdtype": "float16",
        "BLOCK_SIZE_M": 32,
        "BLOCK_SIZE_N": 128,
        "BLOCK_SIZE_K": 32,
        "GROUP_SIZE_M": 16,
        "num_warps": 4,
        "num_ctas": 1,
        "num_stages": 4,
        "kernel_name": "kernel_b3d46ea1_0d1d2d34567891011"
    },
    {
        "M": 472,
        "N": 512,
        "K": 512,
        "ldtype": "float16",
        "rdtype": "float16",
        "BLOCK_SIZE_M": 32,
        "BLOCK_SIZE_N": 64,
        "BLOCK_SIZE_K": 32,
        "GROUP_SIZE_M": 4,
        "num_warps": 2,
        "num_ctas": 1,
        "num_stages": 4,
        "kernel_name": "kernel_bbbda236_0d1d2d34567891011"
    },
    {
        "M": 476,
        "N": 512,
        "K": 512,
        "ldtype": "float16",
        "rdtype": "float16",
        "BLOCK_SIZE_M": 32,
        "BLOCK_SIZE_N": 128,
        "BLOCK_SIZE_K": 32,
        "GROUP_SIZE_M": 8,
        "num_warps": 4,
        "num_ctas": 1,
        "num_stages": 4,
        "kernel_name": "kernel_87e072ae_0d1d2d34567891011"
    },
    {
        "M": 480,
        "N": 512,
        "K": 512,
        "ldtype": "float16",
        "rdtype": "float16",
        "BLOCK_SIZE_M": 32,
        "BLOCK_SIZE_N": 64,
        "BLOCK_SIZE_K": 32,
        "GROUP_SIZE_M": 8,
        "num_warps": 2,
        "num_ctas": 1,
        "num_stages": 4,
        "kernel_name": "kernel_7043566a_0d1d2d34567891011"
    },
    {
        "M": 484,
        "N": 512,
        "K": 512,
        "ldtype": "float16",
        "rdtype": "float16",
        "BLOCK_SIZE_M": 32,
        "BLOCK_SIZE_N": 128,
        "BLOCK_SIZE_K": 32,
        "GROUP_SIZE_M": 8,
        "num_warps": 4,
        "num_ctas": 1,
        "num_stages": 4,
        "kernel_name": "kernel_87e072ae_0d1d2d34567891011"
    },
    {
        "M": 488,
        "N": 512,
        "K": 512,
        "ldtype": "float16",
        "rdtype": "float16",
        "BLOCK_SIZE_M": 32,
        "BLOCK_SIZE_N": 128,
        "BLOCK_SIZE_K": 32,
        "GROUP_SIZE_M": 16,
        "num_warps": 4,
        "num_ctas": 1,
        "num_stages": 4,
        "kernel_name": "kernel_b3d46ea1_0d1d2d34567891011"
    },
    {
        "M": 492,
        "N": 512,
        "K": 512,
        "ldtype": "float16",
        "rdtype": "float16",
        "BLOCK_SIZE_M": 32,
        "BLOCK_SIZE_N": 128,
        "BLOCK_SIZE_K": 32,
        "GROUP_SIZE_M": 8,
        "num_warps": 4,
        "num_ctas": 1,
        "num_stages": 4,
        "kernel_name": "kernel_87e072ae_0d1d2d34567891011"
    },
    {
        "M": 496,
        "N": 512,
        "K": 512,
        "ldtype": "float16",
        "rdtype": "float16",
        "BLOCK_SIZE_M": 32,
        "BLOCK_SIZE_N": 64,
        "BLOCK_SIZE_K": 32,
        "GROUP_SIZE_M": 8,
        "num_warps": 2,
        "num_ctas": 1,
        "num_stages": 5,
        "kernel_name": "kernel_bcc51275_0d1d2d34567891011"
    },
    {
        "M": 500,
        "N": 512,
        "K": 512,
        "ldtype": "float16",
        "rdtype": "float16",
        "BLOCK_SIZE_M": 32,
        "BLOCK_SIZE_N": 64,
        "BLOCK_SIZE_K": 32,
        "GROUP_SIZE_M": 8,
        "num_warps": 2,
        "num_ctas": 1,
        "num_stages": 5,
        "kernel_name": "kernel_bcc51275_0d1d2d34567891011"
    },
    {
        "M": 504,
        "N": 512,
        "K": 512,
        "ldtype": "float16",
        "rdtype": "float16",
        "BLOCK_SIZE_M": 32,
        "BLOCK_SIZE_N": 128,
        "BLOCK_SIZE_K": 32,
        "GROUP_SIZE_M": 8,
        "num_warps": 4,
        "num_ctas": 1,
        "num_stages": 4,
        "kernel_name": "kernel_87e072ae_0d1d2d34567891011"
    },
    {
        "M": 508,
        "N": 512,
        "K": 512,
        "ldtype": "float16",
        "rdtype": "float16",
        "BLOCK_SIZE_M": 32,
        "BLOCK_SIZE_N": 128,
        "BLOCK_SIZE_K": 32,
        "GROUP_SIZE_M": 8,
        "num_warps": 4,
        "num_ctas": 1,
        "num_stages": 4,
        "kernel_name": "kernel_87e072ae_0d1d2d34567891011"
    },
    {
        "M": 512,
        "N": 512,
        "K": 512,
        "ldtype": "float16",
        "rdtype": "float16",
        "BLOCK_SIZE_M": 32,
        "BLOCK_SIZE_N": 128,
        "BLOCK_SIZE_K": 32,
        "GROUP_SIZE_M": 4,
        "num_warps": 4,
        "num_ctas": 1,
        "num_stages": 4,
        "kernel_name": "kernel_c7603356_0d1d2d34567891011"
    },
    {
        "M": 516,
        "N": 512,
        "K": 512,
        "ldtype": "float16",
        "rdtype": "float16",
        "BLOCK_SIZE_M": 32,
        "BLOCK_SIZE_N": 128,
        "BLOCK_SIZE_K": 32,
        "GROUP_SIZE_M": 8,
        "num_warps": 4,
        "num_ctas": 1,
        "num_stages": 4,
        "kernel_name": "kernel_87e072ae_0d1d2d34567891011"
    },
    {
        "M": 520,
        "N": 512,
        "K": 512,
        "ldtype": "float16",
        "rdtype": "float16",
        "BLOCK_SIZE_M": 32,
        "BLOCK_SIZE_N": 128,
        "BLOCK_SIZE_K": 32,
        "GROUP_SIZE_M": 8,
        "num_warps": 4,
        "num_ctas": 1,
        "num_stages": 4,
        "kernel_name": "kernel_87e072ae_0d1d2d34567891011"
    },
    {
        "M": 524,
        "N": 512,
        "K": 512,
        "ldtype": "float16",
        "rdtype": "float16",
        "BLOCK_SIZE_M": 32,
        "BLOCK_SIZE_N": 128,
        "BLOCK_SIZE_K": 32,
        "GROUP_SIZE_M": 4,
        "num_warps": 4,
        "num_ctas": 1,
        "num_stages": 4,
        "kernel_name": "kernel_c7603356_0d1d2d34567891011"
    },
    {
        "M": 528,
        "N": 512,
        "K": 512,
        "ldtype": "float16",
        "rdtype": "float16",
        "BLOCK_SIZE_M": 32,
        "BLOCK_SIZE_N": 128,
        "BLOCK_SIZE_K": 32,
        "GROUP_SIZE_M": 8,
        "num_warps": 4,
        "num_ctas": 1,
        "num_stages": 4,
        "kernel_name": "kernel_87e072ae_0d1d2d34567891011"
    },
    {
        "M": 532,
        "N": 512,
        "K": 512,
        "ldtype": "float16",
        "rdtype": "float16",
        "BLOCK_SIZE_M": 32,
        "BLOCK_SIZE_N": 128,
        "BLOCK_SIZE_K": 32,
        "GROUP_SIZE_M": 8,
        "num_warps": 4,
        "num_ctas": 1,
        "num_stages": 4,
        "kernel_name": "kernel_87e072ae_0d1d2d34567891011"
    },
    {
        "M": 536,
        "N": 512,
        "K": 512,
        "ldtype": "float16",
        "rdtype": "float16",
        "BLOCK_SIZE_M": 32,
        "BLOCK_SIZE_N": 128,
        "BLOCK_SIZE_K": 32,
        "GROUP_SIZE_M": 8,
        "num_warps": 4,
        "num_ctas": 1,
        "num_stages": 4,
        "kernel_name": "kernel_87e072ae_0d1d2d34567891011"
    },
    {
        "M": 540,
        "N": 512,
        "K": 512,
        "ldtype": "float16",
        "rdtype": "float16",
        "BLOCK_SIZE_M": 32,
        "BLOCK_SIZE_N": 128,
        "BLOCK_SIZE_K": 32,
        "GROUP_SIZE_M": 8,
        "num_warps": 4,
        "num_ctas": 1,
        "num_stages": 4,
        "kernel_name": "kernel_87e072ae_0d1d2d34567891011"
    },
    {
        "M": 544,
        "N": 512,
        "K": 512,
        "ldtype": "float16",
        "rdtype": "float16",
        "BLOCK_SIZE_M": 32,
        "BLOCK_SIZE_N": 128,
        "BLOCK_SIZE_K": 32,
        "GROUP_SIZE_M": 8,
        "num_warps": 4,
        "num_ctas": 1,
        "num_stages": 4,
        "kernel_name": "kernel_87e072ae_0d1d2d34567891011"
    },
    {
        "M": 548,
        "N": 512,
        "K": 512,
        "ldtype": "float16",
        "rdtype": "float16",
        "BLOCK_SIZE_M": 32,
        "BLOCK_SIZE_N": 128,
        "BLOCK_SIZE_K": 32,
        "GROUP_SIZE_M": 8,
        "num_warps": 4,
        "num_ctas": 1,
        "num_stages": 4,
        "kernel_name": "kernel_87e072ae_0d1d2d34567891011"
    },
    {
        "M": 552,
        "N": 512,
        "K": 512,
        "ldtype": "float16",
        "rdtype": "float16",
        "BLOCK_SIZE_M": 32,
        "BLOCK_SIZE_N": 128,
        "BLOCK_SIZE_K": 32,
        "GROUP_SIZE_M": 8,
        "num_warps": 4,
        "num_ctas": 1,
        "num_stages": 4,
        "kernel_name": "kernel_87e072ae_0d1d2d34567891011"
    },
    {
        "M": 556,
        "N": 512,
        "K": 512,
        "ldtype": "float16",
        "rdtype": "float16",
        "BLOCK_SIZE_M": 32,
        "BLOCK_SIZE_N": 128,
        "BLOCK_SIZE_K": 32,
        "GROUP_SIZE_M": 8,
        "num_warps": 4,
        "num_ctas": 1,
        "num_stages": 4,
        "kernel_name": "kernel_87e072ae_0d1d2d34567891011"
    },
    {
        "M": 560,
        "N": 512,
        "K": 512,
        "ldtype": "float16",
        "rdtype": "float16",
        "BLOCK_SIZE_M": 32,
        "BLOCK_SIZE_N": 128,
        "BLOCK_SIZE_K": 32,
        "GROUP_SIZE_M": 4,
        "num_warps": 4,
        "num_ctas": 1,
        "num_stages": 4,
        "kernel_name": "kernel_c7603356_0d1d2d34567891011"
    },
    {
        "M": 564,
        "N": 512,
        "K": 512,
        "ldtype": "float16",
        "rdtype": "float16",
        "BLOCK_SIZE_M": 32,
        "BLOCK_SIZE_N": 128,
        "BLOCK_SIZE_K": 32,
        "GROUP_SIZE_M": 8,
        "num_warps": 4,
        "num_ctas": 1,
        "num_stages": 4,
        "kernel_name": "kernel_87e072ae_0d1d2d34567891011"
    },
    {
        "M": 568,
        "N": 512,
        "K": 512,
        "ldtype": "float16",
        "rdtype": "float16",
        "BLOCK_SIZE_M": 32,
        "BLOCK_SIZE_N": 128,
        "BLOCK_SIZE_K": 32,
        "GROUP_SIZE_M": 8,
        "num_warps": 4,
        "num_ctas": 1,
        "num_stages": 4,
        "kernel_name": "kernel_87e072ae_0d1d2d34567891011"
    },
    {
        "M": 572,
        "N": 512,
        "K": 512,
        "ldtype": "float16",
        "rdtype": "float16",
        "BLOCK_SIZE_M": 32,
        "BLOCK_SIZE_N": 128,
        "BLOCK_SIZE_K": 32,
        "GROUP_SIZE_M": 8,
        "num_warps": 4,
        "num_ctas": 1,
        "num_stages": 4,
        "kernel_name": "kernel_87e072ae_0d1d2d34567891011"
    },
    {
        "M": 576,
        "N": 512,
        "K": 512,
        "ldtype": "float16",
        "rdtype": "float16",
        "BLOCK_SIZE_M": 32,
        "BLOCK_SIZE_N": 128,
        "BLOCK_SIZE_K": 32,
        "GROUP_SIZE_M": 8,
        "num_warps": 4,
        "num_ctas": 1,
        "num_stages": 4,
        "kernel_name": "kernel_87e072ae_0d1d2d34567891011"
    },
    {
        "M": 580,
        "N": 512,
        "K": 512,
        "ldtype": "float16",
        "rdtype": "float16",
        "BLOCK_SIZE_M": 64,
        "BLOCK_SIZE_N": 128,
        "BLOCK_SIZE_K": 32,
        "GROUP_SIZE_M": 4,
        "num_warps": 4,
        "num_ctas": 1,
        "num_stages": 5,
        "kernel_name": "kernel_15ac3a21_0d1d2d34567891011"
    },
    {
        "M": 584,
        "N": 512,
        "K": 512,
        "ldtype": "float16",
        "rdtype": "float16",
        "BLOCK_SIZE_M": 64,
        "BLOCK_SIZE_N": 128,
        "BLOCK_SIZE_K": 32,
        "GROUP_SIZE_M": 4,
        "num_warps": 4,
        "num_ctas": 1,
        "num_stages": 5,
        "kernel_name": "kernel_15ac3a21_0d1d2d34567891011"
    },
    {
        "M": 588,
        "N": 512,
        "K": 512,
        "ldtype": "float16",
        "rdtype": "float16",
        "BLOCK_SIZE_M": 128,
        "BLOCK_SIZE_N": 64,
        "BLOCK_SIZE_K": 32,
        "GROUP_SIZE_M": 4,
        "num_warps": 2,
        "num_ctas": 1,
        "num_stages": 5,
        "kernel_name": "kernel_48c1f5c1_0d1d2d34567891011"
    },
    {
        "M": 592,
        "N": 512,
        "K": 512,
        "ldtype": "float16",
        "rdtype": "float16",
        "BLOCK_SIZE_M": 64,
        "BLOCK_SIZE_N": 128,
        "BLOCK_SIZE_K": 32,
        "GROUP_SIZE_M": 4,
        "num_warps": 4,
        "num_ctas": 1,
        "num_stages": 4,
        "kernel_name": "kernel_a060cdab_0d1d2d34567891011"
    },
    {
        "M": 596,
        "N": 512,
        "K": 512,
        "ldtype": "float16",
        "rdtype": "float16",
        "BLOCK_SIZE_M": 64,
        "BLOCK_SIZE_N": 128,
        "BLOCK_SIZE_K": 32,
        "GROUP_SIZE_M": 4,
        "num_warps": 4,
        "num_ctas": 1,
        "num_stages": 4,
        "kernel_name": "kernel_a060cdab_0d1d2d34567891011"
    },
    {
        "M": 600,
        "N": 512,
        "K": 512,
        "ldtype": "float16",
        "rdtype": "float16",
        "BLOCK_SIZE_M": 64,
        "BLOCK_SIZE_N": 128,
        "BLOCK_SIZE_K": 32,
        "GROUP_SIZE_M": 4,
        "num_warps": 4,
        "num_ctas": 1,
        "num_stages": 5,
        "kernel_name": "kernel_15ac3a21_0d1d2d34567891011"
    },
    {
        "M": 604,
        "N": 512,
        "K": 512,
        "ldtype": "float16",
        "rdtype": "float16",
        "BLOCK_SIZE_M": 64,
        "BLOCK_SIZE_N": 128,
        "BLOCK_SIZE_K": 32,
        "GROUP_SIZE_M": 16,
        "num_warps": 4,
        "num_ctas": 1,
        "num_stages": 5,
        "kernel_name": "kernel_4b3dbaf2_0d1d2d34567891011"
    },
    {
        "M": 608,
        "N": 512,
        "K": 512,
        "ldtype": "float16",
        "rdtype": "float16",
        "BLOCK_SIZE_M": 64,
        "BLOCK_SIZE_N": 128,
        "BLOCK_SIZE_K": 32,
        "GROUP_SIZE_M": 4,
        "num_warps": 4,
        "num_ctas": 1,
        "num_stages": 5,
        "kernel_name": "kernel_15ac3a21_0d1d2d34567891011"
    },
    {
        "M": 612,
        "N": 512,
        "K": 512,
        "ldtype": "float16",
        "rdtype": "float16",
        "BLOCK_SIZE_M": 64,
        "BLOCK_SIZE_N": 128,
        "BLOCK_SIZE_K": 32,
        "GROUP_SIZE_M": 4,
        "num_warps": 4,
        "num_ctas": 1,
        "num_stages": 5,
        "kernel_name": "kernel_15ac3a21_0d1d2d34567891011"
    },
    {
        "M": 616,
        "N": 512,
        "K": 512,
        "ldtype": "float16",
        "rdtype": "float16",
        "BLOCK_SIZE_M": 64,
        "BLOCK_SIZE_N": 128,
        "BLOCK_SIZE_K": 32,
        "GROUP_SIZE_M": 4,
        "num_warps": 4,
        "num_ctas": 1,
        "num_stages": 5,
        "kernel_name": "kernel_15ac3a21_0d1d2d34567891011"
    },
    {
        "M": 620,
        "N": 512,
        "K": 512,
        "ldtype": "float16",
        "rdtype": "float16",
        "BLOCK_SIZE_M": 64,
        "BLOCK_SIZE_N": 128,
        "BLOCK_SIZE_K": 32,
        "GROUP_SIZE_M": 4,
        "num_warps": 4,
        "num_ctas": 1,
        "num_stages": 4,
        "kernel_name": "kernel_a060cdab_0d1d2d34567891011"
    },
    {
        "M": 624,
        "N": 512,
        "K": 512,
        "ldtype": "float16",
        "rdtype": "float16",
        "BLOCK_SIZE_M": 64,
        "BLOCK_SIZE_N": 128,
        "BLOCK_SIZE_K": 32,
        "GROUP_SIZE_M": 4,
        "num_warps": 4,
        "num_ctas": 1,
        "num_stages": 5,
        "kernel_name": "kernel_15ac3a21_0d1d2d34567891011"
    },
    {
        "M": 628,
        "N": 512,
        "K": 512,
        "ldtype": "float16",
        "rdtype": "float16",
        "BLOCK_SIZE_M": 128,
        "BLOCK_SIZE_N": 64,
        "BLOCK_SIZE_K": 32,
        "GROUP_SIZE_M": 16,
        "num_warps": 2,
        "num_ctas": 1,
        "num_stages": 5,
        "kernel_name": "kernel_3f6972fa_0d1d2d34567891011"
    },
    {
        "M": 632,
        "N": 512,
        "K": 512,
        "ldtype": "float16",
        "rdtype": "float16",
        "BLOCK_SIZE_M": 64,
        "BLOCK_SIZE_N": 128,
        "BLOCK_SIZE_K": 32,
        "GROUP_SIZE_M": 16,
        "num_warps": 4,
        "num_ctas": 1,
        "num_stages": 5,
        "kernel_name": "kernel_4b3dbaf2_0d1d2d34567891011"
    },
    {
        "M": 636,
        "N": 512,
        "K": 512,
        "ldtype": "float16",
        "rdtype": "float16",
        "BLOCK_SIZE_M": 64,
        "BLOCK_SIZE_N": 128,
        "BLOCK_SIZE_K": 32,
        "GROUP_SIZE_M": 16,
        "num_warps": 4,
        "num_ctas": 1,
        "num_stages": 5,
        "kernel_name": "kernel_4b3dbaf2_0d1d2d34567891011"
    },
    {
        "M": 640,
        "N": 512,
        "K": 512,
        "ldtype": "float16",
        "rdtype": "float16",
        "BLOCK_SIZE_M": 64,
        "BLOCK_SIZE_N": 128,
        "BLOCK_SIZE_K": 32,
        "GROUP_SIZE_M": 4,
        "num_warps": 4,
        "num_ctas": 1,
        "num_stages": 5,
        "kernel_name": "kernel_15ac3a21_0d1d2d34567891011"
    },
    {
        "M": 644,
        "N": 512,
        "K": 512,
        "ldtype": "float16",
        "rdtype": "float16",
        "BLOCK_SIZE_M": 64,
        "BLOCK_SIZE_N": 128,
        "BLOCK_SIZE_K": 32,
        "GROUP_SIZE_M": 16,
        "num_warps": 4,
        "num_ctas": 1,
        "num_stages": 5,
        "kernel_name": "kernel_4b3dbaf2_0d1d2d34567891011"
    },
    {
        "M": 648,
        "N": 512,
        "K": 512,
        "ldtype": "float16",
        "rdtype": "float16",
        "BLOCK_SIZE_M": 128,
        "BLOCK_SIZE_N": 128,
        "BLOCK_SIZE_K": 32,
        "GROUP_SIZE_M": 8,
        "num_warps": 4,
        "num_ctas": 1,
        "num_stages": 5,
        "kernel_name": "kernel_ebec36f8_0d1d2d34567891011"
    },
    {
        "M": 652,
        "N": 512,
        "K": 512,
        "ldtype": "float16",
        "rdtype": "float16",
        "BLOCK_SIZE_M": 64,
        "BLOCK_SIZE_N": 128,
        "BLOCK_SIZE_K": 32,
        "GROUP_SIZE_M": 4,
        "num_warps": 4,
        "num_ctas": 1,
        "num_stages": 5,
        "kernel_name": "kernel_15ac3a21_0d1d2d34567891011"
    },
    {
        "M": 656,
        "N": 512,
        "K": 512,
        "ldtype": "float16",
        "rdtype": "float16",
        "BLOCK_SIZE_M": 64,
        "BLOCK_SIZE_N": 128,
        "BLOCK_SIZE_K": 32,
        "GROUP_SIZE_M": 4,
        "num_warps": 4,
        "num_ctas": 1,
        "num_stages": 5,
        "kernel_name": "kernel_15ac3a21_0d1d2d34567891011"
    },
    {
        "M": 660,
        "N": 512,
        "K": 512,
        "ldtype": "float16",
        "rdtype": "float16",
        "BLOCK_SIZE_M": 64,
        "BLOCK_SIZE_N": 128,
        "BLOCK_SIZE_K": 32,
        "GROUP_SIZE_M": 16,
        "num_warps": 4,
        "num_ctas": 1,
        "num_stages": 5,
        "kernel_name": "kernel_4b3dbaf2_0d1d2d34567891011"
    },
    {
        "M": 664,
        "N": 512,
        "K": 512,
        "ldtype": "float16",
        "rdtype": "float16",
        "BLOCK_SIZE_M": 64,
        "BLOCK_SIZE_N": 128,
        "BLOCK_SIZE_K": 32,
        "GROUP_SIZE_M": 16,
        "num_warps": 4,
        "num_ctas": 1,
        "num_stages": 5,
        "kernel_name": "kernel_4b3dbaf2_0d1d2d34567891011"
    },
    {
        "M": 668,
        "N": 512,
        "K": 512,
        "ldtype": "float16",
        "rdtype": "float16",
        "BLOCK_SIZE_M": 64,
        "BLOCK_SIZE_N": 128,
        "BLOCK_SIZE_K": 32,
        "GROUP_SIZE_M": 4,
        "num_warps": 4,
        "num_ctas": 1,
        "num_stages": 5,
        "kernel_name": "kernel_15ac3a21_0d1d2d34567891011"
    },
    {
        "M": 672,
        "N": 512,
        "K": 512,
        "ldtype": "float16",
        "rdtype": "float16",
        "BLOCK_SIZE_M": 64,
        "BLOCK_SIZE_N": 128,
        "BLOCK_SIZE_K": 32,
        "GROUP_SIZE_M": 4,
        "num_warps": 4,
        "num_ctas": 1,
        "num_stages": 5,
        "kernel_name": "kernel_15ac3a21_0d1d2d34567891011"
    },
    {
        "M": 676,
        "N": 512,
        "K": 512,
        "ldtype": "float16",
        "rdtype": "float16",
        "BLOCK_SIZE_M": 64,
        "BLOCK_SIZE_N": 128,
        "BLOCK_SIZE_K": 32,
        "GROUP_SIZE_M": 4,
        "num_warps": 4,
        "num_ctas": 1,
        "num_stages": 5,
        "kernel_name": "kernel_15ac3a21_0d1d2d34567891011"
    },
    {
        "M": 680,
        "N": 512,
        "K": 512,
        "ldtype": "float16",
        "rdtype": "float16",
        "BLOCK_SIZE_M": 64,
        "BLOCK_SIZE_N": 128,
        "BLOCK_SIZE_K": 32,
        "GROUP_SIZE_M": 16,
        "num_warps": 4,
        "num_ctas": 1,
        "num_stages": 5,
        "kernel_name": "kernel_4b3dbaf2_0d1d2d34567891011"
    },
    {
        "M": 684,
        "N": 512,
        "K": 512,
        "ldtype": "float16",
        "rdtype": "float16",
        "BLOCK_SIZE_M": 128,
        "BLOCK_SIZE_N": 128,
        "BLOCK_SIZE_K": 32,
        "GROUP_SIZE_M": 8,
        "num_warps": 4,
        "num_ctas": 1,
        "num_stages": 5,
        "kernel_name": "kernel_ebec36f8_0d1d2d34567891011"
    },
    {
        "M": 688,
        "N": 512,
        "K": 512,
        "ldtype": "float16",
        "rdtype": "float16",
        "BLOCK_SIZE_M": 64,
        "BLOCK_SIZE_N": 128,
        "BLOCK_SIZE_K": 32,
        "GROUP_SIZE_M": 16,
        "num_warps": 4,
        "num_ctas": 1,
        "num_stages": 5,
        "kernel_name": "kernel_4b3dbaf2_0d1d2d34567891011"
    },
    {
        "M": 692,
        "N": 512,
        "K": 512,
        "ldtype": "float16",
        "rdtype": "float16",
        "BLOCK_SIZE_M": 128,
        "BLOCK_SIZE_N": 128,
        "BLOCK_SIZE_K": 32,
        "GROUP_SIZE_M": 4,
        "num_warps": 4,
        "num_ctas": 1,
        "num_stages": 5,
        "kernel_name": "kernel_b666123f_0d1d2d34567891011"
    },
    {
        "M": 696,
        "N": 512,
        "K": 512,
        "ldtype": "float16",
        "rdtype": "float16",
        "BLOCK_SIZE_M": 128,
        "BLOCK_SIZE_N": 128,
        "BLOCK_SIZE_K": 32,
        "GROUP_SIZE_M": 8,
        "num_warps": 4,
        "num_ctas": 1,
        "num_stages": 5,
        "kernel_name": "kernel_ebec36f8_0d1d2d34567891011"
    },
    {
        "M": 700,
        "N": 512,
        "K": 512,
        "ldtype": "float16",
        "rdtype": "float16",
        "BLOCK_SIZE_M": 64,
        "BLOCK_SIZE_N": 64,
        "BLOCK_SIZE_K": 32,
        "GROUP_SIZE_M": 4,
        "num_warps": 2,
        "num_ctas": 1,
        "num_stages": 4,
        "kernel_name": "kernel_5d1ee156_0d1d2d34567891011"
    },
    {
        "M": 704,
        "N": 512,
        "K": 512,
        "ldtype": "float16",
        "rdtype": "float16",
        "BLOCK_SIZE_M": 64,
        "BLOCK_SIZE_N": 128,
        "BLOCK_SIZE_K": 32,
        "GROUP_SIZE_M": 8,
        "num_warps": 4,
        "num_ctas": 1,
        "num_stages": 5,
        "kernel_name": "kernel_ad3cdaa0_0d1d2d34567891011"
    },
    {
        "M": 708,
        "N": 512,
        "K": 512,
        "ldtype": "float16",
        "rdtype": "float16",
        "BLOCK_SIZE_M": 128,
        "BLOCK_SIZE_N": 64,
        "BLOCK_SIZE_K": 32,
        "GROUP_SIZE_M": 8,
        "num_warps": 2,
        "num_ctas": 1,
        "num_stages": 4,
        "kernel_name": "kernel_cec29660_0d1d2d34567891011"
    },
    {
        "M": 712,
        "N": 512,
        "K": 512,
        "ldtype": "float16",
        "rdtype": "float16",
        "BLOCK_SIZE_M": 128,
        "BLOCK_SIZE_N": 64,
        "BLOCK_SIZE_K": 32,
        "GROUP_SIZE_M": 4,
        "num_warps": 2,
        "num_ctas": 1,
        "num_stages": 5,
        "kernel_name": "kernel_48c1f5c1_0d1d2d34567891011"
    },
    {
        "M": 716,
        "N": 512,
        "K": 512,
        "ldtype": "float16",
        "rdtype": "float16",
        "BLOCK_SIZE_M": 128,
        "BLOCK_SIZE_N": 128,
        "BLOCK_SIZE_K": 32,
        "GROUP_SIZE_M": 8,
        "num_warps": 4,
        "num_ctas": 1,
        "num_stages": 5,
        "kernel_name": "kernel_ebec36f8_0d1d2d34567891011"
    },
    {
        "M": 720,
        "N": 512,
        "K": 512,
        "ldtype": "float16",
        "rdtype": "float16",
        "BLOCK_SIZE_M": 128,
        "BLOCK_SIZE_N": 64,
        "BLOCK_SIZE_K": 32,
        "GROUP_SIZE_M": 4,
        "num_warps": 2,
        "num_ctas": 1,
        "num_stages": 5,
        "kernel_name": "kernel_48c1f5c1_0d1d2d34567891011"
    },
    {
        "M": 724,
        "N": 512,
        "K": 512,
        "ldtype": "float16",
        "rdtype": "float16",
        "BLOCK_SIZE_M": 64,
        "BLOCK_SIZE_N": 128,
        "BLOCK_SIZE_K": 32,
        "GROUP_SIZE_M": 4,
        "num_warps": 4,
        "num_ctas": 1,
        "num_stages": 5,
        "kernel_name": "kernel_15ac3a21_0d1d2d34567891011"
    },
    {
        "M": 728,
        "N": 512,
        "K": 512,
        "ldtype": "float16",
        "rdtype": "float16",
        "BLOCK_SIZE_M": 128,
        "BLOCK_SIZE_N": 64,
        "BLOCK_SIZE_K": 32,
        "GROUP_SIZE_M": 8,
        "num_warps": 2,
        "num_ctas": 1,
        "num_stages": 4,
        "kernel_name": "kernel_cec29660_0d1d2d34567891011"
    },
    {
        "M": 732,
        "N": 512,
        "K": 512,
        "ldtype": "float16",
        "rdtype": "float16",
        "BLOCK_SIZE_M": 128,
        "BLOCK_SIZE_N": 64,
        "BLOCK_SIZE_K": 32,
        "GROUP_SIZE_M": 8,
        "num_warps": 2,
        "num_ctas": 1,
        "num_stages": 5,
        "kernel_name": "kernel_d55fb2e9_0d1d2d34567891011"
    },
    {
        "M": 736,
        "N": 512,
        "K": 512,
        "ldtype": "float16",
        "rdtype": "float16",
        "BLOCK_SIZE_M": 128,
        "BLOCK_SIZE_N": 128,
        "BLOCK_SIZE_K": 32,
        "GROUP_SIZE_M": 8,
        "num_warps": 4,
        "num_ctas": 1,
        "num_stages": 5,
        "kernel_name": "kernel_ebec36f8_0d1d2d34567891011"
    },
    {
        "M": 740,
        "N": 512,
        "K": 512,
        "ldtype": "float16",
        "rdtype": "float16",
        "BLOCK_SIZE_M": 128,
        "BLOCK_SIZE_N": 64,
        "BLOCK_SIZE_K": 32,
        "GROUP_SIZE_M": 16,
        "num_warps": 2,
        "num_ctas": 1,
        "num_stages": 5,
        "kernel_name": "kernel_3f6972fa_0d1d2d34567891011"
    },
    {
        "M": 744,
        "N": 512,
        "K": 512,
        "ldtype": "float16",
        "rdtype": "float16",
        "BLOCK_SIZE_M": 128,
        "BLOCK_SIZE_N": 128,
        "BLOCK_SIZE_K": 32,
        "GROUP_SIZE_M": 4,
        "num_warps": 4,
        "num_ctas": 1,
        "num_stages": 5,
        "kernel_name": "kernel_b666123f_0d1d2d34567891011"
    },
    {
        "M": 748,
        "N": 512,
        "K": 512,
        "ldtype": "float16",
        "rdtype": "float16",
        "BLOCK_SIZE_M": 64,
        "BLOCK_SIZE_N": 128,
        "BLOCK_SIZE_K": 32,
        "GROUP_SIZE_M": 4,
        "num_warps": 4,
        "num_ctas": 1,
        "num_stages": 5,
        "kernel_name": "kernel_15ac3a21_0d1d2d34567891011"
    },
    {
        "M": 752,
        "N": 512,
        "K": 512,
        "ldtype": "float16",
        "rdtype": "float16",
        "BLOCK_SIZE_M": 128,
        "BLOCK_SIZE_N": 64,
        "BLOCK_SIZE_K": 32,
        "GROUP_SIZE_M": 8,
        "num_warps": 2,
        "num_ctas": 1,
        "num_stages": 5,
        "kernel_name": "kernel_d55fb2e9_0d1d2d34567891011"
    },
    {
        "M": 756,
        "N": 512,
        "K": 512,
        "ldtype": "float16",
        "rdtype": "float16",
        "BLOCK_SIZE_M": 128,
        "BLOCK_SIZE_N": 64,
        "BLOCK_SIZE_K": 32,
        "GROUP_SIZE_M": 16,
        "num_warps": 2,
        "num_ctas": 1,
        "num_stages": 5,
        "kernel_name": "kernel_3f6972fa_0d1d2d34567891011"
    },
    {
        "M": 760,
        "N": 512,
        "K": 512,
        "ldtype": "float16",
        "rdtype": "float16",
        "BLOCK_SIZE_M": 128,
        "BLOCK_SIZE_N": 64,
        "BLOCK_SIZE_K": 32,
        "GROUP_SIZE_M": 16,
        "num_warps": 2,
        "num_ctas": 1,
        "num_stages": 5,
        "kernel_name": "kernel_3f6972fa_0d1d2d34567891011"
    },
    {
        "M": 764,
        "N": 512,
        "K": 512,
        "ldtype": "float16",
        "rdtype": "float16",
        "BLOCK_SIZE_M": 128,
        "BLOCK_SIZE_N": 64,
        "BLOCK_SIZE_K": 32,
        "GROUP_SIZE_M": 4,
        "num_warps": 2,
        "num_ctas": 1,
        "num_stages": 4,
        "kernel_name": "kernel_2526d53b_0d1d2d34567891011"
    },
    {
        "M": 768,
        "N": 512,
        "K": 512,
        "ldtype": "float16",
        "rdtype": "float16",
        "BLOCK_SIZE_M": 64,
        "BLOCK_SIZE_N": 128,
        "BLOCK_SIZE_K": 32,
        "GROUP_SIZE_M": 4,
        "num_warps": 4,
        "num_ctas": 1,
        "num_stages": 5,
        "kernel_name": "kernel_15ac3a21_0d1d2d34567891011"
    },
    {
        "M": 772,
        "N": 512,
        "K": 512,
        "ldtype": "float16",
        "rdtype": "float16",
        "BLOCK_SIZE_M": 32,
        "BLOCK_SIZE_N": 128,
        "BLOCK_SIZE_K": 32,
        "GROUP_SIZE_M": 8,
        "num_warps": 4,
        "num_ctas": 1,
        "num_stages": 4,
        "kernel_name": "kernel_87e072ae_0d1d2d34567891011"
    },
    {
        "M": 776,
        "N": 512,
        "K": 512,
        "ldtype": "float16",
        "rdtype": "float16",
        "BLOCK_SIZE_M": 32,
        "BLOCK_SIZE_N": 128,
        "BLOCK_SIZE_K": 32,
        "GROUP_SIZE_M": 16,
        "num_warps": 4,
        "num_ctas": 1,
        "num_stages": 4,
        "kernel_name": "kernel_b3d46ea1_0d1d2d34567891011"
    },
    {
        "M": 780,
        "N": 512,
        "K": 512,
        "ldtype": "float16",
        "rdtype": "float16",
        "BLOCK_SIZE_M": 32,
        "BLOCK_SIZE_N": 128,
        "BLOCK_SIZE_K": 32,
        "GROUP_SIZE_M": 16,
        "num_warps": 4,
        "num_ctas": 1,
        "num_stages": 4,
        "kernel_name": "kernel_b3d46ea1_0d1d2d34567891011"
    },
    {
        "M": 784,
        "N": 512,
        "K": 512,
        "ldtype": "float16",
        "rdtype": "float16",
        "BLOCK_SIZE_M": 32,
        "BLOCK_SIZE_N": 128,
        "BLOCK_SIZE_K": 32,
        "GROUP_SIZE_M": 8,
        "num_warps": 4,
        "num_ctas": 1,
        "num_stages": 4,
        "kernel_name": "kernel_87e072ae_0d1d2d34567891011"
    },
    {
        "M": 788,
        "N": 512,
        "K": 512,
        "ldtype": "float16",
        "rdtype": "float16",
        "BLOCK_SIZE_M": 32,
        "BLOCK_SIZE_N": 128,
        "BLOCK_SIZE_K": 32,
        "GROUP_SIZE_M": 16,
        "num_warps": 4,
        "num_ctas": 1,
        "num_stages": 4,
        "kernel_name": "kernel_b3d46ea1_0d1d2d34567891011"
    },
    {
        "M": 792,
        "N": 512,
        "K": 512,
        "ldtype": "float16",
        "rdtype": "float16",
        "BLOCK_SIZE_M": 32,
        "BLOCK_SIZE_N": 128,
        "BLOCK_SIZE_K": 32,
        "GROUP_SIZE_M": 16,
        "num_warps": 4,
        "num_ctas": 1,
        "num_stages": 4,
        "kernel_name": "kernel_b3d46ea1_0d1d2d34567891011"
    },
    {
        "M": 796,
        "N": 512,
        "K": 512,
        "ldtype": "float16",
        "rdtype": "float16",
        "BLOCK_SIZE_M": 32,
        "BLOCK_SIZE_N": 128,
        "BLOCK_SIZE_K": 32,
        "GROUP_SIZE_M": 16,
        "num_warps": 4,
        "num_ctas": 1,
        "num_stages": 4,
        "kernel_name": "kernel_b3d46ea1_0d1d2d34567891011"
    },
    {
        "M": 800,
        "N": 512,
        "K": 512,
        "ldtype": "float16",
        "rdtype": "float16",
        "BLOCK_SIZE_M": 32,
        "BLOCK_SIZE_N": 128,
        "BLOCK_SIZE_K": 32,
        "GROUP_SIZE_M": 8,
        "num_warps": 4,
        "num_ctas": 1,
        "num_stages": 4,
        "kernel_name": "kernel_87e072ae_0d1d2d34567891011"
    },
    {
        "M": 804,
        "N": 512,
        "K": 512,
        "ldtype": "float16",
        "rdtype": "float16",
        "BLOCK_SIZE_M": 32,
        "BLOCK_SIZE_N": 128,
        "BLOCK_SIZE_K": 32,
        "GROUP_SIZE_M": 16,
        "num_warps": 4,
        "num_ctas": 1,
        "num_stages": 4,
        "kernel_name": "kernel_b3d46ea1_0d1d2d34567891011"
    },
    {
        "M": 808,
        "N": 512,
        "K": 512,
        "ldtype": "float16",
        "rdtype": "float16",
        "BLOCK_SIZE_M": 32,
        "BLOCK_SIZE_N": 128,
        "BLOCK_SIZE_K": 32,
        "GROUP_SIZE_M": 16,
        "num_warps": 4,
        "num_ctas": 1,
        "num_stages": 4,
        "kernel_name": "kernel_b3d46ea1_0d1d2d34567891011"
    },
    {
        "M": 812,
        "N": 512,
        "K": 512,
        "ldtype": "float16",
        "rdtype": "float16",
        "BLOCK_SIZE_M": 32,
        "BLOCK_SIZE_N": 128,
        "BLOCK_SIZE_K": 32,
        "GROUP_SIZE_M": 16,
        "num_warps": 4,
        "num_ctas": 1,
        "num_stages": 4,
        "kernel_name": "kernel_b3d46ea1_0d1d2d34567891011"
    },
    {
        "M": 816,
        "N": 512,
        "K": 512,
        "ldtype": "float16",
        "rdtype": "float16",
        "BLOCK_SIZE_M": 32,
        "BLOCK_SIZE_N": 128,
        "BLOCK_SIZE_K": 32,
        "GROUP_SIZE_M": 8,
        "num_warps": 4,
        "num_ctas": 1,
        "num_stages": 4,
        "kernel_name": "kernel_87e072ae_0d1d2d34567891011"
    },
    {
        "M": 820,
        "N": 512,
        "K": 512,
        "ldtype": "float16",
        "rdtype": "float16",
        "BLOCK_SIZE_M": 32,
        "BLOCK_SIZE_N": 128,
        "BLOCK_SIZE_K": 32,
        "GROUP_SIZE_M": 16,
        "num_warps": 4,
        "num_ctas": 1,
        "num_stages": 4,
        "kernel_name": "kernel_b3d46ea1_0d1d2d34567891011"
    },
    {
        "M": 824,
        "N": 512,
        "K": 512,
        "ldtype": "float16",
        "rdtype": "float16",
        "BLOCK_SIZE_M": 32,
        "BLOCK_SIZE_N": 128,
        "BLOCK_SIZE_K": 32,
        "GROUP_SIZE_M": 16,
        "num_warps": 4,
        "num_ctas": 1,
        "num_stages": 4,
        "kernel_name": "kernel_b3d46ea1_0d1d2d34567891011"
    },
    {
        "M": 828,
        "N": 512,
        "K": 512,
        "ldtype": "float16",
        "rdtype": "float16",
        "BLOCK_SIZE_M": 32,
        "BLOCK_SIZE_N": 128,
        "BLOCK_SIZE_K": 32,
        "GROUP_SIZE_M": 16,
        "num_warps": 4,
        "num_ctas": 1,
        "num_stages": 4,
        "kernel_name": "kernel_b3d46ea1_0d1d2d34567891011"
    },
    {
        "M": 832,
        "N": 512,
        "K": 512,
        "ldtype": "float16",
        "rdtype": "float16",
        "BLOCK_SIZE_M": 32,
        "BLOCK_SIZE_N": 128,
        "BLOCK_SIZE_K": 32,
        "GROUP_SIZE_M": 8,
        "num_warps": 4,
        "num_ctas": 1,
        "num_stages": 4,
        "kernel_name": "kernel_87e072ae_0d1d2d34567891011"
    },
    {
        "M": 836,
        "N": 512,
        "K": 512,
        "ldtype": "float16",
        "rdtype": "float16",
        "BLOCK_SIZE_M": 32,
        "BLOCK_SIZE_N": 128,
        "BLOCK_SIZE_K": 32,
        "GROUP_SIZE_M": 4,
        "num_warps": 4,
        "num_ctas": 1,
        "num_stages": 4,
        "kernel_name": "kernel_c7603356_0d1d2d34567891011"
    },
    {
        "M": 840,
        "N": 512,
        "K": 512,
        "ldtype": "float16",
        "rdtype": "float16",
        "BLOCK_SIZE_M": 32,
        "BLOCK_SIZE_N": 128,
        "BLOCK_SIZE_K": 32,
        "GROUP_SIZE_M": 16,
        "num_warps": 4,
        "num_ctas": 1,
        "num_stages": 4,
        "kernel_name": "kernel_b3d46ea1_0d1d2d34567891011"
    },
    {
        "M": 844,
        "N": 512,
        "K": 512,
        "ldtype": "float16",
        "rdtype": "float16",
        "BLOCK_SIZE_M": 32,
        "BLOCK_SIZE_N": 128,
        "BLOCK_SIZE_K": 32,
        "GROUP_SIZE_M": 8,
        "num_warps": 4,
        "num_ctas": 1,
        "num_stages": 4,
        "kernel_name": "kernel_87e072ae_0d1d2d34567891011"
    },
    {
        "M": 848,
        "N": 512,
        "K": 512,
        "ldtype": "float16",
        "rdtype": "float16",
        "BLOCK_SIZE_M": 32,
        "BLOCK_SIZE_N": 128,
        "BLOCK_SIZE_K": 32,
        "GROUP_SIZE_M": 16,
        "num_warps": 4,
        "num_ctas": 1,
        "num_stages": 4,
        "kernel_name": "kernel_b3d46ea1_0d1d2d34567891011"
    },
    {
        "M": 852,
        "N": 512,
        "K": 512,
        "ldtype": "float16",
        "rdtype": "float16",
        "BLOCK_SIZE_M": 32,
        "BLOCK_SIZE_N": 128,
        "BLOCK_SIZE_K": 32,
        "GROUP_SIZE_M": 16,
        "num_warps": 4,
        "num_ctas": 1,
        "num_stages": 4,
        "kernel_name": "kernel_b3d46ea1_0d1d2d34567891011"
    },
    {
        "M": 856,
        "N": 512,
        "K": 512,
        "ldtype": "float16",
        "rdtype": "float16",
        "BLOCK_SIZE_M": 32,
        "BLOCK_SIZE_N": 128,
        "BLOCK_SIZE_K": 32,
        "GROUP_SIZE_M": 16,
        "num_warps": 4,
        "num_ctas": 1,
        "num_stages": 4,
        "kernel_name": "kernel_b3d46ea1_0d1d2d34567891011"
    },
    {
        "M": 860,
        "N": 512,
        "K": 512,
        "ldtype": "float16",
        "rdtype": "float16",
        "BLOCK_SIZE_M": 32,
        "BLOCK_SIZE_N": 64,
        "BLOCK_SIZE_K": 32,
        "GROUP_SIZE_M": 16,
        "num_warps": 2,
        "num_ctas": 1,
        "num_stages": 4,
        "kernel_name": "kernel_492f21b7_0d1d2d34567891011"
    },
    {
        "M": 864,
        "N": 512,
        "K": 512,
        "ldtype": "float16",
        "rdtype": "float16",
        "BLOCK_SIZE_M": 32,
        "BLOCK_SIZE_N": 128,
        "BLOCK_SIZE_K": 32,
        "GROUP_SIZE_M": 4,
        "num_warps": 4,
        "num_ctas": 1,
        "num_stages": 4,
        "kernel_name": "kernel_c7603356_0d1d2d34567891011"
    },
    {
        "M": 868,
        "N": 512,
        "K": 512,
        "ldtype": "float16",
        "rdtype": "float16",
        "BLOCK_SIZE_M": 32,
        "BLOCK_SIZE_N": 128,
        "BLOCK_SIZE_K": 32,
        "GROUP_SIZE_M": 16,
        "num_warps": 4,
        "num_ctas": 1,
        "num_stages": 4,
        "kernel_name": "kernel_b3d46ea1_0d1d2d34567891011"
    },
    {
        "M": 872,
        "N": 512,
        "K": 512,
        "ldtype": "float16",
        "rdtype": "float16",
        "BLOCK_SIZE_M": 32,
        "BLOCK_SIZE_N": 128,
        "BLOCK_SIZE_K": 32,
        "GROUP_SIZE_M": 16,
        "num_warps": 4,
        "num_ctas": 1,
        "num_stages": 4,
        "kernel_name": "kernel_b3d46ea1_0d1d2d34567891011"
    },
    {
        "M": 876,
        "N": 512,
        "K": 512,
        "ldtype": "float16",
        "rdtype": "float16",
        "BLOCK_SIZE_M": 32,
        "BLOCK_SIZE_N": 128,
        "BLOCK_SIZE_K": 32,
        "GROUP_SIZE_M": 16,
        "num_warps": 4,
        "num_ctas": 1,
        "num_stages": 4,
        "kernel_name": "kernel_b3d46ea1_0d1d2d34567891011"
    },
    {
        "M": 880,
        "N": 512,
        "K": 512,
        "ldtype": "float16",
        "rdtype": "float16",
        "BLOCK_SIZE_M": 32,
        "BLOCK_SIZE_N": 128,
        "BLOCK_SIZE_K": 32,
        "GROUP_SIZE_M": 16,
        "num_warps": 4,
        "num_ctas": 1,
        "num_stages": 4,
        "kernel_name": "kernel_b3d46ea1_0d1d2d34567891011"
    },
    {
        "M": 884,
        "N": 512,
        "K": 512,
        "ldtype": "float16",
        "rdtype": "float16",
        "BLOCK_SIZE_M": 32,
        "BLOCK_SIZE_N": 128,
        "BLOCK_SIZE_K": 32,
        "GROUP_SIZE_M": 16,
        "num_warps": 4,
        "num_ctas": 1,
        "num_stages": 4,
        "kernel_name": "kernel_b3d46ea1_0d1d2d34567891011"
    },
    {
        "M": 888,
        "N": 512,
        "K": 512,
        "ldtype": "float16",
        "rdtype": "float16",
        "BLOCK_SIZE_M": 32,
        "BLOCK_SIZE_N": 128,
        "BLOCK_SIZE_K": 32,
        "GROUP_SIZE_M": 16,
        "num_warps": 4,
        "num_ctas": 1,
        "num_stages": 4,
        "kernel_name": "kernel_b3d46ea1_0d1d2d34567891011"
    },
    {
        "M": 892,
        "N": 512,
        "K": 512,
        "ldtype": "float16",
        "rdtype": "float16",
        "BLOCK_SIZE_M": 32,
        "BLOCK_SIZE_N": 128,
        "BLOCK_SIZE_K": 32,
        "GROUP_SIZE_M": 16,
        "num_warps": 4,
        "num_ctas": 1,
        "num_stages": 4,
        "kernel_name": "kernel_b3d46ea1_0d1d2d34567891011"
    },
    {
        "M": 896,
        "N": 512,
        "K": 512,
        "ldtype": "float16",
        "rdtype": "float16",
        "BLOCK_SIZE_M": 32,
        "BLOCK_SIZE_N": 128,
        "BLOCK_SIZE_K": 32,
        "GROUP_SIZE_M": 16,
        "num_warps": 4,
        "num_ctas": 1,
        "num_stages": 4,
        "kernel_name": "kernel_b3d46ea1_0d1d2d34567891011"
    },
    {
        "M": 900,
        "N": 512,
        "K": 512,
        "ldtype": "float16",
        "rdtype": "float16",
        "BLOCK_SIZE_M": 32,
        "BLOCK_SIZE_N": 128,
        "BLOCK_SIZE_K": 32,
        "GROUP_SIZE_M": 4,
        "num_warps": 4,
        "num_ctas": 1,
        "num_stages": 4,
        "kernel_name": "kernel_c7603356_0d1d2d34567891011"
    },
    {
        "M": 904,
        "N": 512,
        "K": 512,
        "ldtype": "float16",
        "rdtype": "float16",
        "BLOCK_SIZE_M": 32,
        "BLOCK_SIZE_N": 128,
        "BLOCK_SIZE_K": 32,
        "GROUP_SIZE_M": 16,
        "num_warps": 4,
        "num_ctas": 1,
        "num_stages": 4,
        "kernel_name": "kernel_b3d46ea1_0d1d2d34567891011"
    },
    {
        "M": 908,
        "N": 512,
        "K": 512,
        "ldtype": "float16",
        "rdtype": "float16",
        "BLOCK_SIZE_M": 32,
        "BLOCK_SIZE_N": 128,
        "BLOCK_SIZE_K": 32,
        "GROUP_SIZE_M": 16,
        "num_warps": 4,
        "num_ctas": 1,
        "num_stages": 4,
        "kernel_name": "kernel_b3d46ea1_0d1d2d34567891011"
    },
    {
        "M": 912,
        "N": 512,
        "K": 512,
        "ldtype": "float16",
        "rdtype": "float16",
        "BLOCK_SIZE_M": 32,
        "BLOCK_SIZE_N": 128,
        "BLOCK_SIZE_K": 32,
        "GROUP_SIZE_M": 16,
        "num_warps": 4,
        "num_ctas": 1,
        "num_stages": 4,
        "kernel_name": "kernel_b3d46ea1_0d1d2d34567891011"
    },
    {
        "M": 916,
        "N": 512,
        "K": 512,
        "ldtype": "float16",
        "rdtype": "float16",
        "BLOCK_SIZE_M": 32,
        "BLOCK_SIZE_N": 128,
        "BLOCK_SIZE_K": 32,
        "GROUP_SIZE_M": 8,
        "num_warps": 4,
        "num_ctas": 1,
        "num_stages": 4,
        "kernel_name": "kernel_87e072ae_0d1d2d34567891011"
    },
    {
        "M": 920,
        "N": 512,
        "K": 512,
        "ldtype": "float16",
        "rdtype": "float16",
        "BLOCK_SIZE_M": 32,
        "BLOCK_SIZE_N": 128,
        "BLOCK_SIZE_K": 32,
        "GROUP_SIZE_M": 16,
        "num_warps": 4,
        "num_ctas": 1,
        "num_stages": 4,
        "kernel_name": "kernel_b3d46ea1_0d1d2d34567891011"
    },
    {
        "M": 924,
        "N": 512,
        "K": 512,
        "ldtype": "float16",
        "rdtype": "float16",
        "BLOCK_SIZE_M": 32,
        "BLOCK_SIZE_N": 128,
        "BLOCK_SIZE_K": 32,
        "GROUP_SIZE_M": 16,
        "num_warps": 4,
        "num_ctas": 1,
        "num_stages": 4,
        "kernel_name": "kernel_b3d46ea1_0d1d2d34567891011"
    },
    {
        "M": 928,
        "N": 512,
        "K": 512,
        "ldtype": "float16",
        "rdtype": "float16",
        "BLOCK_SIZE_M": 32,
        "BLOCK_SIZE_N": 128,
        "BLOCK_SIZE_K": 32,
        "GROUP_SIZE_M": 8,
        "num_warps": 4,
        "num_ctas": 1,
        "num_stages": 4,
        "kernel_name": "kernel_87e072ae_0d1d2d34567891011"
    },
    {
        "M": 932,
        "N": 512,
        "K": 512,
        "ldtype": "float16",
        "rdtype": "float16",
        "BLOCK_SIZE_M": 32,
        "BLOCK_SIZE_N": 128,
        "BLOCK_SIZE_K": 32,
        "GROUP_SIZE_M": 16,
        "num_warps": 4,
        "num_ctas": 1,
        "num_stages": 4,
        "kernel_name": "kernel_b3d46ea1_0d1d2d34567891011"
    },
    {
        "M": 936,
        "N": 512,
        "K": 512,
        "ldtype": "float16",
        "rdtype": "float16",
        "BLOCK_SIZE_M": 32,
        "BLOCK_SIZE_N": 128,
        "BLOCK_SIZE_K": 32,
        "GROUP_SIZE_M": 8,
        "num_warps": 4,
        "num_ctas": 1,
        "num_stages": 4,
        "kernel_name": "kernel_87e072ae_0d1d2d34567891011"
    },
    {
        "M": 940,
        "N": 512,
        "K": 512,
        "ldtype": "float16",
        "rdtype": "float16",
        "BLOCK_SIZE_M": 32,
        "BLOCK_SIZE_N": 128,
        "BLOCK_SIZE_K": 32,
        "GROUP_SIZE_M": 16,
        "num_warps": 4,
        "num_ctas": 1,
        "num_stages": 4,
        "kernel_name": "kernel_b3d46ea1_0d1d2d34567891011"
    },
    {
        "M": 944,
        "N": 512,
        "K": 512,
        "ldtype": "float16",
        "rdtype": "float16",
        "BLOCK_SIZE_M": 32,
        "BLOCK_SIZE_N": 128,
        "BLOCK_SIZE_K": 32,
        "GROUP_SIZE_M": 16,
        "num_warps": 4,
        "num_ctas": 1,
        "num_stages": 4,
        "kernel_name": "kernel_b3d46ea1_0d1d2d34567891011"
    },
    {
        "M": 948,
        "N": 512,
        "K": 512,
        "ldtype": "float16",
        "rdtype": "float16",
        "BLOCK_SIZE_M": 32,
        "BLOCK_SIZE_N": 128,
        "BLOCK_SIZE_K": 32,
        "GROUP_SIZE_M": 16,
        "num_warps": 4,
        "num_ctas": 1,
        "num_stages": 4,
        "kernel_name": "kernel_b3d46ea1_0d1d2d34567891011"
    },
    {
        "M": 952,
        "N": 512,
        "K": 512,
        "ldtype": "float16",
        "rdtype": "float16",
        "BLOCK_SIZE_M": 32,
        "BLOCK_SIZE_N": 128,
        "BLOCK_SIZE_K": 32,
        "GROUP_SIZE_M": 16,
        "num_warps": 4,
        "num_ctas": 1,
        "num_stages": 4,
        "kernel_name": "kernel_b3d46ea1_0d1d2d34567891011"
    },
    {
        "M": 956,
        "N": 512,
        "K": 512,
        "ldtype": "float16",
        "rdtype": "float16",
        "BLOCK_SIZE_M": 32,
        "BLOCK_SIZE_N": 128,
        "BLOCK_SIZE_K": 32,
        "GROUP_SIZE_M": 8,
        "num_warps": 4,
        "num_ctas": 1,
        "num_stages": 4,
        "kernel_name": "kernel_87e072ae_0d1d2d34567891011"
    },
    {
        "M": 960,
        "N": 512,
        "K": 512,
        "ldtype": "float16",
        "rdtype": "float16",
        "BLOCK_SIZE_M": 32,
        "BLOCK_SIZE_N": 128,
        "BLOCK_SIZE_K": 32,
        "GROUP_SIZE_M": 16,
        "num_warps": 4,
        "num_ctas": 1,
        "num_stages": 4,
        "kernel_name": "kernel_b3d46ea1_0d1d2d34567891011"
    },
    {
        "M": 964,
        "N": 512,
        "K": 512,
        "ldtype": "float16",
        "rdtype": "float16",
        "BLOCK_SIZE_M": 64,
        "BLOCK_SIZE_N": 128,
        "BLOCK_SIZE_K": 32,
        "GROUP_SIZE_M": 8,
        "num_warps": 4,
        "num_ctas": 1,
        "num_stages": 4,
        "kernel_name": "kernel_22e762a8_0d1d2d34567891011"
    },
    {
        "M": 968,
        "N": 512,
        "K": 512,
        "ldtype": "float16",
        "rdtype": "float16",
        "BLOCK_SIZE_M": 64,
        "BLOCK_SIZE_N": 128,
        "BLOCK_SIZE_K": 32,
        "GROUP_SIZE_M": 8,
        "num_warps": 4,
        "num_ctas": 1,
        "num_stages": 4,
        "kernel_name": "kernel_22e762a8_0d1d2d34567891011"
    },
    {
        "M": 972,
        "N": 512,
        "K": 512,
        "ldtype": "float16",
        "rdtype": "float16",
        "BLOCK_SIZE_M": 64,
        "BLOCK_SIZE_N": 128,
        "BLOCK_SIZE_K": 32,
        "GROUP_SIZE_M": 8,
        "num_warps": 4,
        "num_ctas": 1,
        "num_stages": 4,
        "kernel_name": "kernel_22e762a8_0d1d2d34567891011"
    },
    {
        "M": 976,
        "N": 512,
        "K": 512,
        "ldtype": "float16",
        "rdtype": "float16",
        "BLOCK_SIZE_M": 64,
        "BLOCK_SIZE_N": 128,
        "BLOCK_SIZE_K": 32,
        "GROUP_SIZE_M": 8,
        "num_warps": 4,
        "num_ctas": 1,
        "num_stages": 5,
        "kernel_name": "kernel_ad3cdaa0_0d1d2d34567891011"
    },
    {
        "M": 980,
        "N": 512,
        "K": 512,
        "ldtype": "float16",
        "rdtype": "float16",
        "BLOCK_SIZE_M": 64,
        "BLOCK_SIZE_N": 128,
        "BLOCK_SIZE_K": 32,
        "GROUP_SIZE_M": 16,
        "num_warps": 4,
        "num_ctas": 1,
        "num_stages": 5,
        "kernel_name": "kernel_4b3dbaf2_0d1d2d34567891011"
    },
    {
        "M": 984,
        "N": 512,
        "K": 512,
        "ldtype": "float16",
        "rdtype": "float16",
        "BLOCK_SIZE_M": 64,
        "BLOCK_SIZE_N": 128,
        "BLOCK_SIZE_K": 32,
        "GROUP_SIZE_M": 8,
        "num_warps": 4,
        "num_ctas": 1,
        "num_stages": 5,
        "kernel_name": "kernel_ad3cdaa0_0d1d2d34567891011"
    },
    {
        "M": 988,
        "N": 512,
        "K": 512,
        "ldtype": "float16",
        "rdtype": "float16",
        "BLOCK_SIZE_M": 64,
        "BLOCK_SIZE_N": 128,
        "BLOCK_SIZE_K": 32,
        "GROUP_SIZE_M": 8,
        "num_warps": 4,
        "num_ctas": 1,
        "num_stages": 4,
        "kernel_name": "kernel_22e762a8_0d1d2d34567891011"
    },
    {
        "M": 992,
        "N": 512,
        "K": 512,
        "ldtype": "float16",
        "rdtype": "float16",
        "BLOCK_SIZE_M": 64,
        "BLOCK_SIZE_N": 64,
        "BLOCK_SIZE_K": 32,
        "GROUP_SIZE_M": 8,
        "num_warps": 2,
        "num_ctas": 1,
        "num_stages": 4,
        "kernel_name": "kernel_6da0ec73_0d1d2d34567891011"
    },
    {
        "M": 996,
        "N": 512,
        "K": 512,
        "ldtype": "float16",
        "rdtype": "float16",
        "BLOCK_SIZE_M": 64,
        "BLOCK_SIZE_N": 128,
        "BLOCK_SIZE_K": 32,
        "GROUP_SIZE_M": 8,
        "num_warps": 4,
        "num_ctas": 1,
        "num_stages": 5,
        "kernel_name": "kernel_ad3cdaa0_0d1d2d34567891011"
    },
    {
        "M": 1000,
        "N": 512,
        "K": 512,
        "ldtype": "float16",
        "rdtype": "float16",
        "BLOCK_SIZE_M": 64,
        "BLOCK_SIZE_N": 128,
        "BLOCK_SIZE_K": 32,
        "GROUP_SIZE_M": 8,
        "num_warps": 4,
        "num_ctas": 1,
        "num_stages": 5,
        "kernel_name": "kernel_ad3cdaa0_0d1d2d34567891011"
    },
    {
        "M": 1004,
        "N": 512,
        "K": 512,
        "ldtype": "float16",
        "rdtype": "float16",
        "BLOCK_SIZE_M": 64,
        "BLOCK_SIZE_N": 128,
        "BLOCK_SIZE_K": 32,
        "GROUP_SIZE_M": 8,
        "num_warps": 4,
        "num_ctas": 1,
        "num_stages": 5,
        "kernel_name": "kernel_ad3cdaa0_0d1d2d34567891011"
    },
    {
        "M": 1008,
        "N": 512,
        "K": 512,
        "ldtype": "float16",
        "rdtype": "float16",
        "BLOCK_SIZE_M": 64,
        "BLOCK_SIZE_N": 128,
        "BLOCK_SIZE_K": 32,
        "GROUP_SIZE_M": 8,
        "num_warps": 4,
        "num_ctas": 1,
        "num_stages": 4,
        "kernel_name": "kernel_22e762a8_0d1d2d34567891011"
    },
    {
        "M": 1012,
        "N": 512,
        "K": 512,
        "ldtype": "float16",
        "rdtype": "float16",
        "BLOCK_SIZE_M": 64,
        "BLOCK_SIZE_N": 128,
        "BLOCK_SIZE_K": 32,
        "GROUP_SIZE_M": 8,
        "num_warps": 4,
        "num_ctas": 1,
        "num_stages": 4,
        "kernel_name": "kernel_22e762a8_0d1d2d34567891011"
    },
    {
        "M": 1016,
        "N": 512,
        "K": 512,
        "ldtype": "float16",
        "rdtype": "float16",
        "BLOCK_SIZE_M": 64,
        "BLOCK_SIZE_N": 64,
        "BLOCK_SIZE_K": 32,
        "GROUP_SIZE_M": 8,
        "num_warps": 2,
        "num_ctas": 1,
        "num_stages": 4,
        "kernel_name": "kernel_6da0ec73_0d1d2d34567891011"
    },
    {
        "M": 1020,
        "N": 512,
        "K": 512,
        "ldtype": "float16",
        "rdtype": "float16",
        "BLOCK_SIZE_M": 64,
        "BLOCK_SIZE_N": 128,
        "BLOCK_SIZE_K": 32,
        "GROUP_SIZE_M": 8,
        "num_warps": 4,
        "num_ctas": 1,
        "num_stages": 5,
        "kernel_name": "kernel_ad3cdaa0_0d1d2d34567891011"
    },
    {
        "M": 4,
        "N": 512,
        "K": 512,
        "ldtype": "float16",
        "rdtype": "float16",
        "BLOCK_SIZE_M": 16,
        "BLOCK_SIZE_N": 64,
        "BLOCK_SIZE_K": 64,
        "GROUP_SIZE_M": 16,
        "num_warps": 2,
        "num_ctas": 1,
        "num_stages": 4,
        "kernel_name": "kernel_3c1054cf_0d1d2d34567891011"
    },
    {
        "M": 8,
        "N": 512,
        "K": 512,
        "ldtype": "float16",
        "rdtype": "float16",
        "BLOCK_SIZE_M": 32,
        "BLOCK_SIZE_N": 64,
        "BLOCK_SIZE_K": 64,
        "GROUP_SIZE_M": 4,
        "num_warps": 2,
        "num_ctas": 1,
        "num_stages": 5,
        "kernel_name": "kernel_babb08f0_0d1d2d34567891011"
    },
    {
        "M": 12,
        "N": 512,
        "K": 512,
        "ldtype": "float16",
        "rdtype": "float16",
        "BLOCK_SIZE_M": 32,
        "BLOCK_SIZE_N": 64,
        "BLOCK_SIZE_K": 64,
        "GROUP_SIZE_M": 16,
        "num_warps": 2,
        "num_ctas": 1,
        "num_stages": 5,
        "kernel_name": "kernel_cf98af0c_0d1d2d34567891011"
    },
    {
        "M": 16,
        "N": 512,
        "K": 512,
        "ldtype": "float16",
        "rdtype": "float16",
        "BLOCK_SIZE_M": 16,
        "BLOCK_SIZE_N": 64,
        "BLOCK_SIZE_K": 64,
        "GROUP_SIZE_M": 4,
        "num_warps": 2,
        "num_ctas": 1,
        "num_stages": 5,
        "kernel_name": "kernel_719a088d_0d1d2d34567891011"
    },
    {
        "M": 20,
        "N": 512,
        "K": 512,
        "ldtype": "float16",
        "rdtype": "float16",
        "BLOCK_SIZE_M": 32,
        "BLOCK_SIZE_N": 64,
        "BLOCK_SIZE_K": 64,
        "GROUP_SIZE_M": 16,
        "num_warps": 2,
        "num_ctas": 1,
        "num_stages": 5,
        "kernel_name": "kernel_cf98af0c_0d1d2d34567891011"
    },
    {
        "M": 24,
        "N": 512,
        "K": 512,
        "ldtype": "float16",
        "rdtype": "float16",
        "BLOCK_SIZE_M": 32,
        "BLOCK_SIZE_N": 64,
        "BLOCK_SIZE_K": 64,
        "GROUP_SIZE_M": 16,
        "num_warps": 2,
        "num_ctas": 1,
        "num_stages": 5,
        "kernel_name": "kernel_cf98af0c_0d1d2d34567891011"
    },
    {
        "M": 28,
        "N": 512,
        "K": 512,
        "ldtype": "float16",
        "rdtype": "float16",
        "BLOCK_SIZE_M": 32,
        "BLOCK_SIZE_N": 64,
        "BLOCK_SIZE_K": 64,
        "GROUP_SIZE_M": 16,
        "num_warps": 2,
        "num_ctas": 1,
        "num_stages": 5,
        "kernel_name": "kernel_cf98af0c_0d1d2d34567891011"
    },
    {
        "M": 32,
        "N": 512,
        "K": 512,
        "ldtype": "float16",
        "rdtype": "float16",
        "BLOCK_SIZE_M": 32,
        "BLOCK_SIZE_N": 64,
        "BLOCK_SIZE_K": 64,
        "GROUP_SIZE_M": 8,
        "num_warps": 2,
        "num_ctas": 1,
        "num_stages": 5,
        "kernel_name": "kernel_11f7c317_0d1d2d34567891011"
    },
    {
        "M": 36,
        "N": 512,
        "K": 512,
        "ldtype": "float16",
        "rdtype": "float16",
        "BLOCK_SIZE_M": 32,
        "BLOCK_SIZE_N": 64,
        "BLOCK_SIZE_K": 64,
        "GROUP_SIZE_M": 4,
        "num_warps": 2,
        "num_ctas": 1,
        "num_stages": 5,
        "kernel_name": "kernel_babb08f0_0d1d2d34567891011"
    },
    {
        "M": 40,
        "N": 512,
        "K": 512,
        "ldtype": "float16",
        "rdtype": "float16",
        "BLOCK_SIZE_M": 32,
        "BLOCK_SIZE_N": 64,
        "BLOCK_SIZE_K": 64,
        "GROUP_SIZE_M": 4,
        "num_warps": 2,
        "num_ctas": 1,
        "num_stages": 5,
        "kernel_name": "kernel_babb08f0_0d1d2d34567891011"
    },
    {
        "M": 44,
        "N": 512,
        "K": 512,
        "ldtype": "float16",
        "rdtype": "float16",
        "BLOCK_SIZE_M": 32,
        "BLOCK_SIZE_N": 64,
        "BLOCK_SIZE_K": 64,
        "GROUP_SIZE_M": 8,
        "num_warps": 2,
        "num_ctas": 1,
        "num_stages": 5,
        "kernel_name": "kernel_11f7c317_0d1d2d34567891011"
    },
    {
        "M": 48,
        "N": 512,
        "K": 512,
        "ldtype": "float16",
        "rdtype": "float16",
        "BLOCK_SIZE_M": 32,
        "BLOCK_SIZE_N": 64,
        "BLOCK_SIZE_K": 64,
        "GROUP_SIZE_M": 16,
        "num_warps": 2,
        "num_ctas": 1,
        "num_stages": 5,
        "kernel_name": "kernel_cf98af0c_0d1d2d34567891011"
    },
    {
        "M": 52,
        "N": 512,
        "K": 512,
        "ldtype": "float16",
        "rdtype": "float16",
        "BLOCK_SIZE_M": 32,
        "BLOCK_SIZE_N": 64,
        "BLOCK_SIZE_K": 64,
        "GROUP_SIZE_M": 16,
        "num_warps": 2,
        "num_ctas": 1,
        "num_stages": 5,
        "kernel_name": "kernel_cf98af0c_0d1d2d34567891011"
    },
    {
        "M": 56,
        "N": 512,
        "K": 512,
        "ldtype": "float16",
        "rdtype": "float16",
        "BLOCK_SIZE_M": 32,
        "BLOCK_SIZE_N": 64,
        "BLOCK_SIZE_K": 64,
        "GROUP_SIZE_M": 16,
        "num_warps": 2,
        "num_ctas": 1,
        "num_stages": 5,
        "kernel_name": "kernel_cf98af0c_0d1d2d34567891011"
    },
    {
        "M": 60,
        "N": 512,
        "K": 512,
        "ldtype": "float16",
        "rdtype": "float16",
        "BLOCK_SIZE_M": 32,
        "BLOCK_SIZE_N": 64,
        "BLOCK_SIZE_K": 64,
        "GROUP_SIZE_M": 16,
        "num_warps": 2,
        "num_ctas": 1,
        "num_stages": 5,
        "kernel_name": "kernel_cf98af0c_0d1d2d34567891011"
    },
    {
        "M": 64,
        "N": 512,
        "K": 512,
        "ldtype": "float16",
        "rdtype": "float16",
        "BLOCK_SIZE_M": 32,
        "BLOCK_SIZE_N": 64,
        "BLOCK_SIZE_K": 64,
        "GROUP_SIZE_M": 4,
        "num_warps": 2,
        "num_ctas": 1,
        "num_stages": 5,
        "kernel_name": "kernel_babb08f0_0d1d2d34567891011"
    },
    {
        "M": 68,
        "N": 512,
        "K": 512,
        "ldtype": "float16",
        "rdtype": "float16",
        "BLOCK_SIZE_M": 32,
        "BLOCK_SIZE_N": 64,
        "BLOCK_SIZE_K": 64,
        "GROUP_SIZE_M": 16,
        "num_warps": 2,
        "num_ctas": 1,
        "num_stages": 5,
        "kernel_name": "kernel_cf98af0c_0d1d2d34567891011"
    },
    {
        "M": 72,
        "N": 512,
        "K": 512,
        "ldtype": "float16",
        "rdtype": "float16",
        "BLOCK_SIZE_M": 32,
        "BLOCK_SIZE_N": 64,
        "BLOCK_SIZE_K": 64,
        "GROUP_SIZE_M": 16,
        "num_warps": 2,
        "num_ctas": 1,
        "num_stages": 5,
        "kernel_name": "kernel_cf98af0c_0d1d2d34567891011"
    },
    {
        "M": 76,
        "N": 512,
        "K": 512,
        "ldtype": "float16",
        "rdtype": "float16",
        "BLOCK_SIZE_M": 32,
        "BLOCK_SIZE_N": 64,
        "BLOCK_SIZE_K": 64,
        "GROUP_SIZE_M": 16,
        "num_warps": 2,
        "num_ctas": 1,
        "num_stages": 5,
        "kernel_name": "kernel_cf98af0c_0d1d2d34567891011"
    },
    {
        "M": 80,
        "N": 512,
        "K": 512,
        "ldtype": "float16",
        "rdtype": "float16",
        "BLOCK_SIZE_M": 32,
        "BLOCK_SIZE_N": 64,
        "BLOCK_SIZE_K": 64,
        "GROUP_SIZE_M": 16,
        "num_warps": 2,
        "num_ctas": 1,
        "num_stages": 5,
        "kernel_name": "kernel_cf98af0c_0d1d2d34567891011"
    },
    {
        "M": 84,
        "N": 512,
        "K": 512,
        "ldtype": "float16",
        "rdtype": "float16",
        "BLOCK_SIZE_M": 32,
        "BLOCK_SIZE_N": 64,
        "BLOCK_SIZE_K": 64,
        "GROUP_SIZE_M": 8,
        "num_warps": 2,
        "num_ctas": 1,
        "num_stages": 5,
        "kernel_name": "kernel_11f7c317_0d1d2d34567891011"
    },
    {
        "M": 88,
        "N": 512,
        "K": 512,
        "ldtype": "float16",
        "rdtype": "float16",
        "BLOCK_SIZE_M": 32,
        "BLOCK_SIZE_N": 64,
        "BLOCK_SIZE_K": 64,
        "GROUP_SIZE_M": 8,
        "num_warps": 2,
        "num_ctas": 1,
        "num_stages": 5,
        "kernel_name": "kernel_11f7c317_0d1d2d34567891011"
    },
    {
        "M": 92,
        "N": 512,
        "K": 512,
        "ldtype": "float16",
        "rdtype": "float16",
        "BLOCK_SIZE_M": 32,
        "BLOCK_SIZE_N": 64,
        "BLOCK_SIZE_K": 64,
        "GROUP_SIZE_M": 16,
        "num_warps": 2,
        "num_ctas": 1,
        "num_stages": 5,
        "kernel_name": "kernel_cf98af0c_0d1d2d34567891011"
    },
    {
        "M": 96,
        "N": 512,
        "K": 512,
        "ldtype": "float16",
        "rdtype": "float16",
        "BLOCK_SIZE_M": 32,
        "BLOCK_SIZE_N": 64,
        "BLOCK_SIZE_K": 64,
        "GROUP_SIZE_M": 8,
        "num_warps": 2,
        "num_ctas": 1,
        "num_stages": 5,
        "kernel_name": "kernel_11f7c317_0d1d2d34567891011"
    },
    {
        "M": 100,
        "N": 512,
        "K": 512,
        "ldtype": "float16",
        "rdtype": "float16",
        "BLOCK_SIZE_M": 32,
        "BLOCK_SIZE_N": 64,
        "BLOCK_SIZE_K": 64,
        "GROUP_SIZE_M": 16,
        "num_warps": 2,
        "num_ctas": 1,
        "num_stages": 5,
        "kernel_name": "kernel_cf98af0c_0d1d2d34567891011"
    },
    {
        "M": 104,
        "N": 512,
        "K": 512,
        "ldtype": "float16",
        "rdtype": "float16",
        "BLOCK_SIZE_M": 32,
        "BLOCK_SIZE_N": 64,
        "BLOCK_SIZE_K": 64,
        "GROUP_SIZE_M": 16,
        "num_warps": 2,
        "num_ctas": 1,
        "num_stages": 5,
        "kernel_name": "kernel_cf98af0c_0d1d2d34567891011"
    },
    {
        "M": 108,
        "N": 512,
        "K": 512,
        "ldtype": "float16",
        "rdtype": "float16",
        "BLOCK_SIZE_M": 32,
        "BLOCK_SIZE_N": 64,
        "BLOCK_SIZE_K": 64,
        "GROUP_SIZE_M": 16,
        "num_warps": 2,
        "num_ctas": 1,
        "num_stages": 5,
        "kernel_name": "kernel_cf98af0c_0d1d2d34567891011"
    },
    {
        "M": 112,
        "N": 512,
        "K": 512,
        "ldtype": "float16",
        "rdtype": "float16",
        "BLOCK_SIZE_M": 32,
        "BLOCK_SIZE_N": 64,
        "BLOCK_SIZE_K": 64,
        "GROUP_SIZE_M": 16,
        "num_warps": 2,
        "num_ctas": 1,
        "num_stages": 5,
        "kernel_name": "kernel_cf98af0c_0d1d2d34567891011"
    },
    {
        "M": 116,
        "N": 512,
        "K": 512,
        "ldtype": "float16",
        "rdtype": "float16",
        "BLOCK_SIZE_M": 32,
        "BLOCK_SIZE_N": 128,
        "BLOCK_SIZE_K": 64,
        "GROUP_SIZE_M": 16,
        "num_warps": 4,
        "num_ctas": 1,
        "num_stages": 4,
        "kernel_name": "kernel_d93aba62_0d1d2d34567891011"
    },
    {
        "M": 120,
        "N": 512,
        "K": 512,
        "ldtype": "float16",
        "rdtype": "float16",
        "BLOCK_SIZE_M": 32,
        "BLOCK_SIZE_N": 64,
        "BLOCK_SIZE_K": 64,
        "GROUP_SIZE_M": 8,
        "num_warps": 2,
        "num_ctas": 1,
        "num_stages": 5,
        "kernel_name": "kernel_11f7c317_0d1d2d34567891011"
    },
    {
        "M": 124,
        "N": 512,
        "K": 512,
        "ldtype": "float16",
        "rdtype": "float16",
        "BLOCK_SIZE_M": 32,
        "BLOCK_SIZE_N": 64,
        "BLOCK_SIZE_K": 64,
        "GROUP_SIZE_M": 8,
        "num_warps": 2,
        "num_ctas": 1,
        "num_stages": 5,
        "kernel_name": "kernel_11f7c317_0d1d2d34567891011"
    },
    {
        "M": 128,
        "N": 512,
        "K": 512,
        "ldtype": "float16",
        "rdtype": "float16",
        "BLOCK_SIZE_M": 32,
        "BLOCK_SIZE_N": 64,
        "BLOCK_SIZE_K": 64,
        "GROUP_SIZE_M": 16,
        "num_warps": 2,
        "num_ctas": 1,
        "num_stages": 5,
        "kernel_name": "kernel_cf98af0c_0d1d2d34567891011"
    },
    {
        "M": 132,
        "N": 512,
        "K": 512,
        "ldtype": "float16",
        "rdtype": "float16",
        "BLOCK_SIZE_M": 32,
        "BLOCK_SIZE_N": 64,
        "BLOCK_SIZE_K": 64,
        "GROUP_SIZE_M": 8,
        "num_warps": 2,
        "num_ctas": 1,
        "num_stages": 5,
        "kernel_name": "kernel_11f7c317_0d1d2d34567891011"
    },
    {
        "M": 136,
        "N": 512,
        "K": 512,
        "ldtype": "float16",
        "rdtype": "float16",
        "BLOCK_SIZE_M": 32,
        "BLOCK_SIZE_N": 64,
        "BLOCK_SIZE_K": 64,
        "GROUP_SIZE_M": 16,
        "num_warps": 2,
        "num_ctas": 1,
        "num_stages": 5,
        "kernel_name": "kernel_cf98af0c_0d1d2d34567891011"
    },
    {
        "M": 140,
        "N": 512,
        "K": 512,
        "ldtype": "float16",
        "rdtype": "float16",
        "BLOCK_SIZE_M": 32,
        "BLOCK_SIZE_N": 128,
        "BLOCK_SIZE_K": 64,
        "GROUP_SIZE_M": 16,
        "num_warps": 4,
        "num_ctas": 1,
        "num_stages": 4,
        "kernel_name": "kernel_d93aba62_0d1d2d34567891011"
    },
    {
        "M": 144,
        "N": 512,
        "K": 512,
        "ldtype": "float16",
        "rdtype": "float16",
        "BLOCK_SIZE_M": 64,
        "BLOCK_SIZE_N": 64,
        "BLOCK_SIZE_K": 64,
        "GROUP_SIZE_M": 8,
        "num_warps": 2,
        "num_ctas": 1,
        "num_stages": 5,
        "kernel_name": "kernel_950e6aa7_0d1d2d34567891011"
    },
    {
        "M": 148,
        "N": 512,
        "K": 512,
        "ldtype": "float16",
        "rdtype": "float16",
        "BLOCK_SIZE_M": 32,
        "BLOCK_SIZE_N": 64,
        "BLOCK_SIZE_K": 64,
        "GROUP_SIZE_M": 8,
        "num_warps": 2,
        "num_ctas": 1,
        "num_stages": 5,
        "kernel_name": "kernel_11f7c317_0d1d2d34567891011"
    },
    {
        "M": 152,
        "N": 512,
        "K": 512,
        "ldtype": "float16",
        "rdtype": "float16",
        "BLOCK_SIZE_M": 32,
        "BLOCK_SIZE_N": 64,
        "BLOCK_SIZE_K": 64,
        "GROUP_SIZE_M": 4,
        "num_warps": 2,
        "num_ctas": 1,
        "num_stages": 5,
        "kernel_name": "kernel_babb08f0_0d1d2d34567891011"
    },
    {
        "M": 156,
        "N": 512,
        "K": 512,
        "ldtype": "float16",
        "rdtype": "float16",
        "BLOCK_SIZE_M": 32,
        "BLOCK_SIZE_N": 64,
        "BLOCK_SIZE_K": 64,
        "GROUP_SIZE_M": 16,
        "num_warps": 2,
        "num_ctas": 1,
        "num_stages": 5,
        "kernel_name": "kernel_cf98af0c_0d1d2d34567891011"
    },
    {
        "M": 160,
        "N": 512,
        "K": 512,
        "ldtype": "float16",
        "rdtype": "float16",
        "BLOCK_SIZE_M": 32,
        "BLOCK_SIZE_N": 64,
        "BLOCK_SIZE_K": 64,
        "GROUP_SIZE_M": 8,
        "num_warps": 2,
        "num_ctas": 1,
        "num_stages": 5,
        "kernel_name": "kernel_11f7c317_0d1d2d34567891011"
    },
    {
        "M": 164,
        "N": 512,
        "K": 512,
        "ldtype": "float16",
        "rdtype": "float16",
        "BLOCK_SIZE_M": 32,
        "BLOCK_SIZE_N": 128,
        "BLOCK_SIZE_K": 64,
        "GROUP_SIZE_M": 16,
        "num_warps": 4,
        "num_ctas": 1,
        "num_stages": 4,
        "kernel_name": "kernel_d93aba62_0d1d2d34567891011"
    },
    {
        "M": 168,
        "N": 512,
        "K": 512,
        "ldtype": "float16",
        "rdtype": "float16",
        "BLOCK_SIZE_M": 32,
        "BLOCK_SIZE_N": 64,
        "BLOCK_SIZE_K": 64,
        "GROUP_SIZE_M": 16,
        "num_warps": 2,
        "num_ctas": 1,
        "num_stages": 5,
        "kernel_name": "kernel_cf98af0c_0d1d2d34567891011"
    },
    {
        "M": 172,
        "N": 512,
        "K": 512,
        "ldtype": "float16",
        "rdtype": "float16",
        "BLOCK_SIZE_M": 32,
        "BLOCK_SIZE_N": 64,
        "BLOCK_SIZE_K": 64,
        "GROUP_SIZE_M": 8,
        "num_warps": 2,
        "num_ctas": 1,
        "num_stages": 5,
        "kernel_name": "kernel_11f7c317_0d1d2d34567891011"
    },
    {
        "M": 176,
        "N": 512,
        "K": 512,
        "ldtype": "float16",
        "rdtype": "float16",
        "BLOCK_SIZE_M": 32,
        "BLOCK_SIZE_N": 64,
        "BLOCK_SIZE_K": 64,
        "GROUP_SIZE_M": 16,
        "num_warps": 2,
        "num_ctas": 1,
        "num_stages": 5,
        "kernel_name": "kernel_cf98af0c_0d1d2d34567891011"
    },
    {
        "M": 180,
        "N": 512,
        "K": 512,
        "ldtype": "float16",
        "rdtype": "float16",
        "BLOCK_SIZE_M": 32,
        "BLOCK_SIZE_N": 64,
        "BLOCK_SIZE_K": 64,
        "GROUP_SIZE_M": 16,
        "num_warps": 2,
        "num_ctas": 1,
        "num_stages": 5,
        "kernel_name": "kernel_cf98af0c_0d1d2d34567891011"
    },
    {
        "M": 184,
        "N": 512,
        "K": 512,
        "ldtype": "float16",
        "rdtype": "float16",
        "BLOCK_SIZE_M": 32,
        "BLOCK_SIZE_N": 128,
        "BLOCK_SIZE_K": 64,
        "GROUP_SIZE_M": 16,
        "num_warps": 4,
        "num_ctas": 1,
        "num_stages": 4,
        "kernel_name": "kernel_d93aba62_0d1d2d34567891011"
    },
    {
        "M": 188,
        "N": 512,
        "K": 512,
        "ldtype": "float16",
        "rdtype": "float16",
        "BLOCK_SIZE_M": 32,
        "BLOCK_SIZE_N": 64,
        "BLOCK_SIZE_K": 64,
        "GROUP_SIZE_M": 8,
        "num_warps": 2,
        "num_ctas": 1,
        "num_stages": 5,
        "kernel_name": "kernel_11f7c317_0d1d2d34567891011"
    },
    {
        "M": 192,
        "N": 512,
        "K": 512,
        "ldtype": "float16",
        "rdtype": "float16",
        "BLOCK_SIZE_M": 32,
        "BLOCK_SIZE_N": 64,
        "BLOCK_SIZE_K": 64,
        "GROUP_SIZE_M": 8,
        "num_warps": 2,
        "num_ctas": 1,
        "num_stages": 5,
        "kernel_name": "kernel_11f7c317_0d1d2d34567891011"
    },
    {
        "M": 196,
        "N": 512,
        "K": 512,
        "ldtype": "float16",
        "rdtype": "float16",
        "BLOCK_SIZE_M": 64,
        "BLOCK_SIZE_N": 64,
        "BLOCK_SIZE_K": 64,
        "GROUP_SIZE_M": 4,
        "num_warps": 2,
        "num_ctas": 1,
        "num_stages": 4,
        "kernel_name": "kernel_98bbb594_0d1d2d34567891011"
    },
    {
        "M": 200,
        "N": 512,
        "K": 512,
        "ldtype": "float16",
        "rdtype": "float16",
        "BLOCK_SIZE_M": 64,
        "BLOCK_SIZE_N": 64,
        "BLOCK_SIZE_K": 64,
        "GROUP_SIZE_M": 4,
        "num_warps": 2,
        "num_ctas": 1,
        "num_stages": 4,
        "kernel_name": "kernel_98bbb594_0d1d2d34567891011"
    },
    {
        "M": 204,
        "N": 512,
        "K": 512,
        "ldtype": "float16",
        "rdtype": "float16",
        "BLOCK_SIZE_M": 64,
        "BLOCK_SIZE_N": 64,
        "BLOCK_SIZE_K": 64,
        "GROUP_SIZE_M": 4,
        "num_warps": 2,
        "num_ctas": 1,
        "num_stages": 4,
        "kernel_name": "kernel_98bbb594_0d1d2d34567891011"
    },
    {
        "M": 208,
        "N": 512,
        "K": 512,
        "ldtype": "float16",
        "rdtype": "float16",
        "BLOCK_SIZE_M": 64,
        "BLOCK_SIZE_N": 64,
        "BLOCK_SIZE_K": 64,
        "GROUP_SIZE_M": 4,
        "num_warps": 2,
        "num_ctas": 1,
        "num_stages": 4,
        "kernel_name": "kernel_98bbb594_0d1d2d34567891011"
    },
    {
        "M": 212,
        "N": 512,
        "K": 512,
        "ldtype": "float16",
        "rdtype": "float16",
        "BLOCK_SIZE_M": 64,
        "BLOCK_SIZE_N": 128,
        "BLOCK_SIZE_K": 64,
        "GROUP_SIZE_M": 8,
        "num_warps": 4,
        "num_ctas": 1,
        "num_stages": 4,
        "kernel_name": "kernel_21782b4d_0d1d2d34567891011"
    },
    {
        "M": 216,
        "N": 512,
        "K": 512,
        "ldtype": "float16",
        "rdtype": "float16",
        "BLOCK_SIZE_M": 64,
        "BLOCK_SIZE_N": 64,
        "BLOCK_SIZE_K": 64,
        "GROUP_SIZE_M": 4,
        "num_warps": 2,
        "num_ctas": 1,
        "num_stages": 4,
        "kernel_name": "kernel_98bbb594_0d1d2d34567891011"
    },
    {
        "M": 220,
        "N": 512,
        "K": 512,
        "ldtype": "float16",
        "rdtype": "float16",
        "BLOCK_SIZE_M": 64,
        "BLOCK_SIZE_N": 64,
        "BLOCK_SIZE_K": 64,
        "GROUP_SIZE_M": 4,
        "num_warps": 2,
        "num_ctas": 1,
        "num_stages": 4,
        "kernel_name": "kernel_98bbb594_0d1d2d34567891011"
    },
    {
        "M": 224,
        "N": 512,
        "K": 512,
        "ldtype": "float16",
        "rdtype": "float16",
        "BLOCK_SIZE_M": 64,
        "BLOCK_SIZE_N": 64,
        "BLOCK_SIZE_K": 64,
        "GROUP_SIZE_M": 4,
        "num_warps": 2,
        "num_ctas": 1,
        "num_stages": 4,
        "kernel_name": "kernel_98bbb594_0d1d2d34567891011"
    },
    {
        "M": 228,
        "N": 512,
        "K": 512,
        "ldtype": "float16",
        "rdtype": "float16",
        "BLOCK_SIZE_M": 64,
        "BLOCK_SIZE_N": 64,
        "BLOCK_SIZE_K": 64,
        "GROUP_SIZE_M": 4,
        "num_warps": 2,
        "num_ctas": 1,
        "num_stages": 4,
        "kernel_name": "kernel_98bbb594_0d1d2d34567891011"
    },
    {
        "M": 232,
        "N": 512,
        "K": 512,
        "ldtype": "float16",
        "rdtype": "float16",
        "BLOCK_SIZE_M": 64,
        "BLOCK_SIZE_N": 64,
        "BLOCK_SIZE_K": 64,
        "GROUP_SIZE_M": 4,
        "num_warps": 2,
        "num_ctas": 1,
        "num_stages": 4,
        "kernel_name": "kernel_98bbb594_0d1d2d34567891011"
    },
    {
        "M": 236,
        "N": 512,
        "K": 512,
        "ldtype": "float16",
        "rdtype": "float16",
        "BLOCK_SIZE_M": 64,
        "BLOCK_SIZE_N": 64,
        "BLOCK_SIZE_K": 64,
        "GROUP_SIZE_M": 4,
        "num_warps": 2,
        "num_ctas": 1,
        "num_stages": 4,
        "kernel_name": "kernel_98bbb594_0d1d2d34567891011"
    },
    {
        "M": 240,
        "N": 512,
        "K": 512,
        "ldtype": "float16",
        "rdtype": "float16",
        "BLOCK_SIZE_M": 64,
        "BLOCK_SIZE_N": 128,
        "BLOCK_SIZE_K": 64,
        "GROUP_SIZE_M": 8,
        "num_warps": 4,
        "num_ctas": 1,
        "num_stages": 4,
        "kernel_name": "kernel_21782b4d_0d1d2d34567891011"
    },
    {
        "M": 4,
        "N": 512,
        "K": 512,
        "ldtype": "float16",
        "rdtype": "float16",
        "BLOCK_SIZE_M": 16,
        "BLOCK_SIZE_N": 128,
        "BLOCK_SIZE_K": 64,
        "GROUP_SIZE_M": 16,
        "num_warps": 4,
        "num_ctas": 1,
        "num_stages": 5,
        "kernel_name": "kernel_8ac9753b_0d1d2d34567891011"
    },
    {
        "M": 4,
        "N": 512,
        "K": 512,
        "ldtype": "float16",
        "rdtype": "float16",
        "BLOCK_SIZE_M": 16,
        "BLOCK_SIZE_N": 128,
        "BLOCK_SIZE_K": 64,
        "GROUP_SIZE_M": 8,
        "num_warps": 4,
        "num_ctas": 1,
        "num_stages": 5,
        "kernel_name": "kernel_4d05e44c_0d1d2d34567891011"
    },
    {
        "M": 8,
        "N": 512,
        "K": 512,
        "ldtype": "float16",
        "rdtype": "float16",
        "BLOCK_SIZE_M": 16,
        "BLOCK_SIZE_N": 64,
        "BLOCK_SIZE_K": 64,
        "GROUP_SIZE_M": 4,
        "num_warps": 2,
        "num_ctas": 1,
        "num_stages": 5,
        "kernel_name": "kernel_719a088d_0d1d2d34567891011"
    },
    {
        "M": 12,
        "N": 512,
        "K": 512,
        "ldtype": "float16",
        "rdtype": "float16",
        "BLOCK_SIZE_M": 32,
        "BLOCK_SIZE_N": 64,
        "BLOCK_SIZE_K": 64,
        "GROUP_SIZE_M": 16,
        "num_warps": 2,
        "num_ctas": 1,
        "num_stages": 5,
        "kernel_name": "kernel_cf98af0c_0d1d2d34567891011"
    },
    {
        "M": 16,
        "N": 512,
        "K": 512,
        "ldtype": "float16",
        "rdtype": "float16",
        "BLOCK_SIZE_M": 16,
        "BLOCK_SIZE_N": 64,
        "BLOCK_SIZE_K": 64,
        "GROUP_SIZE_M": 4,
        "num_warps": 2,
        "num_ctas": 1,
        "num_stages": 5,
        "kernel_name": "kernel_719a088d_0d1d2d34567891011"
    },
    {
        "M": 20,
        "N": 512,
        "K": 512,
        "ldtype": "float16",
        "rdtype": "float16",
        "BLOCK_SIZE_M": 32,
        "BLOCK_SIZE_N": 64,
        "BLOCK_SIZE_K": 64,
        "GROUP_SIZE_M": 4,
        "num_warps": 2,
        "num_ctas": 1,
        "num_stages": 5,
        "kernel_name": "kernel_babb08f0_0d1d2d34567891011"
    },
    {
        "M": 24,
        "N": 512,
        "K": 512,
        "ldtype": "float16",
        "rdtype": "float16",
        "BLOCK_SIZE_M": 16,
        "BLOCK_SIZE_N": 64,
        "BLOCK_SIZE_K": 64,
        "GROUP_SIZE_M": 4,
        "num_warps": 2,
        "num_ctas": 1,
        "num_stages": 5,
        "kernel_name": "kernel_719a088d_0d1d2d34567891011"
    },
    {
        "M": 28,
        "N": 512,
        "K": 512,
        "ldtype": "float16",
        "rdtype": "float16",
        "BLOCK_SIZE_M": 16,
        "BLOCK_SIZE_N": 64,
        "BLOCK_SIZE_K": 64,
        "GROUP_SIZE_M": 8,
        "num_warps": 2,
        "num_ctas": 1,
        "num_stages": 4,
        "kernel_name": "kernel_1261c9bc_0d1d2d34567891011"
    },
    {
        "M": 32,
        "N": 512,
        "K": 512,
        "ldtype": "float16",
        "rdtype": "float16",
        "BLOCK_SIZE_M": 16,
        "BLOCK_SIZE_N": 64,
        "BLOCK_SIZE_K": 64,
        "GROUP_SIZE_M": 4,
        "num_warps": 2,
        "num_ctas": 1,
        "num_stages": 5,
        "kernel_name": "kernel_719a088d_0d1d2d34567891011"
    },
    {
        "M": 36,
        "N": 512,
        "K": 512,
        "ldtype": "float16",
        "rdtype": "float16",
        "BLOCK_SIZE_M": 16,
        "BLOCK_SIZE_N": 64,
        "BLOCK_SIZE_K": 64,
        "GROUP_SIZE_M": 4,
        "num_warps": 2,
        "num_ctas": 1,
        "num_stages": 5,
        "kernel_name": "kernel_719a088d_0d1d2d34567891011"
    },
    {
        "M": 40,
        "N": 512,
        "K": 512,
        "ldtype": "float16",
        "rdtype": "float16",
        "BLOCK_SIZE_M": 32,
        "BLOCK_SIZE_N": 64,
        "BLOCK_SIZE_K": 64,
        "GROUP_SIZE_M": 4,
        "num_warps": 2,
        "num_ctas": 1,
        "num_stages": 5,
        "kernel_name": "kernel_babb08f0_0d1d2d34567891011"
    },
    {
        "M": 44,
        "N": 512,
        "K": 512,
        "ldtype": "float16",
        "rdtype": "float16",
        "BLOCK_SIZE_M": 16,
        "BLOCK_SIZE_N": 128,
        "BLOCK_SIZE_K": 64,
        "GROUP_SIZE_M": 4,
        "num_warps": 4,
        "num_ctas": 1,
        "num_stages": 5,
        "kernel_name": "kernel_7f22bb6a_0d1d2d34567891011"
    },
    {
        "M": 48,
        "N": 512,
        "K": 512,
        "ldtype": "float16",
        "rdtype": "float16",
        "BLOCK_SIZE_M": 16,
        "BLOCK_SIZE_N": 128,
        "BLOCK_SIZE_K": 64,
        "GROUP_SIZE_M": 16,
        "num_warps": 4,
        "num_ctas": 1,
        "num_stages": 5,
        "kernel_name": "kernel_8ac9753b_0d1d2d34567891011"
    },
    {
        "M": 52,
        "N": 512,
        "K": 512,
        "ldtype": "float16",
        "rdtype": "float16",
        "BLOCK_SIZE_M": 32,
        "BLOCK_SIZE_N": 64,
        "BLOCK_SIZE_K": 64,
        "GROUP_SIZE_M": 16,
        "num_warps": 2,
        "num_ctas": 1,
        "num_stages": 5,
        "kernel_name": "kernel_cf98af0c_0d1d2d34567891011"
    },
    {
        "M": 56,
        "N": 512,
        "K": 512,
        "ldtype": "float16",
        "rdtype": "float16",
        "BLOCK_SIZE_M": 32,
        "BLOCK_SIZE_N": 64,
        "BLOCK_SIZE_K": 64,
        "GROUP_SIZE_M": 4,
        "num_warps": 2,
        "num_ctas": 1,
        "num_stages": 5,
        "kernel_name": "kernel_babb08f0_0d1d2d34567891011"
    },
    {
        "M": 60,
        "N": 512,
        "K": 512,
        "ldtype": "float16",
        "rdtype": "float16",
        "BLOCK_SIZE_M": 32,
        "BLOCK_SIZE_N": 64,
        "BLOCK_SIZE_K": 64,
        "GROUP_SIZE_M": 8,
        "num_warps": 2,
        "num_ctas": 1,
        "num_stages": 5,
        "kernel_name": "kernel_11f7c317_0d1d2d34567891011"
    },
    {
        "M": 64,
        "N": 512,
        "K": 512,
        "ldtype": "float16",
        "rdtype": "float16",
        "BLOCK_SIZE_M": 32,
        "BLOCK_SIZE_N": 64,
        "BLOCK_SIZE_K": 64,
        "GROUP_SIZE_M": 16,
        "num_warps": 2,
        "num_ctas": 1,
        "num_stages": 5,
        "kernel_name": "kernel_cf98af0c_0d1d2d34567891011"
    },
    {
        "M": 68,
        "N": 512,
        "K": 512,
        "ldtype": "float16",
        "rdtype": "float16",
        "BLOCK_SIZE_M": 32,
        "BLOCK_SIZE_N": 64,
        "BLOCK_SIZE_K": 64,
        "GROUP_SIZE_M": 4,
        "num_warps": 2,
        "num_ctas": 1,
        "num_stages": 5,
        "kernel_name": "kernel_babb08f0_0d1d2d34567891011"
    },
    {
        "M": 72,
        "N": 512,
        "K": 512,
        "ldtype": "float16",
        "rdtype": "float16",
        "BLOCK_SIZE_M": 32,
        "BLOCK_SIZE_N": 64,
        "BLOCK_SIZE_K": 64,
        "GROUP_SIZE_M": 4,
        "num_warps": 2,
        "num_ctas": 1,
        "num_stages": 5,
        "kernel_name": "kernel_babb08f0_0d1d2d34567891011"
    },
    {
        "M": 76,
        "N": 512,
        "K": 512,
        "ldtype": "float16",
        "rdtype": "float16",
        "BLOCK_SIZE_M": 32,
        "BLOCK_SIZE_N": 64,
        "BLOCK_SIZE_K": 64,
        "GROUP_SIZE_M": 16,
        "num_warps": 2,
        "num_ctas": 1,
        "num_stages": 5,
        "kernel_name": "kernel_cf98af0c_0d1d2d34567891011"
    },
    {
        "M": 80,
        "N": 512,
        "K": 512,
        "ldtype": "float16",
        "rdtype": "float16",
        "BLOCK_SIZE_M": 32,
        "BLOCK_SIZE_N": 64,
        "BLOCK_SIZE_K": 64,
        "GROUP_SIZE_M": 8,
        "num_warps": 2,
        "num_ctas": 1,
        "num_stages": 5,
        "kernel_name": "kernel_11f7c317_0d1d2d34567891011"
    },
    {
        "M": 84,
        "N": 512,
        "K": 512,
        "ldtype": "float16",
        "rdtype": "float16",
        "BLOCK_SIZE_M": 32,
        "BLOCK_SIZE_N": 64,
        "BLOCK_SIZE_K": 64,
        "GROUP_SIZE_M": 16,
        "num_warps": 2,
        "num_ctas": 1,
        "num_stages": 5,
        "kernel_name": "kernel_cf98af0c_0d1d2d34567891011"
    },
    {
        "M": 88,
        "N": 512,
        "K": 512,
        "ldtype": "float16",
        "rdtype": "float16",
        "BLOCK_SIZE_M": 32,
        "BLOCK_SIZE_N": 64,
        "BLOCK_SIZE_K": 64,
        "GROUP_SIZE_M": 8,
        "num_warps": 2,
        "num_ctas": 1,
        "num_stages": 5,
        "kernel_name": "kernel_11f7c317_0d1d2d34567891011"
    },
    {
        "M": 92,
        "N": 512,
        "K": 512,
        "ldtype": "float16",
        "rdtype": "float16",
        "BLOCK_SIZE_M": 32,
        "BLOCK_SIZE_N": 64,
        "BLOCK_SIZE_K": 64,
        "GROUP_SIZE_M": 16,
        "num_warps": 2,
        "num_ctas": 1,
        "num_stages": 5,
        "kernel_name": "kernel_cf98af0c_0d1d2d34567891011"
    },
    {
        "M": 96,
        "N": 512,
        "K": 512,
        "ldtype": "float16",
        "rdtype": "float16",
        "BLOCK_SIZE_M": 32,
        "BLOCK_SIZE_N": 64,
        "BLOCK_SIZE_K": 64,
        "GROUP_SIZE_M": 16,
        "num_warps": 2,
        "num_ctas": 1,
        "num_stages": 5,
        "kernel_name": "kernel_cf98af0c_0d1d2d34567891011"
    },
    {
        "M": 100,
        "N": 512,
        "K": 512,
        "ldtype": "float16",
        "rdtype": "float16",
        "BLOCK_SIZE_M": 32,
        "BLOCK_SIZE_N": 64,
        "BLOCK_SIZE_K": 64,
        "GROUP_SIZE_M": 16,
        "num_warps": 2,
        "num_ctas": 1,
        "num_stages": 5,
        "kernel_name": "kernel_cf98af0c_0d1d2d34567891011"
    },
    {
        "M": 104,
        "N": 512,
        "K": 512,
        "ldtype": "float16",
        "rdtype": "float16",
        "BLOCK_SIZE_M": 32,
        "BLOCK_SIZE_N": 64,
        "BLOCK_SIZE_K": 64,
        "GROUP_SIZE_M": 16,
        "num_warps": 2,
        "num_ctas": 1,
        "num_stages": 5,
        "kernel_name": "kernel_cf98af0c_0d1d2d34567891011"
    },
    {
        "M": 108,
        "N": 512,
        "K": 512,
        "ldtype": "float16",
        "rdtype": "float16",
        "BLOCK_SIZE_M": 32,
        "BLOCK_SIZE_N": 64,
        "BLOCK_SIZE_K": 64,
        "GROUP_SIZE_M": 16,
        "num_warps": 2,
        "num_ctas": 1,
        "num_stages": 5,
        "kernel_name": "kernel_cf98af0c_0d1d2d34567891011"
    },
    {
        "M": 112,
        "N": 512,
        "K": 512,
        "ldtype": "float16",
        "rdtype": "float16",
        "BLOCK_SIZE_M": 32,
        "BLOCK_SIZE_N": 64,
        "BLOCK_SIZE_K": 64,
        "GROUP_SIZE_M": 16,
        "num_warps": 2,
        "num_ctas": 1,
        "num_stages": 5,
        "kernel_name": "kernel_cf98af0c_0d1d2d34567891011"
    },
    {
        "M": 116,
        "N": 512,
        "K": 512,
        "ldtype": "float16",
        "rdtype": "float16",
        "BLOCK_SIZE_M": 32,
        "BLOCK_SIZE_N": 128,
        "BLOCK_SIZE_K": 64,
        "GROUP_SIZE_M": 16,
        "num_warps": 4,
        "num_ctas": 1,
        "num_stages": 4,
        "kernel_name": "kernel_d93aba62_0d1d2d34567891011"
    },
    {
        "M": 120,
        "N": 512,
        "K": 512,
        "ldtype": "float16",
        "rdtype": "float16",
        "BLOCK_SIZE_M": 32,
        "BLOCK_SIZE_N": 64,
        "BLOCK_SIZE_K": 64,
        "GROUP_SIZE_M": 16,
        "num_warps": 2,
        "num_ctas": 1,
        "num_stages": 5,
        "kernel_name": "kernel_cf98af0c_0d1d2d34567891011"
    },
    {
        "M": 124,
        "N": 512,
        "K": 512,
        "ldtype": "float16",
        "rdtype": "float16",
        "BLOCK_SIZE_M": 32,
        "BLOCK_SIZE_N": 64,
        "BLOCK_SIZE_K": 64,
        "GROUP_SIZE_M": 16,
        "num_warps": 2,
        "num_ctas": 1,
        "num_stages": 5,
        "kernel_name": "kernel_cf98af0c_0d1d2d34567891011"
    },
    {
        "M": 128,
        "N": 512,
        "K": 512,
        "ldtype": "float16",
        "rdtype": "float16",
        "BLOCK_SIZE_M": 32,
        "BLOCK_SIZE_N": 64,
        "BLOCK_SIZE_K": 64,
        "GROUP_SIZE_M": 16,
        "num_warps": 2,
        "num_ctas": 1,
        "num_stages": 5,
        "kernel_name": "kernel_cf98af0c_0d1d2d34567891011"
    },
    {
        "M": 132,
        "N": 512,
        "K": 512,
        "ldtype": "float16",
        "rdtype": "float16",
        "BLOCK_SIZE_M": 32,
        "BLOCK_SIZE_N": 64,
        "BLOCK_SIZE_K": 64,
        "GROUP_SIZE_M": 16,
        "num_warps": 2,
        "num_ctas": 1,
        "num_stages": 5,
        "kernel_name": "kernel_cf98af0c_0d1d2d34567891011"
    },
    {
        "M": 136,
        "N": 512,
        "K": 512,
        "ldtype": "float16",
        "rdtype": "float16",
        "BLOCK_SIZE_M": 32,
        "BLOCK_SIZE_N": 64,
        "BLOCK_SIZE_K": 64,
        "GROUP_SIZE_M": 16,
        "num_warps": 2,
        "num_ctas": 1,
        "num_stages": 5,
        "kernel_name": "kernel_cf98af0c_0d1d2d34567891011"
    },
    {
        "M": 140,
        "N": 512,
        "K": 512,
        "ldtype": "float16",
        "rdtype": "float16",
        "BLOCK_SIZE_M": 32,
        "BLOCK_SIZE_N": 64,
        "BLOCK_SIZE_K": 64,
        "GROUP_SIZE_M": 4,
        "num_warps": 2,
        "num_ctas": 1,
        "num_stages": 5,
        "kernel_name": "kernel_babb08f0_0d1d2d34567891011"
    },
    {
        "M": 144,
        "N": 512,
        "K": 512,
        "ldtype": "float16",
        "rdtype": "float16",
        "BLOCK_SIZE_M": 32,
        "BLOCK_SIZE_N": 64,
        "BLOCK_SIZE_K": 64,
        "GROUP_SIZE_M": 8,
        "num_warps": 2,
        "num_ctas": 1,
        "num_stages": 5,
        "kernel_name": "kernel_11f7c317_0d1d2d34567891011"
    },
    {
        "M": 148,
        "N": 512,
        "K": 512,
        "ldtype": "float16",
        "rdtype": "float16",
        "BLOCK_SIZE_M": 32,
        "BLOCK_SIZE_N": 64,
        "BLOCK_SIZE_K": 64,
        "GROUP_SIZE_M": 16,
        "num_warps": 2,
        "num_ctas": 1,
        "num_stages": 5,
        "kernel_name": "kernel_cf98af0c_0d1d2d34567891011"
    },
    {
        "M": 152,
        "N": 512,
        "K": 512,
        "ldtype": "float16",
        "rdtype": "float16",
        "BLOCK_SIZE_M": 32,
        "BLOCK_SIZE_N": 64,
        "BLOCK_SIZE_K": 64,
        "GROUP_SIZE_M": 16,
        "num_warps": 2,
        "num_ctas": 1,
        "num_stages": 5,
        "kernel_name": "kernel_cf98af0c_0d1d2d34567891011"
    },
    {
        "M": 156,
        "N": 512,
        "K": 512,
        "ldtype": "float16",
        "rdtype": "float16",
        "BLOCK_SIZE_M": 32,
        "BLOCK_SIZE_N": 64,
        "BLOCK_SIZE_K": 64,
        "GROUP_SIZE_M": 16,
        "num_warps": 2,
        "num_ctas": 1,
        "num_stages": 5,
        "kernel_name": "kernel_cf98af0c_0d1d2d34567891011"
    },
    {
        "M": 160,
        "N": 512,
        "K": 512,
        "ldtype": "float16",
        "rdtype": "float16",
        "BLOCK_SIZE_M": 64,
        "BLOCK_SIZE_N": 64,
        "BLOCK_SIZE_K": 64,
        "GROUP_SIZE_M": 16,
        "num_warps": 2,
        "num_ctas": 1,
        "num_stages": 5,
        "kernel_name": "kernel_4c357593_0d1d2d34567891011"
    },
    {
        "M": 164,
        "N": 512,
        "K": 512,
        "ldtype": "float16",
        "rdtype": "float16",
        "BLOCK_SIZE_M": 32,
        "BLOCK_SIZE_N": 64,
        "BLOCK_SIZE_K": 64,
        "GROUP_SIZE_M": 8,
        "num_warps": 2,
        "num_ctas": 1,
        "num_stages": 5,
        "kernel_name": "kernel_11f7c317_0d1d2d34567891011"
    },
    {
        "M": 168,
        "N": 512,
        "K": 512,
        "ldtype": "float16",
        "rdtype": "float16",
        "BLOCK_SIZE_M": 32,
        "BLOCK_SIZE_N": 64,
        "BLOCK_SIZE_K": 64,
        "GROUP_SIZE_M": 8,
        "num_warps": 2,
        "num_ctas": 1,
        "num_stages": 5,
        "kernel_name": "kernel_11f7c317_0d1d2d34567891011"
    },
    {
        "M": 172,
        "N": 512,
        "K": 512,
        "ldtype": "float16",
        "rdtype": "float16",
        "BLOCK_SIZE_M": 32,
        "BLOCK_SIZE_N": 64,
        "BLOCK_SIZE_K": 64,
        "GROUP_SIZE_M": 16,
        "num_warps": 2,
        "num_ctas": 1,
        "num_stages": 5,
        "kernel_name": "kernel_cf98af0c_0d1d2d34567891011"
    },
    {
        "M": 176,
        "N": 512,
        "K": 512,
        "ldtype": "float16",
        "rdtype": "float16",
        "BLOCK_SIZE_M": 32,
        "BLOCK_SIZE_N": 64,
        "BLOCK_SIZE_K": 64,
        "GROUP_SIZE_M": 8,
        "num_warps": 2,
        "num_ctas": 1,
        "num_stages": 5,
        "kernel_name": "kernel_11f7c317_0d1d2d34567891011"
    },
    {
        "M": 180,
        "N": 512,
        "K": 512,
        "ldtype": "float16",
        "rdtype": "float16",
        "BLOCK_SIZE_M": 32,
        "BLOCK_SIZE_N": 64,
        "BLOCK_SIZE_K": 64,
        "GROUP_SIZE_M": 4,
        "num_warps": 2,
        "num_ctas": 1,
        "num_stages": 5,
        "kernel_name": "kernel_babb08f0_0d1d2d34567891011"
    },
    {
        "M": 184,
        "N": 512,
        "K": 512,
        "ldtype": "float16",
        "rdtype": "float16",
        "BLOCK_SIZE_M": 32,
        "BLOCK_SIZE_N": 64,
        "BLOCK_SIZE_K": 64,
        "GROUP_SIZE_M": 16,
        "num_warps": 2,
        "num_ctas": 1,
        "num_stages": 5,
        "kernel_name": "kernel_cf98af0c_0d1d2d34567891011"
    },
    {
        "M": 188,
        "N": 512,
        "K": 512,
        "ldtype": "float16",
        "rdtype": "float16",
        "BLOCK_SIZE_M": 32,
        "BLOCK_SIZE_N": 64,
        "BLOCK_SIZE_K": 64,
        "GROUP_SIZE_M": 8,
        "num_warps": 2,
        "num_ctas": 1,
        "num_stages": 5,
        "kernel_name": "kernel_11f7c317_0d1d2d34567891011"
    },
    {
        "M": 192,
        "N": 512,
        "K": 512,
        "ldtype": "float16",
        "rdtype": "float16",
        "BLOCK_SIZE_M": 32,
        "BLOCK_SIZE_N": 64,
        "BLOCK_SIZE_K": 64,
        "GROUP_SIZE_M": 16,
        "num_warps": 2,
        "num_ctas": 1,
        "num_stages": 5,
        "kernel_name": "kernel_cf98af0c_0d1d2d34567891011"
    },
    {
        "M": 196,
        "N": 512,
        "K": 512,
        "ldtype": "float16",
        "rdtype": "float16",
        "BLOCK_SIZE_M": 64,
        "BLOCK_SIZE_N": 64,
        "BLOCK_SIZE_K": 64,
        "GROUP_SIZE_M": 8,
        "num_warps": 2,
        "num_ctas": 1,
        "num_stages": 4,
        "kernel_name": "kernel_5c76303f_0d1d2d34567891011"
    },
    {
        "M": 200,
        "N": 512,
        "K": 512,
        "ldtype": "float16",
        "rdtype": "float16",
        "BLOCK_SIZE_M": 64,
        "BLOCK_SIZE_N": 64,
        "BLOCK_SIZE_K": 64,
        "GROUP_SIZE_M": 8,
        "num_warps": 2,
        "num_ctas": 1,
        "num_stages": 4,
        "kernel_name": "kernel_5c76303f_0d1d2d34567891011"
    },
    {
        "M": 204,
        "N": 512,
        "K": 512,
        "ldtype": "float16",
        "rdtype": "float16",
        "BLOCK_SIZE_M": 64,
        "BLOCK_SIZE_N": 64,
        "BLOCK_SIZE_K": 64,
        "GROUP_SIZE_M": 8,
        "num_warps": 2,
        "num_ctas": 1,
        "num_stages": 4,
        "kernel_name": "kernel_5c76303f_0d1d2d34567891011"
    },
    {
        "M": 208,
        "N": 512,
        "K": 512,
        "ldtype": "float16",
        "rdtype": "float16",
        "BLOCK_SIZE_M": 64,
        "BLOCK_SIZE_N": 64,
        "BLOCK_SIZE_K": 64,
        "GROUP_SIZE_M": 16,
        "num_warps": 2,
        "num_ctas": 1,
        "num_stages": 4,
        "kernel_name": "kernel_8c21baee_0d1d2d34567891011"
    },
    {
        "M": 212,
        "N": 512,
        "K": 512,
        "ldtype": "float16",
        "rdtype": "float16",
        "BLOCK_SIZE_M": 64,
        "BLOCK_SIZE_N": 64,
        "BLOCK_SIZE_K": 64,
        "GROUP_SIZE_M": 8,
        "num_warps": 2,
        "num_ctas": 1,
        "num_stages": 4,
        "kernel_name": "kernel_5c76303f_0d1d2d34567891011"
    },
    {
        "M": 216,
        "N": 512,
        "K": 512,
        "ldtype": "float16",
        "rdtype": "float16",
        "BLOCK_SIZE_M": 64,
        "BLOCK_SIZE_N": 64,
        "BLOCK_SIZE_K": 64,
        "GROUP_SIZE_M": 8,
        "num_warps": 2,
        "num_ctas": 1,
        "num_stages": 4,
        "kernel_name": "kernel_5c76303f_0d1d2d34567891011"
    },
    {
        "M": 220,
        "N": 512,
        "K": 512,
        "ldtype": "float16",
        "rdtype": "float16",
        "BLOCK_SIZE_M": 64,
        "BLOCK_SIZE_N": 64,
        "BLOCK_SIZE_K": 64,
        "GROUP_SIZE_M": 16,
        "num_warps": 2,
        "num_ctas": 1,
        "num_stages": 4,
        "kernel_name": "kernel_8c21baee_0d1d2d34567891011"
    },
    {
        "M": 224,
        "N": 512,
        "K": 512,
        "ldtype": "float16",
        "rdtype": "float16",
        "BLOCK_SIZE_M": 64,
        "BLOCK_SIZE_N": 64,
        "BLOCK_SIZE_K": 64,
        "GROUP_SIZE_M": 16,
        "num_warps": 2,
        "num_ctas": 1,
        "num_stages": 4,
        "kernel_name": "kernel_8c21baee_0d1d2d34567891011"
    },
    {
        "M": 228,
        "N": 512,
        "K": 512,
        "ldtype": "float16",
        "rdtype": "float16",
        "BLOCK_SIZE_M": 64,
        "BLOCK_SIZE_N": 64,
        "BLOCK_SIZE_K": 64,
        "GROUP_SIZE_M": 16,
        "num_warps": 2,
        "num_ctas": 1,
        "num_stages": 4,
        "kernel_name": "kernel_8c21baee_0d1d2d34567891011"
    },
    {
        "M": 232,
        "N": 512,
        "K": 512,
        "ldtype": "float16",
        "rdtype": "float16",
        "BLOCK_SIZE_M": 64,
        "BLOCK_SIZE_N": 64,
        "BLOCK_SIZE_K": 64,
        "GROUP_SIZE_M": 8,
        "num_warps": 2,
        "num_ctas": 1,
        "num_stages": 4,
        "kernel_name": "kernel_5c76303f_0d1d2d34567891011"
    },
    {
        "M": 236,
        "N": 512,
        "K": 512,
        "ldtype": "float16",
        "rdtype": "float16",
        "BLOCK_SIZE_M": 64,
        "BLOCK_SIZE_N": 64,
        "BLOCK_SIZE_K": 64,
        "GROUP_SIZE_M": 4,
        "num_warps": 2,
        "num_ctas": 1,
        "num_stages": 4,
        "kernel_name": "kernel_98bbb594_0d1d2d34567891011"
    },
    {
        "M": 240,
        "N": 512,
        "K": 512,
        "ldtype": "float16",
        "rdtype": "float16",
        "BLOCK_SIZE_M": 64,
        "BLOCK_SIZE_N": 64,
        "BLOCK_SIZE_K": 64,
        "GROUP_SIZE_M": 4,
        "num_warps": 2,
        "num_ctas": 1,
        "num_stages": 4,
        "kernel_name": "kernel_98bbb594_0d1d2d34567891011"
    },
    {
        "M": 244,
        "N": 512,
        "K": 512,
        "ldtype": "float16",
        "rdtype": "float16",
        "BLOCK_SIZE_M": 64,
        "BLOCK_SIZE_N": 64,
        "BLOCK_SIZE_K": 64,
        "GROUP_SIZE_M": 8,
        "num_warps": 2,
        "num_ctas": 1,
        "num_stages": 4,
        "kernel_name": "kernel_5c76303f_0d1d2d34567891011"
    },
    {
        "M": 248,
        "N": 512,
        "K": 512,
        "ldtype": "float16",
        "rdtype": "float16",
        "BLOCK_SIZE_M": 64,
        "BLOCK_SIZE_N": 64,
        "BLOCK_SIZE_K": 64,
        "GROUP_SIZE_M": 8,
        "num_warps": 2,
        "num_ctas": 1,
        "num_stages": 4,
        "kernel_name": "kernel_5c76303f_0d1d2d34567891011"
    },
    {
        "M": 252,
        "N": 512,
        "K": 512,
        "ldtype": "float16",
        "rdtype": "float16",
        "BLOCK_SIZE_M": 64,
        "BLOCK_SIZE_N": 64,
        "BLOCK_SIZE_K": 64,
        "GROUP_SIZE_M": 16,
        "num_warps": 2,
        "num_ctas": 1,
        "num_stages": 4,
        "kernel_name": "kernel_8c21baee_0d1d2d34567891011"
    },
    {
        "M": 4,
        "N": 512,
        "K": 512,
        "ldtype": "float16",
        "rdtype": "float16",
        "BLOCK_SIZE_M": 16,
        "BLOCK_SIZE_N": 128,
        "BLOCK_SIZE_K": 64,
        "GROUP_SIZE_M": 16,
        "num_warps": 4,
        "num_ctas": 1,
        "num_stages": 5,
        "kernel_name": "kernel_8ac9753b_0d1d2d34567891011"
    },
    {
        "M": 8,
        "N": 512,
        "K": 512,
        "ldtype": "float16",
        "rdtype": "float16",
        "BLOCK_SIZE_M": 32,
        "BLOCK_SIZE_N": 64,
        "BLOCK_SIZE_K": 64,
        "GROUP_SIZE_M": 16,
        "num_warps": 2,
        "num_ctas": 1,
        "num_stages": 5,
        "kernel_name": "kernel_cf98af0c_0d1d2d34567891011"
    },
    {
        "M": 12,
        "N": 512,
        "K": 512,
        "ldtype": "float16",
        "rdtype": "float16",
        "BLOCK_SIZE_M": 32,
        "BLOCK_SIZE_N": 64,
        "BLOCK_SIZE_K": 64,
        "GROUP_SIZE_M": 8,
        "num_warps": 2,
        "num_ctas": 1,
        "num_stages": 5,
        "kernel_name": "kernel_11f7c317_0d1d2d34567891011"
    },
    {
        "M": 16,
        "N": 512,
        "K": 512,
        "ldtype": "float16",
        "rdtype": "float16",
        "BLOCK_SIZE_M": 32,
        "BLOCK_SIZE_N": 64,
        "BLOCK_SIZE_K": 64,
        "GROUP_SIZE_M": 8,
        "num_warps": 2,
        "num_ctas": 1,
        "num_stages": 5,
        "kernel_name": "kernel_11f7c317_0d1d2d34567891011"
    },
    {
        "M": 20,
        "N": 512,
        "K": 512,
        "ldtype": "float16",
        "rdtype": "float16",
        "BLOCK_SIZE_M": 32,
        "BLOCK_SIZE_N": 64,
        "BLOCK_SIZE_K": 64,
        "GROUP_SIZE_M": 4,
        "num_warps": 2,
        "num_ctas": 1,
        "num_stages": 5,
        "kernel_name": "kernel_babb08f0_0d1d2d34567891011"
    },
    {
        "M": 24,
        "N": 512,
        "K": 512,
        "ldtype": "float16",
        "rdtype": "float16",
        "BLOCK_SIZE_M": 32,
        "BLOCK_SIZE_N": 64,
        "BLOCK_SIZE_K": 64,
        "GROUP_SIZE_M": 4,
        "num_warps": 2,
        "num_ctas": 1,
        "num_stages": 5,
        "kernel_name": "kernel_babb08f0_0d1d2d34567891011"
    },
    {
        "M": 28,
        "N": 512,
        "K": 512,
        "ldtype": "float16",
        "rdtype": "float16",
        "BLOCK_SIZE_M": 32,
        "BLOCK_SIZE_N": 64,
        "BLOCK_SIZE_K": 64,
        "GROUP_SIZE_M": 8,
        "num_warps": 2,
        "num_ctas": 1,
        "num_stages": 5,
        "kernel_name": "kernel_11f7c317_0d1d2d34567891011"
    },
    {
        "M": 32,
        "N": 512,
        "K": 512,
        "ldtype": "float16",
        "rdtype": "float16",
        "BLOCK_SIZE_M": 32,
        "BLOCK_SIZE_N": 64,
        "BLOCK_SIZE_K": 64,
        "GROUP_SIZE_M": 4,
        "num_warps": 2,
        "num_ctas": 1,
        "num_stages": 5,
        "kernel_name": "kernel_babb08f0_0d1d2d34567891011"
    },
    {
        "M": 36,
        "N": 512,
        "K": 512,
        "ldtype": "float16",
        "rdtype": "float16",
        "BLOCK_SIZE_M": 32,
        "BLOCK_SIZE_N": 64,
        "BLOCK_SIZE_K": 64,
        "GROUP_SIZE_M": 8,
        "num_warps": 2,
        "num_ctas": 1,
        "num_stages": 5,
        "kernel_name": "kernel_11f7c317_0d1d2d34567891011"
    },
    {
        "M": 40,
        "N": 512,
        "K": 512,
        "ldtype": "float16",
        "rdtype": "float16",
        "BLOCK_SIZE_M": 32,
        "BLOCK_SIZE_N": 64,
        "BLOCK_SIZE_K": 64,
        "GROUP_SIZE_M": 4,
        "num_warps": 2,
        "num_ctas": 1,
        "num_stages": 5,
        "kernel_name": "kernel_babb08f0_0d1d2d34567891011"
    },
    {
        "M": 44,
        "N": 512,
        "K": 512,
        "ldtype": "float16",
        "rdtype": "float16",
        "BLOCK_SIZE_M": 32,
        "BLOCK_SIZE_N": 64,
        "BLOCK_SIZE_K": 64,
        "GROUP_SIZE_M": 8,
        "num_warps": 2,
        "num_ctas": 1,
        "num_stages": 5,
        "kernel_name": "kernel_11f7c317_0d1d2d34567891011"
    },
    {
        "M": 48,
        "N": 512,
        "K": 512,
        "ldtype": "float16",
        "rdtype": "float16",
        "BLOCK_SIZE_M": 32,
        "BLOCK_SIZE_N": 64,
        "BLOCK_SIZE_K": 64,
        "GROUP_SIZE_M": 16,
        "num_warps": 2,
        "num_ctas": 1,
        "num_stages": 5,
        "kernel_name": "kernel_cf98af0c_0d1d2d34567891011"
    },
    {
        "M": 52,
        "N": 512,
        "K": 512,
        "ldtype": "float16",
        "rdtype": "float16",
        "BLOCK_SIZE_M": 32,
        "BLOCK_SIZE_N": 64,
        "BLOCK_SIZE_K": 64,
        "GROUP_SIZE_M": 8,
        "num_warps": 2,
        "num_ctas": 1,
        "num_stages": 5,
        "kernel_name": "kernel_11f7c317_0d1d2d34567891011"
    },
    {
        "M": 56,
        "N": 512,
        "K": 512,
        "ldtype": "float16",
        "rdtype": "float16",
        "BLOCK_SIZE_M": 32,
        "BLOCK_SIZE_N": 64,
        "BLOCK_SIZE_K": 64,
        "GROUP_SIZE_M": 16,
        "num_warps": 2,
        "num_ctas": 1,
        "num_stages": 5,
        "kernel_name": "kernel_cf98af0c_0d1d2d34567891011"
    },
    {
        "M": 60,
        "N": 512,
        "K": 512,
        "ldtype": "float16",
        "rdtype": "float16",
        "BLOCK_SIZE_M": 32,
        "BLOCK_SIZE_N": 64,
        "BLOCK_SIZE_K": 64,
        "GROUP_SIZE_M": 16,
        "num_warps": 2,
        "num_ctas": 1,
        "num_stages": 5,
        "kernel_name": "kernel_cf98af0c_0d1d2d34567891011"
    },
    {
        "M": 64,
        "N": 512,
        "K": 512,
        "ldtype": "float16",
        "rdtype": "float16",
        "BLOCK_SIZE_M": 32,
        "BLOCK_SIZE_N": 64,
        "BLOCK_SIZE_K": 64,
        "GROUP_SIZE_M": 16,
        "num_warps": 2,
        "num_ctas": 1,
        "num_stages": 5,
        "kernel_name": "kernel_cf98af0c_0d1d2d34567891011"
    },
    {
        "M": 68,
        "N": 512,
        "K": 512,
        "ldtype": "float16",
        "rdtype": "float16",
        "BLOCK_SIZE_M": 32,
        "BLOCK_SIZE_N": 64,
        "BLOCK_SIZE_K": 64,
        "GROUP_SIZE_M": 16,
        "num_warps": 2,
        "num_ctas": 1,
        "num_stages": 5,
        "kernel_name": "kernel_cf98af0c_0d1d2d34567891011"
    },
    {
        "M": 72,
        "N": 512,
        "K": 512,
        "ldtype": "float16",
        "rdtype": "float16",
        "BLOCK_SIZE_M": 32,
        "BLOCK_SIZE_N": 64,
        "BLOCK_SIZE_K": 64,
        "GROUP_SIZE_M": 4,
        "num_warps": 2,
        "num_ctas": 1,
        "num_stages": 5,
        "kernel_name": "kernel_babb08f0_0d1d2d34567891011"
    },
    {
        "M": 76,
        "N": 512,
        "K": 512,
        "ldtype": "float16",
        "rdtype": "float16",
        "BLOCK_SIZE_M": 32,
        "BLOCK_SIZE_N": 64,
        "BLOCK_SIZE_K": 64,
        "GROUP_SIZE_M": 16,
        "num_warps": 2,
        "num_ctas": 1,
        "num_stages": 5,
        "kernel_name": "kernel_cf98af0c_0d1d2d34567891011"
    },
    {
        "M": 80,
        "N": 512,
        "K": 512,
        "ldtype": "float16",
        "rdtype": "float16",
        "BLOCK_SIZE_M": 32,
        "BLOCK_SIZE_N": 64,
        "BLOCK_SIZE_K": 64,
        "GROUP_SIZE_M": 4,
        "num_warps": 2,
        "num_ctas": 1,
        "num_stages": 5,
        "kernel_name": "kernel_babb08f0_0d1d2d34567891011"
    },
    {
        "M": 84,
        "N": 512,
        "K": 512,
        "ldtype": "float16",
        "rdtype": "float16",
        "BLOCK_SIZE_M": 32,
        "BLOCK_SIZE_N": 64,
        "BLOCK_SIZE_K": 64,
        "GROUP_SIZE_M": 16,
        "num_warps": 2,
        "num_ctas": 1,
        "num_stages": 5,
        "kernel_name": "kernel_cf98af0c_0d1d2d34567891011"
    },
    {
        "M": 88,
        "N": 512,
        "K": 512,
        "ldtype": "float16",
        "rdtype": "float16",
        "BLOCK_SIZE_M": 32,
        "BLOCK_SIZE_N": 64,
        "BLOCK_SIZE_K": 64,
        "GROUP_SIZE_M": 8,
        "num_warps": 2,
        "num_ctas": 1,
        "num_stages": 5,
        "kernel_name": "kernel_11f7c317_0d1d2d34567891011"
    },
    {
        "M": 92,
        "N": 512,
        "K": 512,
        "ldtype": "float16",
        "rdtype": "float16",
        "BLOCK_SIZE_M": 32,
        "BLOCK_SIZE_N": 64,
        "BLOCK_SIZE_K": 64,
        "GROUP_SIZE_M": 8,
        "num_warps": 2,
        "num_ctas": 1,
        "num_stages": 5,
        "kernel_name": "kernel_11f7c317_0d1d2d34567891011"
    },
    {
        "M": 96,
        "N": 512,
        "K": 512,
        "ldtype": "float16",
        "rdtype": "float16",
        "BLOCK_SIZE_M": 32,
        "BLOCK_SIZE_N": 64,
        "BLOCK_SIZE_K": 64,
        "GROUP_SIZE_M": 8,
        "num_warps": 2,
        "num_ctas": 1,
        "num_stages": 5,
        "kernel_name": "kernel_11f7c317_0d1d2d34567891011"
    },
    {
        "M": 100,
        "N": 512,
        "K": 512,
        "ldtype": "float16",
        "rdtype": "float16",
        "BLOCK_SIZE_M": 32,
        "BLOCK_SIZE_N": 64,
        "BLOCK_SIZE_K": 64,
        "GROUP_SIZE_M": 16,
        "num_warps": 2,
        "num_ctas": 1,
        "num_stages": 5,
        "kernel_name": "kernel_cf98af0c_0d1d2d34567891011"
    },
    {
        "M": 104,
        "N": 512,
        "K": 512,
        "ldtype": "float16",
        "rdtype": "float16",
        "BLOCK_SIZE_M": 32,
        "BLOCK_SIZE_N": 64,
        "BLOCK_SIZE_K": 64,
        "GROUP_SIZE_M": 16,
        "num_warps": 2,
        "num_ctas": 1,
        "num_stages": 5,
        "kernel_name": "kernel_cf98af0c_0d1d2d34567891011"
    },
    {
        "M": 108,
        "N": 512,
        "K": 512,
        "ldtype": "float16",
        "rdtype": "float16",
        "BLOCK_SIZE_M": 32,
        "BLOCK_SIZE_N": 64,
        "BLOCK_SIZE_K": 64,
        "GROUP_SIZE_M": 16,
        "num_warps": 2,
        "num_ctas": 1,
        "num_stages": 5,
        "kernel_name": "kernel_cf98af0c_0d1d2d34567891011"
    },
    {
        "M": 112,
        "N": 512,
        "K": 512,
        "ldtype": "float16",
        "rdtype": "float16",
        "BLOCK_SIZE_M": 32,
        "BLOCK_SIZE_N": 64,
        "BLOCK_SIZE_K": 64,
        "GROUP_SIZE_M": 8,
        "num_warps": 2,
        "num_ctas": 1,
        "num_stages": 5,
        "kernel_name": "kernel_11f7c317_0d1d2d34567891011"
    },
    {
        "M": 116,
        "N": 512,
        "K": 512,
        "ldtype": "float16",
        "rdtype": "float16",
        "BLOCK_SIZE_M": 32,
        "BLOCK_SIZE_N": 64,
        "BLOCK_SIZE_K": 64,
        "GROUP_SIZE_M": 16,
        "num_warps": 2,
        "num_ctas": 1,
        "num_stages": 5,
        "kernel_name": "kernel_cf98af0c_0d1d2d34567891011"
    },
    {
        "M": 120,
        "N": 512,
        "K": 512,
        "ldtype": "float16",
        "rdtype": "float16",
        "BLOCK_SIZE_M": 32,
        "BLOCK_SIZE_N": 64,
        "BLOCK_SIZE_K": 64,
        "GROUP_SIZE_M": 16,
        "num_warps": 2,
        "num_ctas": 1,
        "num_stages": 5,
        "kernel_name": "kernel_cf98af0c_0d1d2d34567891011"
    },
    {
        "M": 124,
        "N": 512,
        "K": 512,
        "ldtype": "float16",
        "rdtype": "float16",
        "BLOCK_SIZE_M": 32,
        "BLOCK_SIZE_N": 64,
        "BLOCK_SIZE_K": 64,
        "GROUP_SIZE_M": 16,
        "num_warps": 2,
        "num_ctas": 1,
        "num_stages": 5,
        "kernel_name": "kernel_cf98af0c_0d1d2d34567891011"
    },
    {
        "M": 128,
        "N": 512,
        "K": 512,
        "ldtype": "float16",
        "rdtype": "float16",
        "BLOCK_SIZE_M": 32,
        "BLOCK_SIZE_N": 64,
        "BLOCK_SIZE_K": 64,
        "GROUP_SIZE_M": 16,
        "num_warps": 2,
        "num_ctas": 1,
        "num_stages": 4,
        "kernel_name": "kernel_d78a532d_0d1d2d34567891011"
    },
    {
        "M": 132,
        "N": 512,
        "K": 512,
        "ldtype": "float16",
        "rdtype": "float16",
        "BLOCK_SIZE_M": 32,
        "BLOCK_SIZE_N": 64,
        "BLOCK_SIZE_K": 64,
        "GROUP_SIZE_M": 16,
        "num_warps": 2,
        "num_ctas": 1,
        "num_stages": 5,
        "kernel_name": "kernel_cf98af0c_0d1d2d34567891011"
    },
    {
        "M": 136,
        "N": 512,
        "K": 512,
        "ldtype": "float16",
        "rdtype": "float16",
        "BLOCK_SIZE_M": 32,
        "BLOCK_SIZE_N": 64,
        "BLOCK_SIZE_K": 64,
        "GROUP_SIZE_M": 16,
        "num_warps": 2,
        "num_ctas": 1,
        "num_stages": 5,
        "kernel_name": "kernel_cf98af0c_0d1d2d34567891011"
    },
    {
        "M": 140,
        "N": 512,
        "K": 512,
        "ldtype": "float16",
        "rdtype": "float16",
        "BLOCK_SIZE_M": 32,
        "BLOCK_SIZE_N": 64,
        "BLOCK_SIZE_K": 64,
        "GROUP_SIZE_M": 16,
        "num_warps": 2,
        "num_ctas": 1,
        "num_stages": 5,
        "kernel_name": "kernel_cf98af0c_0d1d2d34567891011"
    },
    {
        "M": 144,
        "N": 512,
        "K": 512,
        "ldtype": "float16",
        "rdtype": "float16",
        "BLOCK_SIZE_M": 32,
        "BLOCK_SIZE_N": 64,
        "BLOCK_SIZE_K": 64,
        "GROUP_SIZE_M": 8,
        "num_warps": 2,
        "num_ctas": 1,
        "num_stages": 5,
        "kernel_name": "kernel_11f7c317_0d1d2d34567891011"
    },
    {
        "M": 148,
        "N": 512,
        "K": 512,
        "ldtype": "float16",
        "rdtype": "float16",
        "BLOCK_SIZE_M": 32,
        "BLOCK_SIZE_N": 64,
        "BLOCK_SIZE_K": 64,
        "GROUP_SIZE_M": 16,
        "num_warps": 2,
        "num_ctas": 1,
        "num_stages": 5,
        "kernel_name": "kernel_cf98af0c_0d1d2d34567891011"
    },
    {
        "M": 152,
        "N": 512,
        "K": 512,
        "ldtype": "float16",
        "rdtype": "float16",
        "BLOCK_SIZE_M": 32,
        "BLOCK_SIZE_N": 64,
        "BLOCK_SIZE_K": 64,
        "GROUP_SIZE_M": 8,
        "num_warps": 2,
        "num_ctas": 1,
        "num_stages": 5,
        "kernel_name": "kernel_11f7c317_0d1d2d34567891011"
    },
    {
        "M": 156,
        "N": 512,
        "K": 512,
        "ldtype": "float16",
        "rdtype": "float16",
        "BLOCK_SIZE_M": 32,
        "BLOCK_SIZE_N": 64,
        "BLOCK_SIZE_K": 64,
        "GROUP_SIZE_M": 16,
        "num_warps": 2,
        "num_ctas": 1,
        "num_stages": 5,
        "kernel_name": "kernel_cf98af0c_0d1d2d34567891011"
    },
    {
        "M": 160,
        "N": 512,
        "K": 512,
        "ldtype": "float16",
        "rdtype": "float16",
        "BLOCK_SIZE_M": 32,
        "BLOCK_SIZE_N": 64,
        "BLOCK_SIZE_K": 64,
        "GROUP_SIZE_M": 16,
        "num_warps": 2,
        "num_ctas": 1,
        "num_stages": 5,
        "kernel_name": "kernel_cf98af0c_0d1d2d34567891011"
    },
    {
        "M": 164,
        "N": 512,
        "K": 512,
        "ldtype": "float16",
        "rdtype": "float16",
        "BLOCK_SIZE_M": 32,
        "BLOCK_SIZE_N": 64,
        "BLOCK_SIZE_K": 64,
        "GROUP_SIZE_M": 8,
        "num_warps": 2,
        "num_ctas": 1,
        "num_stages": 5,
        "kernel_name": "kernel_11f7c317_0d1d2d34567891011"
    },
    {
        "M": 168,
        "N": 512,
        "K": 512,
        "ldtype": "float16",
        "rdtype": "float16",
        "BLOCK_SIZE_M": 32,
        "BLOCK_SIZE_N": 64,
        "BLOCK_SIZE_K": 64,
        "GROUP_SIZE_M": 16,
        "num_warps": 2,
        "num_ctas": 1,
        "num_stages": 5,
        "kernel_name": "kernel_cf98af0c_0d1d2d34567891011"
    },
    {
        "M": 172,
        "N": 512,
        "K": 512,
        "ldtype": "float16",
        "rdtype": "float16",
        "BLOCK_SIZE_M": 64,
        "BLOCK_SIZE_N": 64,
        "BLOCK_SIZE_K": 64,
        "GROUP_SIZE_M": 16,
        "num_warps": 2,
        "num_ctas": 1,
        "num_stages": 5,
        "kernel_name": "kernel_4c357593_0d1d2d34567891011"
    },
    {
        "M": 176,
        "N": 512,
        "K": 512,
        "ldtype": "float16",
        "rdtype": "float16",
        "BLOCK_SIZE_M": 32,
        "BLOCK_SIZE_N": 64,
        "BLOCK_SIZE_K": 64,
        "GROUP_SIZE_M": 4,
        "num_warps": 2,
        "num_ctas": 1,
        "num_stages": 5,
        "kernel_name": "kernel_babb08f0_0d1d2d34567891011"
    },
    {
        "M": 180,
        "N": 512,
        "K": 512,
        "ldtype": "float16",
        "rdtype": "float16",
        "BLOCK_SIZE_M": 32,
        "BLOCK_SIZE_N": 64,
        "BLOCK_SIZE_K": 64,
        "GROUP_SIZE_M": 8,
        "num_warps": 2,
        "num_ctas": 1,
        "num_stages": 5,
        "kernel_name": "kernel_11f7c317_0d1d2d34567891011"
    },
    {
        "M": 184,
        "N": 512,
        "K": 512,
        "ldtype": "float16",
        "rdtype": "float16",
        "BLOCK_SIZE_M": 32,
        "BLOCK_SIZE_N": 64,
        "BLOCK_SIZE_K": 64,
        "GROUP_SIZE_M": 16,
        "num_warps": 2,
        "num_ctas": 1,
        "num_stages": 5,
        "kernel_name": "kernel_cf98af0c_0d1d2d34567891011"
    },
    {
        "M": 188,
        "N": 512,
        "K": 512,
        "ldtype": "float16",
        "rdtype": "float16",
        "BLOCK_SIZE_M": 32,
        "BLOCK_SIZE_N": 64,
        "BLOCK_SIZE_K": 64,
        "GROUP_SIZE_M": 8,
        "num_warps": 2,
        "num_ctas": 1,
        "num_stages": 5,
        "kernel_name": "kernel_11f7c317_0d1d2d34567891011"
    },
    {
        "M": 192,
        "N": 512,
        "K": 512,
        "ldtype": "float16",
        "rdtype": "float16",
        "BLOCK_SIZE_M": 32,
        "BLOCK_SIZE_N": 64,
        "BLOCK_SIZE_K": 64,
        "GROUP_SIZE_M": 8,
        "num_warps": 2,
        "num_ctas": 1,
        "num_stages": 5,
        "kernel_name": "kernel_11f7c317_0d1d2d34567891011"
    },
    {
        "M": 196,
        "N": 512,
        "K": 512,
        "ldtype": "float16",
        "rdtype": "float16",
        "BLOCK_SIZE_M": 64,
        "BLOCK_SIZE_N": 64,
        "BLOCK_SIZE_K": 64,
        "GROUP_SIZE_M": 8,
        "num_warps": 2,
        "num_ctas": 1,
        "num_stages": 4,
        "kernel_name": "kernel_5c76303f_0d1d2d34567891011"
    },
    {
        "M": 200,
        "N": 512,
        "K": 512,
        "ldtype": "float16",
        "rdtype": "float16",
        "BLOCK_SIZE_M": 64,
        "BLOCK_SIZE_N": 64,
        "BLOCK_SIZE_K": 64,
        "GROUP_SIZE_M": 4,
        "num_warps": 2,
        "num_ctas": 1,
        "num_stages": 4,
        "kernel_name": "kernel_98bbb594_0d1d2d34567891011"
    },
    {
        "M": 204,
        "N": 512,
        "K": 512,
        "ldtype": "float16",
        "rdtype": "float16",
        "BLOCK_SIZE_M": 64,
        "BLOCK_SIZE_N": 64,
        "BLOCK_SIZE_K": 64,
        "GROUP_SIZE_M": 4,
        "num_warps": 2,
        "num_ctas": 1,
        "num_stages": 4,
        "kernel_name": "kernel_98bbb594_0d1d2d34567891011"
    },
    {
        "M": 208,
        "N": 512,
        "K": 512,
        "ldtype": "float16",
        "rdtype": "float16",
        "BLOCK_SIZE_M": 64,
        "BLOCK_SIZE_N": 64,
        "BLOCK_SIZE_K": 64,
        "GROUP_SIZE_M": 4,
        "num_warps": 2,
        "num_ctas": 1,
        "num_stages": 4,
        "kernel_name": "kernel_98bbb594_0d1d2d34567891011"
    },
    {
        "M": 212,
        "N": 512,
        "K": 512,
        "ldtype": "float16",
        "rdtype": "float16",
        "BLOCK_SIZE_M": 64,
        "BLOCK_SIZE_N": 64,
        "BLOCK_SIZE_K": 64,
        "GROUP_SIZE_M": 8,
        "num_warps": 2,
        "num_ctas": 1,
        "num_stages": 4,
        "kernel_name": "kernel_5c76303f_0d1d2d34567891011"
    },
    {
        "M": 216,
        "N": 512,
        "K": 512,
        "ldtype": "float16",
        "rdtype": "float16",
        "BLOCK_SIZE_M": 64,
        "BLOCK_SIZE_N": 64,
        "BLOCK_SIZE_K": 64,
        "GROUP_SIZE_M": 4,
        "num_warps": 2,
        "num_ctas": 1,
        "num_stages": 4,
        "kernel_name": "kernel_98bbb594_0d1d2d34567891011"
    },
    {
        "M": 220,
        "N": 512,
        "K": 512,
        "ldtype": "float16",
        "rdtype": "float16",
        "BLOCK_SIZE_M": 64,
        "BLOCK_SIZE_N": 64,
        "BLOCK_SIZE_K": 64,
        "GROUP_SIZE_M": 8,
        "num_warps": 2,
        "num_ctas": 1,
        "num_stages": 4,
        "kernel_name": "kernel_5c76303f_0d1d2d34567891011"
    },
    {
        "M": 224,
        "N": 512,
        "K": 512,
        "ldtype": "float16",
        "rdtype": "float16",
        "BLOCK_SIZE_M": 64,
        "BLOCK_SIZE_N": 64,
        "BLOCK_SIZE_K": 64,
        "GROUP_SIZE_M": 8,
        "num_warps": 2,
        "num_ctas": 1,
        "num_stages": 4,
        "kernel_name": "kernel_5c76303f_0d1d2d34567891011"
    },
    {
        "M": 228,
        "N": 512,
        "K": 512,
        "ldtype": "float16",
        "rdtype": "float16",
        "BLOCK_SIZE_M": 64,
        "BLOCK_SIZE_N": 64,
        "BLOCK_SIZE_K": 64,
        "GROUP_SIZE_M": 4,
        "num_warps": 2,
        "num_ctas": 1,
        "num_stages": 4,
        "kernel_name": "kernel_98bbb594_0d1d2d34567891011"
    },
    {
        "M": 232,
        "N": 512,
        "K": 512,
        "ldtype": "float16",
        "rdtype": "float16",
        "BLOCK_SIZE_M": 64,
        "BLOCK_SIZE_N": 128,
        "BLOCK_SIZE_K": 32,
        "GROUP_SIZE_M": 16,
        "num_warps": 4,
        "num_ctas": 1,
        "num_stages": 5,
        "kernel_name": "kernel_4b3dbaf2_0d1d2d34567891011"
    },
    {
        "M": 236,
        "N": 512,
        "K": 512,
        "ldtype": "float16",
        "rdtype": "float16",
        "BLOCK_SIZE_M": 64,
        "BLOCK_SIZE_N": 64,
        "BLOCK_SIZE_K": 64,
        "GROUP_SIZE_M": 4,
        "num_warps": 2,
        "num_ctas": 1,
        "num_stages": 4,
        "kernel_name": "kernel_98bbb594_0d1d2d34567891011"
    },
    {
        "M": 240,
        "N": 512,
        "K": 512,
        "ldtype": "float16",
        "rdtype": "float16",
        "BLOCK_SIZE_M": 64,
        "BLOCK_SIZE_N": 64,
        "BLOCK_SIZE_K": 64,
        "GROUP_SIZE_M": 8,
        "num_warps": 2,
        "num_ctas": 1,
        "num_stages": 4,
        "kernel_name": "kernel_5c76303f_0d1d2d34567891011"
    },
    {
        "M": 244,
        "N": 512,
        "K": 512,
        "ldtype": "float16",
        "rdtype": "float16",
        "BLOCK_SIZE_M": 64,
        "BLOCK_SIZE_N": 64,
        "BLOCK_SIZE_K": 64,
        "GROUP_SIZE_M": 4,
        "num_warps": 2,
        "num_ctas": 1,
        "num_stages": 4,
        "kernel_name": "kernel_98bbb594_0d1d2d34567891011"
    },
    {
        "M": 248,
        "N": 512,
        "K": 512,
        "ldtype": "float16",
        "rdtype": "float16",
        "BLOCK_SIZE_M": 64,
        "BLOCK_SIZE_N": 64,
        "BLOCK_SIZE_K": 64,
        "GROUP_SIZE_M": 16,
        "num_warps": 2,
        "num_ctas": 1,
        "num_stages": 4,
        "kernel_name": "kernel_8c21baee_0d1d2d34567891011"
    },
    {
        "M": 252,
        "N": 512,
        "K": 512,
        "ldtype": "float16",
        "rdtype": "float16",
        "BLOCK_SIZE_M": 64,
        "BLOCK_SIZE_N": 64,
        "BLOCK_SIZE_K": 64,
        "GROUP_SIZE_M": 4,
        "num_warps": 2,
        "num_ctas": 1,
        "num_stages": 4,
        "kernel_name": "kernel_98bbb594_0d1d2d34567891011"
    }
]